Sheet: Summary
B1: Summary: Deaths (thousands) by cause
F3: Year | G3: 2012 | I3: 2000
G4: GLOBAL | I4: GLOBAL
B5: Population (thousands) | G5: =Global2012!R[2]C -> 7075456 | I5: =Global2000!R[2]C[-2] -> 6123850
A6: GHE 2012 code | B6: GHE 2012 cause category | G6: Deaths (000s) | H6: % total | I6: Deaths (000s) | J6: % total
A7: 0 | C7: All Causes | G7: =Global2012!R[3]C/1000 -> 55858.719400000009 | H7: =100*RC[-1]/R7C[-1] -> 100.00000000000001 | I7: =Global2000!R[3]C[-2]/1000 -> 52806.017400000004 | J7: =100*RC[-1]/R7C[-1] -> 100
A8: 1 | B8: I. | C8: Communicable, maternal, perinatal and nutritional conditions | G8: =Global2012!R[3]C/1000 -> 12822.156599999998 | H8: =100*RC[-1]/R7C[-1] -> 22.95461968646563 | I8: =Global2000!R[3]C[-2]/1000 -> 16310.155000000001 | J8: =100*RC[-1]/R7C[-1] -> 30.88692501926873
A9: 2 | C9: A. | D9: Infectious and parasitic diseases | G9: =Global2012!R[3]C/1000 -> 6431.0714000000007 | H9: =100*RC[-1]/R7C[-1] -> 11.513102106669493 | I9: =Global2000!R[3]C[-2]/1000 -> 8645.4894999999997 | J9: =100*RC[-1]/R7C[-1] -> 16.372167275012107
A10: 3 | D10: 1. | E10: Tuberculosis | G10: =Global2012!R[3]C/1000 -> 934.87940000000003 | H10: =100*RC[-1]/R7C[-1] -> 1.6736498975305902 | I10: =Global2000!R[3]C[-2]/1000 -> 1343.0841 | J10: =100*RC[-1]/R7C[-1] -> 2.5434300220489643
A11: 4 | D11: 2. | E11: STDs excluding HIV | G11: =Global2012!R[3]C/1000 -> 84.273699999999977 | H11: =100*RC[-1]/R7C[-1] -> 0.15086937349301272 | I11: =Global2000!R[3]C[-2]/1000 -> 130.51069999999999 | J11: =100*RC[-1]/R7C[-1] -> 0.24715118925064014
A12: 5 | E12: a. | F12: Syphilis | G12: =Global2012!R[3]C/1000 -> 78.911200000000008 | H12: =100*RC[-1]/R7C[-1] -> 0.14126926082018271 | I12: =Global2000!R[3]C[-2]/1000 -> 124.75760000000001 | J12: =100*RC[-1]/R7C[-1] -> 0.23625640815699916
A13: 6 | E13: b. | F13: Chlamydia | G13: =Global2012!R[3]C/1000 -> 1.0763000000000003 | H13: =100*RC[-1]/R7C[-1] -> 1.9268254116115667E-3 | I13: =Global2000!R[3]C[-2]/1000 -> 1.1694 | J13: =100*RC[-1]/R7C[-1] -> 2.2145203474481299E-3
A14: 7 | E14: c. | F14: Gonorrhoea | G14: =Global2012!R[3]C/1000 -> 0.79570000000000007 | H14: =100*RC[-1]/R7C[-1] -> 1.4244866487218466E-3 | I14: =Global2000!R[3]C[-2]/1000 -> 0.88359999999999994 | J14: =100*RC[-1]/R7C[-1] -> 1.6732941499958676E-3
A15: 8 | E15: d. | F15: Trichomoniasis | G15: =Global2012!R[3]C/1000 -> 0 | H15: =100*RC[-1]/R7C[-1] -> 0 | I15: =Global2000!R[3]C[-2]/1000 -> 0 | J15: =100*RC[-1]/R7C[-1] -> 0
A16: 9 | E16: e. | F16: Other STDs | G16: =Global2012!R[3]C/1000 -> 3.4907000000000004 | H16: =100*RC[-1]/R7C[-1] -> 6.2491586586569687E-3 | I16: =Global2000!R[3]C[-2]/1000 -> 3.7004999999999999 | J16: =100*RC[-1]/R7C[-1] -> 7.0077240856266506E-3
A17: 10 | D17: 3. | E17: HIV/AIDS | G17: =Global2012!R[3]C/1000 -> 1533.7603999999999 | H17: =100*RC[-1]/R7C[-1] -> 2.7457851101398498 | I17: =Global2000!R[3]C[-2]/1000 -> 1678.2156 | J17: =100*RC[-1]/R7C[-1] -> 3.178076443992536
A18: 11 | D18: 4. | E18: Diarrhoeal diseases | G18: =Global2012!R[3]C/1000 -> 1497.7235000000001 | H18: =100*RC[-1]/R7C[-1] -> 2.6812707417707107 | I18: =Global2000!R[3]C[-2]/1000 -> 2171.2474999999999 | J18: =100*RC[-1]/R7C[-1] -> 4.1117425757618298
A19: 12 | D19: 5. | E19: Childhood-cluster diseases | G19: =Global2012!R[3]C/1000 -> 266.26499999999999 | H19: =100*RC[-1]/R7C[-1] -> 0.47667580435078855 | I19: =Global2000!R[3]C[-2]/1000 -> 867.10410000000002 | J19: =100*RC[-1]/R7C[-1] -> 1.6420554752913443
A20: 13 | E20: a. | F20: Whooping cough | G20: =Global2012!R[3]C/1000 -> 67.059100000000001 | H20: =100*RC[-1]/R7C[-1] -> 0.12005126633819677 | I20: =Global2000!R[3]C[-2]/1000 -> 68.752300000000005 | J20: =100*RC[-1]/R7C[-1] -> 0.13019785127745687
A21: 14 | E21: b. | F21: Diphtheria | G21: =Global2012!R[3]C/1000 -> 2.6153000000000004 | H21: =100*RC[-1]/R7C[-1] -> 4.6819906150587474E-3 | I21: =Global2000!R[3]C[-2]/1000 -> 5.7643999999999993 | J21: =100*RC[-1]/R7C[-1] -> 1.0916180170027363E-2
A22: 15 | E22: c. | F22: Measles | G22: =Global2012!R[3]C/1000 -> 130.46120000000002 | H22: =100*RC[-1]/R7C[-1] -> 0.2335556586354538 | I22: =Global2000!R[3]C[-2]/1000 -> 620.93780000000004 | J22: =100*RC[-1]/R7C[-1] -> 1.1758845498543504
A23: 16 | E23: d. | F23: Tetanus | G23: =Global2012!R[3]C/1000 -> 66.12939999999999 | H23: =100*RC[-1]/R7C[-1] -> 0.11838688876207924 | I23: =Global2000!R[3]C[-2]/1000 -> 171.64939999999999 | J23: =100*RC[-1]/R7C[-1] -> 0.32505651524479479
A24: 17 | D24: 6. | E24: Meningitis | G24: =Global2012!R[3]C/1000 -> 395.23020000000002 | H24: =100*RC[-1]/R7C[-1] -> 0.70755327770725795 | I24: =Global2000!R[3]C[-2]/1000 -> 512.08510000000012 | J24: =100*RC[-1]/R7C[-1] -> 0.96974762576963447
A25: 18 | D25: 7. | E25: Encephalitis | G25: =Global2012!R[3]C/1000 -> 77.868599999999986 | H25: =100*RC[-1]/R7C[-1] -> 0.13940276618658032 | I25: =Global2000!R[3]C[-2]/1000 -> 109.0265 | J25: =100*RC[-1]/R7C[-1] -> 0.20646605324187919
A26: 19 | D26: 8. | E26: Acute hepatitis B | G26: =Global2012!R[3]C/1000 -> 149.16389999999998 | H26: =100*RC[-1]/R7C[-1] -> 0.26703780824592255 | I26: =Global2000!R[3]C[-2]/1000 -> 123.7342 | J26: =100*RC[-1]/R7C[-1] -> 0.23431837145135659
A27: 20 | D27: 9. | E27: Acute hepatitis C | G27: =Global2012!R[3]C/1000 -> 38.914199999999994 | H27: =100*RC[-1]/R7C[-1] -> 6.9665399454180807E-2 | I27: =Global2000!R[3]C[-2]/1000 -> 23.053000000000001 | J27: =100*RC[-1]/R7C[-1] -> 4.3656009551669012E-2
A28: 21 | D28: 10. | E28: Parasitic and vector diseases | G28: =Global2012!R[3]C/1000 -> 786.18189999999993 | H28: =100*RC[-1]/R7C[-1] -> 1.4074470529304683 | I28: =Global2000!R[3]C[-2]/1000 -> 1109.2370000000001 | J28: =100*RC[-1]/R7C[-1] -> 2.1005882560649236
A29: 22 | E29: a. | F29: Malaria | G29: =Global2012!R[3]C/1000 -> 618.24789999999996 | H29: =100*RC[-1]/R7C[-1] -> 1.1068064335180585 | I29: =Global2000!R[3]C[-2]/1000 -> 875.06219999999996 | J29: =100*RC[-1]/R7C[-1] -> 1.6571259168656789
A30: 23 | E30: b. | F30: Trypanosomiasis | G30: =Global2012!R[3]C/1000 -> 17.970500000000001 | H30: =100*RC[-1]/R7C[-1] -> 3.2171342617639744E-2 | I30: =Global2000!R[3]C[-2]/1000 -> 53.163799999999995 | J30: =100*RC[-1]/R7C[-1] -> 0.10067754134399082
A31: 24 | E31: c. | F31: Chagas disease | G31: =Global2012!R[3]C/1000 -> 7.805699999999999 | H31: =100*RC[-1]/R7C[-1] -> 1.3974004566957542E-2 | I31: =Global2000!R[3]C[-2]/1000 -> 8.7580999999999989 | J31: =100*RC[-1]/R7C[-1] -> 1.658542043354324E-2
A32: 25 | E32: d. | F32: Schistosomiasis | G32: =Global2012!R[3]C/1000 -> 21.797000000000001 | H32: =100*RC[-1]/R7C[-1] -> 3.902166077942703E-2 | I32: =Global2000!R[3]C[-2]/1000 -> 22.611099999999997 | J32: =100*RC[-1]/R7C[-1] -> 4.2819173104313664E-2
A33: 26 | E33: e. | F33: Leishmaniasis | G33: =Global2012!R[3]C/1000 -> 48.403800000000004 | H33: =100*RC[-1]/R7C[-1] -> 8.6653973667717113E-2 | I33: =Global2000!R[3]C[-2]/1000 -> 69.511299999999991 | J33: =100*RC[-1]/R7C[-1] -> 0.13163518747013098
A34: 27 | E34: f. | F34: Lymphatic filariasis | G34: =Global2012!R[3]C/1000 -> 1.1000000000000001E-3 | H34: =100*RC[-1]/R7C[-1] -> 1.9692538816061722E-6 | I34: =Global2000!R[3]C[-2]/1000 -> 1.4E-3 | J34: =100*RC[-1]/R7C[-1] -> 2.6512130036150005E-6
A35: 28 | E35: g. | F35: Onchocerciasis | G35: =Global2012!R[3]C/1000 -> 8.0000000000000004E-4 | H35: =100*RC[-1]/R7C[-1] -> 1.4321846411681251E-6 | I35: =Global2000!R[3]C[-2]/1000 -> 1.6999999999999999E-3 | J35: =100*RC[-1]/R7C[-1] -> 3.219330075818215E-6
A36: 29 | E36: h. | F36: Leprosy | G36: =Global2012!R[3]C/1000 -> 7.7896000000000001 | H36: =100*RC[-1]/R7C[-1] -> 1.3945181851054034E-2 | I36: =Global2000!R[3]C[-2]/1000 -> 6.7676000000000007 | J36: =100*RC[-1]/R7C[-1] -> 1.2815963659474915E-2
A37: 30 | E37: i. | F37: Dengue | G37: =Global2012!R[3]C/1000 -> 28.754999999999999 | H37: =100*RC[-1]/R7C[-1] -> 5.1478086695986795E-2 | I37: =Global2000!R[3]C[-2]/1000 -> 17.619699999999998 | J37: =100*RC[-1]/R7C[-1] -> 3.3366841256996585E-2
A38: 31 | E38: j. | F38: Trachoma | G38: =Global2012!R[3]C/1000 -> 4.0000000000000002E-4 | H38: =100*RC[-1]/R7C[-1] -> 7.1609232058406257E-7 | I38: =Global2000!R[3]C[-2]/1000 -> 0 | J38: =100*RC[-1]/R7C[-1] -> 0
A39: 32 | E39: k. | F39: Rabies | G39: =Global2012!R[3]C/1000 -> 35.409999999999997 | H39: =100*RC[-1]/R7C[-1] -> 6.3392072679704134E-2 | I39: =Global2000!R[3]C[-2]/1000 -> 55.739899999999999 | J39: =100*RC[-1]/R7C[-1] -> 0.10555596264299984
A40: 33 | D40: 11. | E40: Intestinal nematode infections | G40: =Global2012!R[3]C/1000 -> 3.3037000000000001 | H40: =100*RC[-1]/R7C[-1] -> 5.914385498783919E-3 | I40: =Global2000!R[3]C[-2]/1000 -> 3.1305000000000001 | J40: =100*RC[-1]/R7C[-1] -> 5.928301648440543E-3
A41: 34 | E41: a. | F41: Ascariasis | G41: =Global2012!R[3]C/1000 -> 3.3021000000000003 | H41: =100*RC[-1]/R7C[-1] -> 5.9115211295015825E-3 | I41: =Global2000!R[3]C[-2]/1000 -> 3.1241999999999996 | J41: =100*RC[-1]/R7C[-1] -> 5.9163711899242744E-3
A42: 35 | E42: b. | F42: Trichuriasis | G42: =Global2012!R[3]C/1000 -> 0 | H42: =100*RC[-1]/R7C[-1] -> 0 | I42: =Global2000!R[3]C[-2]/1000 -> 0 | J42: =100*RC[-1]/R7C[-1] -> 0
A43: 36 | E43: c. | F43: Hookworm disease | G43: =Global2012!R[3]C/1000 -> 1.6999999999999999E-3 | H43: =100*RC[-1]/R7C[-1] -> 3.0433923624822654E-6 | I43: =Global2000!R[3]C[-2]/1000 -> 6.3E-3 | J43: =100*RC[-1]/R7C[-1] -> 1.1930458516267503E-5
A44: 37 | D44: 12. | E44: Other infectious diseases | G44: =Global2012!R[3]C/1000 -> 663.5073000000001 | H44: =100*RC[-1]/R7C[-1] -> 1.1878312054536646 | I44: =Global2000!R[3]C[-2]/1000 -> 575.06100000000004 | J44: =100*RC[-1]/R7C[-1] -> 1.0890065721941757
A45: 38 | C45: B. | D45: Respiratory infections | G45: =Global2012!R[3]C/1000 -> 3060.8365999999996 | H45: =100*RC[-1]/R7C[-1] -> 5.47960395955658 | I45: =Global2000!R[3]C[-2]/1000 -> 3502.4884999999999 | J45: =100*RC[-1]/R7C[-1] -> 6.632745040151427
A46: 39 | D46: 1. | E46: Lower respiratory infections | G46: =Global2012!R[3]C/1000 -> 3051.9881000000005 | H46: =100*RC[-1]/R7C[-1] -> 5.4637631023098612 | I46: =Global2000!R[3]C[-2]/1000 -> 3490.5682999999999 | J46: =100*RC[-1]/R7C[-1] -> 6.6101714764045054
A47: 40 | D47: 2. | E47: Upper respiratory infections | G47: =Global2012!R[3]C/1000 -> 6.0381999999999998 | H47: =100*RC[-1]/R7C[-1] -> 1.0809771625376715E-2 | I47: =Global2000!R[3]C[-2]/1000 -> 8.5023999999999997 | J47: =100*RC[-1]/R7C[-1] -> 1.6101195315668702E-2
A48: 41 | D48: 3. | E48: Otitis media | G48: =Global2012!R[3]C/1000 -> 2.8096999999999999 | H48: =100*RC[-1]/R7C[-1] -> 5.0300114828626006E-3 | I48: =Global2000!R[3]C[-2]/1000 -> 3.4178999999999999 | J48: =100*RC[-1]/R7C[-1] -> 6.4725578036112221E-3
A49: 42 | C49: C. | D49: Maternal conditions | G49: =Global2012!R[3]C/1000 -> 296.00170000000008 | H49: =100*RC[-1]/R7C[-1] -> 0.52991136062456889 | I49: =Global2000!R[3]C[-2]/1000 -> 427.26429999999999 | J49: =100*RC[-1]/R7C[-1] -> 0.80912047724318625
A50: 49 | C50: D. | D50: Neonatal conditions | G50: =Global2012!R[3]C/1000 -> 2475.0747000000001 | H50: =100*RC[-1]/R7C[-1] -> 4.4309549638547558 | I50: =Global2000!R[3]C[-2]/1000 -> 3096.9975999999997 | J50: =100*RC[-1]/R7C[-1] -> 5.8648573637746049
A51: 50 | D51: 1. | E51: Preterm birth complications | G51: =Global2012!R[3]C/1000 -> 1134.9537999999998 | H51: =100*RC[-1]/R7C[-1] -> 2.0318292509942495 | I51: =Global2000!R[3]C[-2]/1000 -> 1316.1043999999999 | J51: =100*RC[-1]/R7C[-1] -> 2.4923379281392273
A52: 51 | D52: 2. | E52: Birth asphyxia and birth trauma | G52: =Global2012!R[3]C/1000 -> 743.90839999999992 | H52: =100*RC[-1]/R7C[-1] -> 1.3317677311449425 | I52: =Global2000!R[3]C[-2]/1000 -> 1045.3739999999998 | J52: =100*RC[-1]/R7C[-1] -> 1.9796493874578767
A53: 52 | D53: 3. | E53: Neonatal sepsis and infections | G53: =Global2012!R[3]C/1000 -> 431.06740000000002 | H53: =100*RC[-1]/R7C[-1] -> 0.77171013698534585 | I53: =Global2000!R[3]C[-2]/1000 -> 544.38880000000006 | J53: =100*RC[-1]/R7C[-1] -> 1.0309219039874042
A54: 53 | D54: 4. | E54: Other neonatal conditions | G54: =Global2012!R[3]C/1000 -> 165.14540000000002 | H54: =100*RC[-1]/R7C[-1] -> 0.29564838179945813 | I54: =Global2000!R[3]C[-2]/1000 -> 191.13 | J54: =100*RC[-1]/R7C[-1] -> 0.36194738670066789
A55: 54 | C55: E. | D55: Nutritional deficiencies | G55: =Global2012!R[3]C/1000 -> 559.17239999999993 | H55: =100*RC[-1]/R7C[-1] -> 1.001047653806399 | I55: =Global2000!R[3]C[-2]/1000 -> 637.91559999999993 | J55: =100*RC[-1]/R7C[-1] -> 1.2080358099491892
A56: 55 | D56: 1. | E56: Protein-energy malnutrition | G56: =Global2012!R[3]C/1000 -> 456.50759999999997 | H56: =100*RC[-1]/R7C[-1] -> 0.81725396662065242 | I56: =Global2000!R[3]C[-2]/1000 -> 552.59669999999994 | J56: =100*RC[-1]/R7C[-1] -> 1.0464653977105265
A57: 56 | D57: 2. | E57: Iodine deficiency | G57: =Global2012!R[3]C/1000 -> 3.2456000000000005 | H57: =100*RC[-1]/R7C[-1] -> 5.8103730892190841E-3 | I57: =Global2000!R[3]C[-2]/1000 -> 1.2390999999999999 | J57: =100*RC[-1]/R7C[-1] -> 2.3465128805566764E-3
A58: 57 | D58: 3. | E58: Vitamin A deficiency | G58: =Global2012!R[3]C/1000 -> 0.12119999999999999 | H58: =100*RC[-1]/R7C[-1] -> 2.1697597313697094E-4 | I58: =Global2000!R[3]C[-2]/1000 -> 8.5000000000000006E-3 | J58: =100*RC[-1]/R7C[-1] -> 1.6096650379091077E-5
A59: 58 | D59: 4. | E59: Iron-deficiency anaemia | G59: =Global2012!R[3]C/1000 -> 90.160200000000003 | H59: =100*RC[-1]/R7C[-1] -> 0.161407567105808 | I59: =Global2000!R[3]C[-2]/1000 -> 76.725399999999993 | J59: =100*RC[-1]/R7C[-1] -> 0.14529669870540168
A60: 59 | D60: 5. | E60: Other nutritional deficiencies | G60: =Global2012!R[3]C/1000 -> 9.1380999999999997 | H60: =100*RC[-1]/R7C[-1] -> 1.6359308086823055E-2 | I60: =Global2000!R[3]C[-2]/1000 -> 7.3462000000000005 | J60: =100*RC[-1]/R7C[-1] -> 1.3911672119397513E-2
A61: 60 | B61: II. | C61: Noncommunicable diseases | G61: =Global2012!R[3]C/1000 -> 37892.226999999999 | H61: =100*RC[-1]/R7C[-1] -> 67.83583191132017 | I61: =Global2000!R[3]C[-2]/1000 -> 31469.737100000002 | J61: =100*RC[-1]/R7C[-1] -> 59.594983014189594
A62: 61 | C62: A. | D62: Malignant neoplasms | G62: =Global2012!R[3]C/1000 -> 8206.2160000000003 | H62: =100*RC[-1]/R7C[-1] -> 14.69102064663516 | I62: =Global2000!R[3]C[-2]/1000 -> 6413.0086000000001 | J62: =100*RC[-1]/R7C[-1] -> 12.14446556615345
A63: 62 | D63: 1. | E63: Mouth and oropharynx cancers | G63: =Global2012!R[3]C/1000 -> 298.02729999999997 | H63: =100*RC[-1]/R7C[-1] -> 0.53353765213600635 | I63: =Global2000!R[3]C[-2]/1000 -> 223.9495 | J63: =100*RC[-1]/R7C[-1] -> 0.42409844753791259
A64: 63 | D64: 2. | E64: Oesophagus cancer | G64: =Global2012!R[3]C/1000 -> 405.80270000000002 | H64: =100*RC[-1]/R7C[-1] -> 0.72648049285569549 | I64: =Global2000!R[3]C[-2]/1000 -> 334.23680000000007 | J64: =100*RC[-1]/R7C[-1] -> 0.63295210746190467
A65: 64 | D65: 3. | E65: Stomach cancer | G65: =Global2012!R[3]C/1000 -> 733.49940000000004 | H65: =100*RC[-1]/R7C[-1] -> 1.3131332187325437 | I65: =Global2000!R[3]C[-2]/1000 -> 670.9819 | J65: =100*RC[-1]/R7C[-1] -> 1.2706542417645001
A66: 65 | D66: 4. | E66: Colon and rectum cancers | G66: =Global2012!R[3]C/1000 -> 723.91269999999997 | H66: =100*RC[-1]/R7C[-1] -> 1.2959708131081857 | I66: =Global2000!R[3]C[-2]/1000 -> 564.44830000000002 | J66: =100*RC[-1]/R7C[-1] -> 1.0689090520202722
A67: 66 | D67: 5. | E67: Liver cancer | G67: =Global2012!R[3]C/1000 -> 740.37290000000007 | H67: =100*RC[-1]/R7C[-1] -> 1.3254383701463803 | I67: =Global2000!R[3]C[-2]/1000 -> 552.20689999999991 | J67: =100*RC[-1]/R7C[-1] -> 1.0457272242613771
A68: 67 | D68: 6. | E68: Pancreas cancer | G68: =Global2012!R[3]C/1000 -> 331.91840000000002 | H68: =100*RC[-1]/R7C[-1] -> 0.59421054325137279 | I68: =Global2000!R[3]C[-2]/1000 -> 228.65799999999999 | J68: =100*RC[-1]/R7C[-1] -> 0.43301504498614202
A69: 68 | D69: 7. | E69: Trachea, bronchus, lung cancers | G69: =Global2012!R[3]C/1000 -> 1599.557 | H69: =100*RC[-1]/R7C[-1] -> 2.8635762100912037 | I69: =Global2000!R[3]C[-2]/1000 -> 1164.4284 | J69: =100*RC[-1]/R7C[-1] -> 2.2051055113275781
A70: 69 | D70: 8. | E70: Melanoma and other skin cancers | G70: =Global2012!R[3]C/1000 -> 94.972700000000003 | H70: =100*RC[-1]/R7C[-1] -> 0.170023052837835 | I70: =Global2000!R[3]C[-2]/1000 -> 66.579399999999993 | J70: =100*RC[-1]/R7C[-1] -> 0.12608297932348897
A71: 70 | D71: 9. | E71: Breast cancer | G71: =Global2012!R[3]C/1000 -> 536.52139999999997 | H71: =100*RC[-1]/R7C[-1] -> 0.96049713592252517 | I71: =Global2000!R[3]C[-2]/1000 -> 435.49299999999999 | J71: =100*RC[-1]/R7C[-1] -> 0.82470336041664827
A72: 71 | D72: 10. | E72: Cervix uteri cancer | G72: =Global2012!R[3]C/1000 -> 264.22489999999999 | H72: =100*RC[-1]/R7C[-1] -> 0.47302355449272965 | I72: =Global2000!R[3]C[-2]/1000 -> 226.51540000000003 | J72: =100*RC[-1]/R7C[-1] -> 0.42895755285646675
A73: 72 | D73: 11. | E73: Corpus uteri cancer | G73: =Global2012!R[3]C/1000 -> 78.669899999999998 | H73: =100*RC[-1]/R7C[-1] -> 0.14083727812779034 | I73: =Global2000!R[3]C[-2]/1000 -> 63.5548 | J73: =100*RC[-1]/R7C[-1] -> 0.12035522300153617
A74: 73 | D74: 12. | E74: Ovary cancer | G74: =Global2012!R[3]C/1000 -> 151.0393 | H74: =100*RC[-1]/R7C[-1] -> 0.27039520709098097 | I74: =Global2000!R[3]C[-2]/1000 -> 121.12439999999999 | J74: =100*RC[-1]/R7C[-1] -> 0.22937613166790338
A75: 74 | D75: 13. | E75: Prostate cancer | G75: =Global2012!R[3]C/1000 -> 321.72829999999999 | H75: =100*RC[-1]/R7C[-1] -> 0.57596791236141354 | I75: =Global2000!R[3]C[-2]/1000 -> 237.94989999999999 | J75: =100*RC[-1]/R7C[-1] -> 0.45061133506349216
A76: 75 | D76: 14. | E76: Bladder cancer | G76: =Global2012!R[3]C/1000 -> 172.8133 | H76: =100*RC[-1]/R7C[-1] -> 0.30937569256197439 | I76: =Global2000!R[3]C[-2]/1000 -> 135.26579999999998 | J76: =100*RC[-1]/R7C[-1] -> 0.2561560342174185
A77: 76 | D77: 15. | E77: Lymphomas, multiple myeloma | G77: =Global2012!R[3]C/1000 -> 312.3021 | H77: =100*RC[-1]/R7C[-1] -> 0.55909283878068983 | I77: =Global2000!R[3]C[-2]/1000 -> 258.31349999999998 | J77: =100*RC[-1]/R7C[-1] -> 0.48917436443521672
A78: 77 | D78: 16. | E78: Leukaemia | G78: =Global2012!R[3]C/1000 -> 276.09730000000002 | H78: =100*RC[-1]/R7C[-1] -> 0.49427789065998529 | I78: =Global2000!R[3]C[-2]/1000 -> 242.82619999999997 | J78: =100*RC[-1]/R7C[-1] -> 0.45984569932744052
A79: 78 | E79: Other malignant neoplasms | G79: =Global2012!R[3]C/1000 -> 1164.7561000000001 | H79: =100*RC[-1]/R7C[-1] -> 2.0851822464086061 | I79: =Global2000!R[3]C[-2]/1000 -> 886.47640000000001 | J79: =100*RC[-1]/R7C[-1] -> 1.678741256484152
A80: 79 | C80: B. | D80: Other neoplasms | G80: =Global2012!R[3]C/1000 -> 193.02459999999996 | H80: =100*RC[-1]/R7C[-1] -> 0.34555858435952602 | I80: =Global2000!R[3]C[-2]/1000 -> 144.34909999999996 | J80: =100*RC[-1]/R7C[-1] -> 0.27335729355722999
A81: 80 | C81: C. | D81: Diabetes mellitus | G81: =Global2012!R[3]C/1000 -> 1497.3708000000001 | H81: =100*RC[-1]/R7C[-1] -> 2.6806393273670359 | I81: =Global2000!R[3]C[-2]/1000 -> 1045.7552000000001 | J81: =100*RC[-1]/R7C[-1] -> 1.9803712748842899
A82: 81 | C82: D. | D82: Endocrine, blood, immune disorders | G82: =Global2012!R[3]C/1000 -> 410.51820000000004 | H82: =100*RC[-1]/R7C[-1] -> 0.73492232619998088 | I82: =Global2000!R[3]C[-2]/1000 -> 283.38209999999998 | J82: =100*RC[-1]/R7C[-1] -> 0.53664736322266171
A83: 82 | C83: E. | D83: Mental and behavioral disorders | G83: =Global2012!R[3]C/1000 -> 257.33859999999999 | H83: =100*RC[-1]/R7C[-1] -> 0.46069548812463451 | I83: =Global2000!R[3]C[-2]/1000 -> 200.36490000000003 | J83: =100*RC[-1]/R7C[-1] -> 0.37943573453429957
A84: 83 | D84: 1. | E84: Unipolar depressive disorders | G84: =Global2012!R[3]C/1000 -> 4.3203999999999994 | H84: =100*RC[-1]/R7C[-1] -> 7.7345131546284586E-3 | I84: =Global2000!R[3]C[-2]/1000 -> 3.2326999999999999 | J84: =100*RC[-1]/R7C[-1] -> 6.1218401977044369E-3
A85: 84 | D85: 2. | E85: Bipolar disorder | G85: =Global2012!R[3]C/1000 -> 0.73840000000000006 | H85: =100*RC[-1]/R7C[-1] -> 1.3219064237981796E-3 | I85: =Global2000!R[3]C[-2]/1000 -> 0.3846 | J85: =100*RC[-1]/R7C[-1] -> 7.2832608656452091E-4
A86: 85 | D86: 3. | E86: Schizophrenia | G86: =Global2012!R[3]C/1000 -> 21.102 | H86: =100*RC[-1]/R7C[-1] -> 3.7777450372412216E-2 | I86: =Global2000!R[3]C[-2]/1000 -> 24.619499999999999 | J86: =100*RC[-1]/R7C[-1] -> 4.662252753035679E-2
A87: 86 | D87: 4. | E87: Alcohol use disorders | G87: =Global2012!R[3]C/1000 -> 107.26049999999999 | H87: =100*RC[-1]/R7C[-1] -> 0.19202105088001709 | I87: =Global2000!R[3]C[-2]/1000 -> 93.231200000000001 | J87: =100*RC[-1]/R7C[-1] -> 0.17655412127330777
A88: 87 | D88: 5. | E88: Drug use disorders | G88: =Global2012!R[3]C/1000 -> 93.254700000000014 | H88: =100*RC[-1]/R7C[-1] -> 0.16694743632092646 | I88: =Global2000!R[3]C[-2]/1000 -> 54.385199999999998 | J88: =100*RC[-1]/R7C[-1] -> 0.10299053531728751
A89: 88 | D89: 6. | E89: Anxiety disorders | G89: =Global2012!R[3]C/1000 -> 6.6099999999999992E-2 | H89: =100*RC[-1]/R7C[-1] -> 1.1833425597651632E-4 | I89: =Global2000!R[3]C[-2]/1000 -> 5.7500000000000002E-2 | J89: =100*RC[-1]/R7C[-1] -> 1.0888910550561611E-4
A90: 89 | D90: 7. | E90: Eating disorders | G90: =Global2012!R[3]C/1000 -> 9.1183999999999994 | H90: =100*RC[-1]/R7C[-1] -> 1.632404054003429E-2 | I90: =Global2000!R[3]C[-2]/1000 -> 7.6098999999999997 | J90: =100*RC[-1]/R7C[-1] -> 1.4411047025864139E-2
A91: 90 | D91: 8. | E91: Pervasive developmental disorders | G91: =Global2012!R[3]C/1000 -> 0 | H91: =100*RC[-1]/R7C[-1] -> 0 | I91: =Global2000!R[3]C[-2]/1000 -> 0 | J91: =100*RC[-1]/R7C[-1] -> 0
A92: 91 | D92: 9. | E92: Childhood behavioural disorders | G92: =Global2012!R[3]C/1000 -> 0 | H92: =100*RC[-1]/R7C[-1] -> 0 | I92: =Global2000!R[3]C[-2]/1000 -> 0 | J92: =100*RC[-1]/R7C[-1] -> 0
A93: 92 | D93: 10. | E93: Idiopathic intellectual disability | G93: =Global2012!R[3]C/1000 -> 1.7681 | H93: =100*RC[-1]/R7C[-1] -> 3.1653070800617025E-3 | I93: =Global2000!R[3]C[-2]/1000 -> 1.2415 | J93: =100*RC[-1]/R7C[-1] -> 2.3510578171343026E-3
A94: 93 | D94: 11. | E94: Other mental and behavioural disorders | G94: =Global2012!R[3]C/1000 -> 19.710799999999999 | H94: =100*RC[-1]/R7C[-1] -> 3.5286881281420851E-2 | I94: =Global2000!R[3]C[-2]/1000 -> 15.602599999999999 | J94: =100*RC[-1]/R7C[-1] -> 2.9547011435859579E-2
A95: 94 | C95: F. | D95: Neurological conditions | G95: =Global2012!R[3]C/1000 -> 1420.2964999999999 | H95: =100*RC[-1]/R7C[-1] -> 2.542658541506055 | I95: =Global2000!R[3]C[-2]/1000 -> 805.8682 | J95: =100*RC[-1]/R7C[-1] -> 1.5260916078855815
A96: 95 | D96: 1. | E96: Alzheimer's disease and other dementias | G96: =Global2012!R[3]C/1000 -> 700.83389999999997 | H96: =100*RC[-1]/R7C[-1] -> 1.2546544344874471 | I96: =Global2000!R[3]C[-2]/1000 -> 297.05859999999996 | J96: =100*RC[-1]/R7C[-1] -> 0.56254687368261924
A97: 96 | D97: 2. | E97: Parkinson's disease | G97: =Global2012!R[3]C/1000 -> 119.2824 | H97: =100*RC[-1]/R7C[-1] -> 0.21354302655209095 | I97: =Global2000!R[3]C[-2]/1000 -> 73.386299999999991 | J97: =100*RC[-1]/R7C[-1] -> 0.1389733663194225
A98: 97 | D98: 3. | E98: Epilepsy | G98: =Global2012!R[3]C/1000 -> 204.82489999999999 | H98: =100*RC[-1]/R7C[-1] -> 0.36668384488599637 | I98: =Global2000!R[3]C[-2]/1000 -> 171.07910000000001 | J98: =100*RC[-1]/R7C[-1] -> 0.32397652469053645
A99: 98 | D99: 4. | E99: Multiple sclerosis | G99: =Global2012!R[3]C/1000 -> 19.051299999999998 | H99: =100*RC[-1]/R7C[-1] -> 3.410622406785787E-2 | I99: =Global2000!R[3]C[-2]/1000 -> 15.736700000000001 | J99: =100*RC[-1]/R7C[-1] -> 2.9800959767134417E-2
A100: 99 | D100: 5. | E100: Migraine | G100: =Global2012!R[3]C/1000 -> 9.6999999999999986E-3 | H100: =100*RC[-1]/R7C[-1] -> 1.7365238774163514E-5 | I100: =Global2000!R[3]C[-2]/1000 -> 1.24E-2 | J100: =100*RC[-1]/R7C[-1] -> 2.3482172317732864E-5
A101: 100 | D101: 6. | E101: Non-migraine headache | G101: =Global2012!R[3]C/1000 -> 0 | H101: =100*RC[-1]/R7C[-1] -> 0 | I101: =Global2000!R[3]C[-2]/1000 -> 0 | J101: =100*RC[-1]/R7C[-1] -> 0
A102: 101 | D102: 7. | E102: Other neurological conditions | G102: =Global2012!R[3]C/1000 -> 376.2944 | H102: =100*RC[-1]/R7C[-1] -> 0.67365382529696871 | I102: =Global2000!R[3]C[-2]/1000 -> 248.59520000000001 | J102: =100*RC[-1]/R7C[-1] -> 0.47077059062590842
A103: 102 | C103: G. | D103: Sense organ diseases | G103: =Global2012!R[3]C/1000 -> 0.65759999999999996 | H103: =100*RC[-1]/R7C[-1] -> 1.1772557750401986E-3 | I103: =Global2000!R[3]C[-2]/1000 -> 1.7037 | J103: =100*RC[-1]/R7C[-1] -> 3.2263368530420547E-3
A104: 103 | D104: 1. | E104: Glaucoma | G104: =Global2012!R[3]C/1000 -> 3.7899999999999996E-2 | H104: =100*RC[-1]/R7C[-1] -> 6.7849747375339913E-5 | I104: =Global2000!R[3]C[-2]/1000 -> 0.17230000000000001 | J104: =100*RC[-1]/R7C[-1] -> 3.2628857180204619E-4
A105: 104 | D105: 2. | E105: Cataracts | G105: =Global2012!R[3]C/1000 -> 1.5900000000000001E-2 | H105: =100*RC[-1]/R7C[-1] -> 2.8464669743216487E-5 | I105: =Global2000!R[3]C[-2]/1000 -> 0.25329999999999997 | J105: =100*RC[-1]/R7C[-1] -> 4.7968018129691402E-4
A106: 105 | D106: 3. | E106: Refractive errors | G106: =Global2012!R[3]C/1000 -> 1.2000000000000001E-3 | H106: =100*RC[-1]/R7C[-1] -> 2.1482769617521877E-6 | I106: =Global2000!R[3]C[-2]/1000 -> 0 | J106: =100*RC[-1]/R7C[-1] -> 0
A107: 106 | D107: 4. | E107: Macular degeneration | G107: =Global2012!R[3]C/1000 -> 0 | H107: =100*RC[-1]/R7C[-1] -> 0 | I107: =Global2000!R[3]C[-2]/1000 -> 0 | J107: =100*RC[-1]/R7C[-1] -> 0
A108: 107 | D108: 5. | E108: Other vision loss | G108: =Global2012!R[3]C/1000 -> 0 | H108: =100*RC[-1]/R7C[-1] -> 0 | I108: =Global2000!R[3]C[-2]/1000 -> 0 | J108: =100*RC[-1]/R7C[-1] -> 0
A109: 108 | D109: 6. | E109: Other hearing loss | G109: =Global2012!R[3]C/1000 -> 6.3000000000000009E-3 | H109: =100*RC[-1]/R7C[-1] -> 1.1278454049198987E-5 | I109: =Global2000!R[3]C[-2]/1000 -> 9.9000000000000008E-3 | J109: =100*RC[-1]/R7C[-1] -> 1.8747863382706077E-5
A110: 109 | D110: 7. | E110: other sense organ disorders | G110: =Global2012!R[3]C/1000 -> 0.59629999999999994 | H110: =100*RC[-1]/R7C[-1] -> 1.0675146269106912E-3 | I110: =Global2000!R[3]C[-2]/1000 -> 1.268 | J110: =100*RC[-1]/R7C[-1] -> 2.4012414918455861E-3
A111: 110 | C111: H. | D111: Cardiovascular diseases | G111: =Global2012!R[3]C/1000 -> 17519.300700000003 | H111: =100*RC[-1]/R7C[-1] -> 31.363591733182485 | I111: =Global2000!R[3]C[-2]/1000 -> 14881.4962 | J111: =100*RC[-1]/R7C[-1] -> 28.18144017049087
A112: 111 | D112: 1. | E112: Rheumatic heart disease | G112: =Global2012!R[3]C/1000 -> 337.3347 | H112: =100*RC[-1]/R7C[-1] -> 0.60390697034132146 | I112: =Global2000!R[3]C[-2]/1000 -> 371.93669999999997 | J112: =100*RC[-1]/R7C[-1] -> 0.704345296829751
A113: 112 | D113: 2. | E113: Hypertensive heart disease | G113: =Global2012!R[3]C/1000 -> 1141.2049 | H113: =100*RC[-1]/R7C[-1] -> 2.0430201627572573 | I113: =Global2000!R[3]C[-2]/1000 -> 848.96 | J113: =100*RC[-1]/R7C[-1] -> 1.6076955653921363
A114: 113 | D114: 3. | E114: Ischaemic heart disease | G114: =Global2012!R[3]C/1000 -> 7356.0609999999997 | H114: =100*RC[-1]/R7C[-1] -> 13.169046979619798 | I114: =Global2000!R[3]C[-2]/1000 -> 5974.0592999999999 | J114: =100*RC[-1]/R7C[-1] -> 11.313216928947949
A115: 114 | D115: 4. | E115: Stroke | G115: =Global2012!R[3]C/1000 -> 6670.9337000000005 | H115: =100*RC[-1]/R7C[-1] -> 11.942510984238567 | I115: =Global2000!R[3]C[-2]/1000 -> 5661.5486000000001 | J115: =100*RC[-1]/R7C[-1] -> 10.721408049227358
A116: 115 | D116: 5. | E116: Cardiomyopathy, myocarditis, endocarditis | G116: =Global2012!R[3]C/1000 -> 472.29039999999998 | H116: =100*RC[-1]/R7C[-1] -> 0.8455088213139379 | I116: =Global2000!R[3]C[-2]/1000 -> 401.5403 | J116: =100*RC[-1]/R7C[-1] -> 0.76040633202533459
A117: 116 | D117: 6. | E117: Other circulatory diseases | G117: =Global2012!R[3]C/1000 -> 1541.4760000000001 | H117: =100*RC[-1]/R7C[-1] -> 2.7595978149115963 | I117: =Global2000!R[3]C[-2]/1000 -> 1623.4511 | J117: =100*RC[-1]/R7C[-1] -> 3.0743676193236262
A118: 117 | C118: I. | D118: Respiratory diseases | G118: =Global2012!R[3]C/1000 -> 4042.0727000000002 | H118: =100*RC[-1]/R7C[-1] -> 7.2362430492812182 | I118: =Global2000!R[3]C[-2]/1000 -> 3937.808199999999 | J118: =100*RC[-1]/R7C[-1] -> 7.4571202182726974
A119: 118 | D119: 1. | E119: Chronic obstructive pulmonary disease | G119: =Global2012!R[3]C/1000 -> 3104.3298 | H119: =100*RC[-1]/R7C[-1] -> 5.5574668258506463 | I119: =Global2000!R[3]C[-2]/1000 -> 3059.3155000000002 | J119: =100*RC[-1]/R7C[-1] -> 5.7934978826863768
A120: 119 | D120: 2. | E120: Asthma | G120: =Global2012!R[3]C/1000 -> 386.31799999999998 | H120: =100*RC[-1]/R7C[-1] -> 0.69159838275848462 | I120: =Global2000!R[3]C[-2]/1000 -> 383.83280000000002 | J120: =100*RC[-1]/R7C[-1] -> 0.72687322183853986
A121: 120 | D121: 3. | E121: Other respiratory diseases | G121: =Global2012!R[3]C/1000 -> 551.42489999999987 | H121: =100*RC[-1]/R7C[-1] -> 0.98717784067208625 | I121: =Global2000!R[3]C[-2]/1000 -> 494.66 | J121: =100*RC[-1]/R7C[-1] -> 0.93674930312014015
A122: 121 | C122: J. | D122: Digestive diseases | G122: =Global2012!R[3]C/1000 -> 2264.0733999999998 | H122: =100*RC[-1]/R7C[-1] -> 4.0532139374466203 | I122: =Global2000!R[3]C[-2]/1000 -> 2034.5461 | J122: =100*RC[-1]/R7C[-1] -> 3.8528679119815612
A123: 122 | D123: 1. | E123: Peptic ulcer disease | G123: =Global2012!R[3]C/1000 -> 262.91069999999996 | H123: =100*RC[-1]/R7C[-1] -> 0.47067083317345065 | I123: =Global2000!R[3]C[-2]/1000 -> 321.50779999999997 | J123: =100*RC[-1]/R7C[-1] -> 0.6088469000883221
A124: 123 | D124: 2. | E124: Cirrhosis of the liver | G124: =Global2012!R[3]C/1000 -> 1020.8911999999999 | H124: =100*RC[-1]/R7C[-1] -> 1.8276308711796208 | I124: =Global2000!R[3]C[-2]/1000 -> 891.51319999999998 | J124: =100*RC[-1]/R7C[-1] -> 1.6882795633817289
A125: 124 | D125: 3. | E125: Appendicitis | G125: =Global2012!R[3]C/1000 -> 39.551000000000002 | H125: =100*RC[-1]/R7C[-1] -> 7.0805418428550648E-2 | I125: =Global2000!R[3]C[-2]/1000 -> 40.983199999999997 | J125: =100*RC[-1]/R7C[-1] -> 7.7610851978395914E-2
A126: 125 | E126: Other digestive diseases | G126: =Global2012!R[3]C/1000 -> 940.72059999999999 | H126: =100*RC[-1]/R7C[-1] -> 1.684106993688079 | I126: =Global2000!R[3]C[-2]/1000 -> 780.54150000000004 | J126: =100*RC[-1]/R7C[-1] -> 1.4781298390436846
A127: 126 | C127: K. | D127: Genitourinary diseases | G127: =Global2012!R[3]C/1000 -> 1195.5532000000001 | H127: =100*RC[-1]/R7C[-1] -> 2.1403161634242549 | I127: =Global2000!R[3]C[-2]/1000 -> 900.01300000000003 | J127: =100*RC[-1]/R7C[-1] -> 1.7043758350161056
A128: 127 | D128: 1. | E128: Kidney diseases | G128: =Global2012!R[3]C/1000 -> 864.22580000000005 | H128: =100*RC[-1]/R7C[-1] -> 1.5471636465765448 | I128: =Global2000!R[3]C[-2]/1000 -> 694.1468000000001 | J128: =100*RC[-1]/R7C[-1] -> 1.314522158984101
A129: 128 | D129: 2. | E129: Hyperplasia of prostate | G129: =Global2012!R[3]C/1000 -> 5.8702000000000005 | H129: =100*RC[-1]/R7C[-1] -> 1.0509012850731412E-2 | I129: =Global2000!R[3]C[-2]/1000 -> 8.0973000000000006 | J129: =100*RC[-1]/R7C[-1] -> 1.5334047895836962E-2
A130: 129 | D130: 3. | E130: Urolithiasis | G130: =Global2012!R[3]C/1000 -> 31.453400000000002 | H130: =100*RC[-1]/R7C[-1] -> 5.6308845490646887E-2 | I130: =Global2000!R[3]C[-2]/1000 -> 24.882900000000003 | J130: =100*RC[-1]/R7C[-1] -> 4.7121334319751219E-2
A131: 130 | D131: 4. | E131: Other genitourinary diseases | G131: =Global2012!R[3]C/1000 -> 285.25200000000001 | H131: =100*RC[-1]/R7C[-1] -> 0.51066691657811258 | I131: =Global2000!R[3]C[-2]/1000 -> 165.9067 | J131: =100*RC[-1]/R7C[-1] -> 0.31418142887632344
A132: 131 | D132: 5. | E132: Infertility | G132: =Global2012!R[3]C/1000 -> 0 | H132: =100*RC[-1]/R7C[-1] -> 0 | I132: =Global2000!R[3]C[-2]/1000 -> 0 | J132: =100*RC[-1]/R7C[-1] -> 0
A133: 132 | D133: 6. | E133: Gynecological diseases | G133: =Global2012!R[3]C/1000 -> 8.7517000000000014 | H133: =100*RC[-1]/R7C[-1] -> 1.5667562905138852E-2 | I133: =Global2000!R[3]C[-2]/1000 -> 6.9794 | J133: =100*RC[-1]/R7C[-1] -> 1.3217054312450384E-2
A134: 133 | C134: L. | D134: Skin diseases | G134: =Global2012!R[3]C/1000 -> 111.17760000000001 | H134: =100*RC[-1]/R7C[-1] -> 0.19903356395241673 | I134: =Global2000!R[3]C[-2]/1000 -> 95.004400000000004 | J134: =100*RC[-1]/R7C[-1] -> 0.17991207191474357
A135: 134 | C135: M. | D135: Musculoskeletal diseases | G135: =Global2012!R[3]C/1000 -> 216.72959999999998 | H135: =100*RC[-1]/R7C[-1] -> 0.38799600550813906 | I135: =Global2000!R[3]C[-2]/1000 -> 137.63420000000002 | J135: =100*RC[-1]/R7C[-1] -> 0.26064112913010556
A136: 135 | D136: 1. | E136: Rheumatoid arthritis | G136: =Global2012!R[3]C/1000 -> 66.007600000000011 | H136: =100*RC[-1]/R7C[-1] -> 0.11816883865046143 | I136: =Global2000!R[3]C[-2]/1000 -> 47.134999999999998 | J136: =100*RC[-1]/R7C[-1] -> 8.9260660660995042E-2
A137: 136 | D137: 2. | E137: Osteoarthritis | G137: =Global2012!R[3]C/1000 -> 4.1488999999999994 | H137: =100*RC[-1]/R7C[-1] -> 7.4274885721780414E-3 | I137: =Global2000!R[3]C[-2]/1000 -> 3.5163000000000002 | J137: =100*RC[-1]/R7C[-1] -> 6.6589002032938762E-3
A138: 137 | D138: 3. | E138: Gout | G138: =Global2012!R[3]C/1000 -> 0.55290000000000006 | H138: =100*RC[-1]/R7C[-1] -> 9.8981861012732058E-4 | I138: =Global2000!R[3]C[-2]/1000 -> 0.31610000000000005 | J138: =100*RC[-1]/R7C[-1] -> 5.9860602174478708E-4
A139: 138 | D139: 4. | E139: Back and neck pain | G139: =Global2012!R[3]C/1000 -> 3.8704999999999998 | H139: =100*RC[-1]/R7C[-1] -> 6.9290883170515342E-3 | I139: =Global2000!R[3]C[-2]/1000 -> 1.91 | J139: =100*RC[-1]/R7C[-1] -> 3.6170120263604652E-3
A140: 139 | E140: Other musculoskeletal disorders | G140: =Global2012!R[3]C/1000 -> 142.14970000000002 | H140: =100*RC[-1]/R7C[-1] -> 0.25448077135832087 | I140: =Global2000!R[3]C[-2]/1000 -> 84.756699999999995 | J140: =100*RC[-1]/R7C[-1] -> 0.16050576084535395
A141: 140 | C141: N. | D141: Congenital anomalies | G141: =Global2012!R[3]C/1000 -> 556.32650000000001 | H141: =100*RC[-1]/R7C[-1] -> 0.99595283596852369 | I141: =Global2000!R[3]C[-2]/1000 -> 587.9027000000001 | J141: =100*RC[-1]/R7C[-1] -> 1.1133252022145492
A142: 141 | D142: 1. | E142: Neural tube defects | G142: =Global2012!R[3]C/1000 -> 87.52709999999999 | H142: =100*RC[-1]/R7C[-1] -> 0.15669371038248323 | I142: =Global2000!R[3]C[-2]/1000 -> 110.09509999999999 | J142: =100*RC[-1]/R7C[-1] -> 0.20848968625306702
A143: 142 | D143: 2. | E143: Cleft lip and cleft palate | G143: =Global2012!R[3]C/1000 -> 4.3681000000000001 | H143: =100*RC[-1]/R7C[-1] -> 7.8199071638581086E-3 | I143: =Global2000!R[3]C[-2]/1000 -> 6.0818000000000003 | J143: =100*RC[-1]/R7C[-1] -> 1.1517248032418366E-2
A144: 143 | D144: 3. | E144: Down's syndrome | G144: =Global2012!R[3]C/1000 -> 19.135300000000001 | H144: =100*RC[-1]/R7C[-1] -> 3.4256603455180536E-2 | I144: =Global2000!R[3]C[-2]/1000 -> 20.158000000000001 | J144: =100*RC[-1]/R7C[-1] -> 3.817367980490799E-2
A145: 144 | D145: 4. | E145: Congenital heart anomalies | G145: =Global2012!R[3]C/1000 -> 230.23990000000001 | H145: =100*RC[-1]/R7C[-1] -> 0.41218256070510628 | I145: =Global2000!R[3]C[-2]/1000 -> 233.63140000000001 | J145: =100*RC[-1]/R7C[-1] -> 0.44243328980912694
A146: 145 | D146: 5. | E146: Other chromosomal anomalies | G146: =Global2012!R[3]C/1000 -> 23.115599999999997 | H146: =100*RC[-1]/R7C[-1] -> 4.1382259114232378E-2 | I146: =Global2000!R[3]C[-2]/1000 -> 25.592199999999998 | J146: =100*RC[-1]/R7C[-1] -> 4.8464552450797012E-2
A147: 146 | D147: 6. | E147: Other congenital anomalies | G147: =Global2012!R[3]C/1000 -> 191.94070000000002 | H147: =100*RC[-1]/R7C[-1] -> 0.34361815319382349 | I147: =Global2000!R[3]C[-2]/1000 -> 192.34399999999999 | J147: =100*RC[-1]/R7C[-1] -> 0.36424636711951686
A148: 147 | C148: O. | D148: Oral conditions | G148: =Global2012!R[3]C/1000 -> 1.5700999999999998 | H148: =100*RC[-1]/R7C[-1] -> 2.8108413813725912E-3 | I148: =Global2000!R[3]C[-2]/1000 -> 0.9012 | J148: =100*RC[-1]/R7C[-1] -> 1.7066236848984563E-3
A149: 148 | D149: 1. | E149: Dental caries | G149: =Global2012!R[3]C/1000 -> 1.1227 | H149: =100*RC[-1]/R7C[-1] -> 2.0098921207993177E-3 | I149: =Global2000!R[3]C[-2]/1000 -> 0.46429999999999993 | J149: =100*RC[-1]/R7C[-1] -> 8.7925585541317477E-4
A150: 149 | D150: 2. | E150: Periodontal disease | G150: =Global2012!R[3]C/1000 -> 4.0500000000000001E-2 | H150: =100*RC[-1]/R7C[-1] -> 7.2504347459136328E-5 | I150: =Global2000!R[3]C[-2]/1000 -> 2.8900000000000002E-2 | J150: =100*RC[-1]/R7C[-1] -> 5.4728611288909657E-5
A151: 150 | D151: 3. | E151: Edentulism | G151: =Global2012!R[3]C/1000 -> 0.40710000000000002 | H151: =100*RC[-1]/R7C[-1] -> 7.2880295927442971E-4 | I151: =Global2000!R[3]C[-2]/1000 -> 0.40790000000000004 | J151: =100*RC[-1]/R7C[-1] -> 7.7244984583897073E-4
A152: 151 | B152: III. | C152: Injuries | G152: =Global2012!R[3]C/1000 -> 5144.3360000000002 | H152: =100*RC[-1]/R7C[-1] -> 9.2095487602603363 | I152: =Global2000!R[3]C[-2]/1000 -> 5026.125 | J152: =100*RC[-1]/R7C[-1] -> 9.5180913984246036
A153: 152 | C153: A. | D153: Unintentional injuries | G153: =Global2012!R[3]C/1000 -> 3716.3863999999999 | H153: =100*RC[-1]/R7C[-1] -> 6.6531894034076258 | I153: =Global2000!R[3]C[-2]/1000 -> 3530.6131999999998 | J153: =100*RC[-1]/R7C[-1] -> 6.6860054475534056
A154: 153 | D154: 1. | E154: Road injury | G154: =Global2012!R[3]C/1000 -> 1254.5258999999999 | H154: =100*RC[-1]/R7C[-1] -> 2.2458909074095237 | I154: =Global2000!R[3]C[-2]/1000 -> 1022.2614999999998 | J154: =100*RC[-1]/R7C[-1] -> 1.9358807013535539
A155: 154 | D155: 2. | E155: Poisonings | G155: =Global2012!R[3]C/1000 -> 193.46029999999999 | H155: =100*RC[-1]/R7C[-1] -> 0.34633858791972227 | I155: =Global2000!R[3]C[-2]/1000 -> 254.77439999999999 | J155: =100*RC[-1]/R7C[-1] -> 0.48247228733443542
A156: 155 | D156: 3. | E156: Falls | G156: =Global2012!R[3]C/1000 -> 693.13099999999997 | H156: =100*RC[-1]/R7C[-1] -> 1.2408644656468795 | I156: =Global2000!R[3]C[-2]/1000 -> 526.58630000000005 | J156: =100*RC[-1]/R7C[-1] -> 0.99720889006107849
A157: 156 | D157: 4. | E157: Fire, heat and hot substances | G157: =Global2012!R[3]C/1000 -> 267.88909999999998 | H157: =100*RC[-1]/R7C[-1] -> 0.47958331819543998 | I157: =Global2000!R[3]C[-2]/1000 -> 268.94109999999995 | J157: =100*RC[-1]/R7C[-1] -> 0.50930010109037294
A158: 157 | D158: 5. | E158: Drowning | G158: =Global2012!R[3]C/1000 -> 372.4418 | H158: =100*RC[-1]/R7C[-1] -> 0.66675678211126321 | I158: =Global2000!R[3]C[-2]/1000 -> 442.17980000000006 | J158: =100*RC[-1]/R7C[-1] -> 0.83736631121134308
A159: 158 | D159: 6. | E159: Exposure to forces of nature | G159: =Global2012!R[3]C/1000 -> 2.4550999999999998 | H159: =100*RC[-1]/R7C[-1] -> 4.3951956406648295E-3 | I159: =Global2000!R[3]C[-2]/1000 -> 1.2976999999999999 | J159: =100*RC[-1]/R7C[-1] -> 2.4574850819937041E-3
A160: 159 | D160: 7. | E160: Other unintentional injuries | G160: =Global2012!R[3]C/1000 -> 932.48390000000006 | H160: =100*RC[-1]/R7C[-1] -> 1.6693613996456922 | I160: =Global2000!R[3]C[-2]/1000 -> 1014.5722999999999 | J160: =100*RC[-1]/R7C[-1] -> 1.9213194820482711
A161: 160 | C161: B. | D161: Intentional injuries | G161: =Global2012!R[3]C/1000 -> 1427.9494 | H161: =100*RC[-1]/R7C[-1] -> 2.5563589988065494 | I161: =Global2000!R[3]C[-2]/1000 -> 1495.5118 | J161: =100*RC[-1]/R7C[-1] -> 2.8320859508711971
A162: 161 | D162: 1. | E162: Self-harm | G162: =Global2012!R[3]C/1000 -> 803.89969999999994 | H162: =100*RC[-1]/R7C[-1] -> 1.4391660042245793 | I162: =Global2000!R[3]C[-2]/1000 -> 883.48869999999999 | J162: =100*RC[-1]/R7C[-1] -> 1.67308337856208
A163: 162 | D163: 2. | E163: Interpersonal violence | G163: =Global2012!R[3]C/1000 -> 504.58710000000002 | H163: =100*RC[-1]/R7C[-1] -> 0.90332736843945605 | I163: =Global2000!R[3]C[-2]/1000 -> 489.65040000000005 | J163: =100*RC[-1]/R7C[-1] -> 0.9272625055037762
A164: 163 | D164: 3. | E164: Collective violence and legal intervention | G164: =Global2012!R[3]C/1000 -> 119.46250000000001 | H164: =100*RC[-1]/R7C[-1] -> 0.21386544711943392 | I164: =Global2000!R[3]C[-2]/1000 -> 122.37269999999999 | J164: =100*RC[-1]/R7C[-1] -> 0.23174006680534098

Sheet: Global2012
A1: Global Health Estimates (GHE) 2014: Deaths by age, sex and cause
A2: Region: | C2: Global
A3: Year: | C3: 2012
A4: GlobalGlobal | H4: 10 | I4: 12 | J4: 15 | K4: 115 | L4: 130 | M4: 150 | N4: 160 | O4: 170 | Q4: 20 | R4: 22 | S4: 25 | T4: 215 | U4: 230 | V4: 250 | W4: 260 | X4: 270
F5: Sex | G5: Both sexes | H5: Male | Q5: Female
F6: Age group | G6: Total | H6: 0-27 days | I6: 1-59 months | J6: 5-14 years | K6: 15-29 years | L6: 30-49 years | M6: 50-59 years | N6: 60-69 years | O6: 70+ years | P6: Total | Q6: 0-27 days | R6: 1-59 months | S6: 5-14 years | T6: 15-29 years | U6: 30-49 years | V6: 50-59 years | W6: 60-69 years | X6: 70+ years | Y6: Total
A7: Population (thousands) | G7: =RC[9]+RC[18] -> 7075456 | H7: 5763 | I7: 332149 | J7: 625624 | K7: 921699 | L7: 964582 | M7: 344623 | N7: 214647 | O7: 157347 | P7: =SUM(RC[-8]:RC[-1]) -> 3566434 | Q7: 5377 | R7: 309866 | S7: 584513 | T7: 876126 | U7: 943696 | V7: 348072 | W7: 230746 | X7: 210626 | Y7: =SUM(RC[-8]:RC[-1]) -> 3509022
A8: Live births (thousands) | G8: 138584.4
A9: GHE code | C9: GHE cause category
A10: 0 | C10: All Causes | G10: =RC[9]+RC[18] -> 55858719.400000006 | H10: 1564530.7 | I10: 1959305.8 | J10: 759145.6 | K10: 1678426.5 | L10: 3620621.4 | M10: 3475751.2 | N10: 4898501.3 | O10: 11870870.300000001 | P10: =SUM(RC[-8]:RC[-1]) -> 29827152.800000001 | Q10: 1288145.2 | R10: 1742131.2 | S10: 687333.3 | T10: 1178016.6000000001 | U10: 2342901 | V10: 2129236.7000000002 | W10: 3405523.6 | X10: 13258279 | Y10: =SUM(RC[-8]:RC[-1]) -> 26031566.600000001
A11: 1 | B11: I. | C11: Communicable, maternal, perinatal and nutritional conditions | G11: =RC[9]+RC[18] -> 12822156.599999998 | H11: 1395832.9 | I11: 1550224.7 | J11: 369977.2 | K11: 374480.4 | L11: 944150.7 | M11: 437155.8 | N11: 465786 | O11: 1110941.7 | P11: =SUM(RC[-8]:RC[-1]) -> 6648549.3999999994 | Q11: 1142345.3999999999 | R11: 1382691.4 | S11: 378767.9 | T11: 533270.6 | U11: 861555 | V11: 286913.8 | W11: 355663.7 | X11: 1232399.3999999999 | Y11: =SUM(RC[-8]:RC[-1]) -> 6173607.1999999993
A12: 2 | C12: A. | D12: Infectious and parasitic diseases | G12: =RC[9]+RC[18] -> 6431071.4000000004 | H12: 67067.8 | I12: 869879.3 | J12: 278932.3 | K12: 296890 | L12: 825565.2 | M12: 331382 | N12: 300508.90000000002 | O12: 444347.2 | P12: =SUM(RC[-8]:RC[-1]) -> 3414572.7 | Q12: 71959.399999999994 | R12: 832335.6 | S12: 284135.8 | T12: 307763.20000000001 | U12: 627923.1 | V12: 211334.7 | W12: 219476.5 | X12: 461570.4 | Y12: =SUM(RC[-8]:RC[-1]) -> 3016498.7
A13: 3 | D13: 1. | E13: Tuberculosis | G13: =RC[9]+RC[18] -> 934879.4 | H13: 68.2 | I13: 28534.7 | J13: 5898.3 | K13: 28503.200000000001 | L13: 150653.29999999999 | M13: 108755.7 | N13: 127594.8 | O13: 159075.29999999999 | P13: =SUM(RC[-8]:RC[-1]) -> 609083.5 | Q13: 35.700000000000003 | R13: 26890.9 | S13: 8220.4 | T13: 27329.1 | U13: 80999 | V13: 47419.6 | W13: 57346.3 | X13: 77554.899999999994 | Y13: =SUM(RC[-8]:RC[-1]) -> 325795.90000000002
A14: 4 | D14: 2. | E14: STDs excluding HIV | G14: =RC[9]+RC[18] -> 84273.699999999983 | H14: 21002.2 | I14: 12255.2 | J14: 3484.7 | K14: 761.1 | L14: 1003.6 | M14: 498.7 | N14: 582.20000000000005 | O14: 858.6 | P14: =SUM(RC[-8]:RC[-1]) -> 40446.299999999988 | Q14: 22716.7 | R14: 11516.4 | S14: 3767.9 | T14: 1259.2 | U14: 1570.3 | V14: 644.6 | W14: 682.6 | X14: 1669.7 | Y14: =SUM(RC[-8]:RC[-1]) -> 43827.399999999994
A15: 5 | E15: a. | F15: Syphilis | G15: =RC[9]+RC[18] -> 78911.200000000012 | H15: 21002.2 | I15: 12255.2 | J15: 3484.4 | K15: 760 | L15: 1003.6 | M15: 498.3 | N15: 581.70000000000005 | O15: 853.8 | P15: =SUM(RC[-8]:RC[-1]) -> 40439.200000000004 | Q15: 22716.400000000001 | R15: 11516.4 | S15: 3543.1 | T15: 65.599999999999994 | U15: 82.6 | V15: 90.2 | W15: 153.80000000000001 | X15: 303.89999999999998 | Y15: =SUM(RC[-8]:RC[-1]) -> 38472
A16: 6 | E16: b. | F16: Chlamydia | G16: =RC[9]+RC[18] -> 1076.3000000000002 | H16: 0 | I16: 0 | J16: 0.3 | K16: 0.7 | L16: 0 | M16: 0.4 | N16: 0 | O16: 3 | P16: =SUM(RC[-8]:RC[-1]) -> 4.4000000000000004 | Q16: 0.2 | R16: 0.1 | S16: 52.7 | T16: 272.3 | U16: 312.2 | V16: 115.4 | W16: 109.2 | X16: 209.8 | Y16: =SUM(RC[-8]:RC[-1]) -> 1071.9000000000001
A17: 7 | E17: c. | F17: Gonorrhoea | G17: =RC[9]+RC[18] -> 795.7 | H17: 0 | I17: 0 | J17: 0 | K17: 0.4 | L17: 0 | M17: 0 | N17: 0.4 | O17: 1.8 | P17: =SUM(RC[-8]:RC[-1]) -> 2.6 | Q17: 0.1 | R17: 0 | S17: 36.799999999999997 | T17: 201.8 | U17: 233.1 | V17: 86.9 | W17: 72.900000000000006 | X17: 161.5 | Y17: =SUM(RC[-8]:RC[-1]) -> 793.1
A18: 8 | E18: d. | F18: Trichomoniasis | G18: =RC[9]+RC[18] -> 0 | H18: 0 | I18: 0 | J18: 0 | K18: 0 | L18: 0 | M18: 0 | N18: 0 | O18: 0 | P18: =SUM(RC[-8]:RC[-1]) -> 0 | Q18: 0 | R18: 0 | S18: 0 | T18: 0 | U18: 0 | V18: 0 | W18: 0 | X18: 0 | Y18: =SUM(RC[-8]:RC[-1]) -> 0
A19: 9 | E19: e. | F19: Other STDs | G19: =RC[9]+RC[18] -> 3490.7000000000003 | H19: 0 | I19: 0 | J19: 0 | K19: 0 | L19: 0 | M19: 0 | N19: 0 | O19: 0 | P19: =SUM(RC[-8]:RC[-1]) -> 0 | Q19: 0 | R19: 0 | S19: 135.4 | T19: 719.5 | U19: 942.4 | V19: 352.1 | W19: 346.8 | X19: 994.5 | Y19: =SUM(RC[-8]:RC[-1]) -> 3490.7000000000003
A20: 10 | D20: 3. | E20: HIV/AIDS | G20: =RC[9]+RC[18] -> 1533760.4 | H20: 535.29999999999995 | I20: 51180.6 | J20: 48587.6 | K20: 104640.9 | L20: 479825.6 | M20: 93731.3 | N20: 29631.599999999999 | O20: 9017.2999999999993 | P20: =SUM(RC[-8]:RC[-1]) -> 817150.20000000007 | Q20: 510.5 | R20: 50569.2 | S20: 47687.7 | T20: 134586.79999999999 | U20: 402315.6 | V20: 58269.3 | W20: 17297.900000000001 | X20: 5373.2 | Y20: =SUM(RC[-8]:RC[-1]) -> 716610.2
A21: 11 | D21: 4. | E21: Diarrhoeal diseases | G21: =RC[9]+RC[18] -> 1497723.5 | H21: 11292.9 | I21: 303444.8 | J21: 65917.7 | K21: 34518.1 | L21: 55676.1 | M21: 41349.1 | N21: 55984.3 | O21: 127237.6 | P21: =SUM(RC[-8]:RC[-1]) -> 695420.6 | Q21: 10553.3 | R21: 296873.5 | S21: 76127.600000000006 | T21: 50819.8 | U21: 56009.1 | V21: 43031.5 | W21: 69575.8 | X21: 199312.3 | Y21: =SUM(RC[-8]:RC[-1]) -> 802302.90000000014
A22: 12 | D22: 5. | E22: Childhood-cluster diseases | G22: =RC[9]+RC[18] -> 266265 | H22: 26127.8 | I22: 83038.899999999994 | J22: 14305.5 | K22: 2522.5 | L22: 1851.9 | M22: 1281.2 | N22: 849 | O22: 1309.3 | P22: =SUM(RC[-8]:RC[-1]) -> 131286.09999999998 | Q22: 31797 | R22: 79345.2 | S22: 17531.900000000001 | T22: 2712.7 | U22: 1142.7 | V22: 710.7 | W22: 809.5 | X22: 929.2 | Y22: =SUM(RC[-8]:RC[-1]) -> 134978.90000000005
A23: 13 | E23: a. | F23: Whooping cough | G23: =RC[9]+RC[18] -> 67059.100000000006 | H23: 1444.3 | I23: 32436.799999999999 | J23: 1687.8 | K23: 446.5 | L23: 193.9 | M23: 163.9 | N23: 0.4 | O23: 3.5 | P23: =SUM(RC[-8]:RC[-1]) -> 36377.100000000006 | Q23: 1405.8 | R23: 27390.5 | S23: 1400.8 | T23: 254.8 | U23: 122.3 | V23: 102.8 | W23: 0.4 | X23: 4.5999999999999996 | Y23: =SUM(RC[-8]:RC[-1]) -> 30681.999999999996
A24: 14 | E24: b. | F24: Diphtheria | G24: =RC[9]+RC[18] -> 2615.3000000000002 | H24: 4 | I24: 648.1 | J24: 572 | K24: 54 | L24: 33.299999999999997 | M24: 24.2 | N24: 0 | O24: 0.7 | P24: =SUM(RC[-8]:RC[-1]) -> 1336.3 | Q24: 2 | R24: 653.79999999999995 | S24: 550.20000000000005 | T24: 36.4 | U24: 20 | V24: 14.9 | W24: 0.4 | X24: 1.3 | Y24: =SUM(RC[-8]:RC[-1]) -> 1279.0000000000002
A25: 15 | E25: c. | F25: Measles | G25: =RC[9]+RC[18] -> 130461.20000000001 | H25: 0 | I25: 49656.3 | J25: 10472.200000000001 | K25: 1275.2 | L25: 420.8 | M25: 219.8 | N25: 179.1 | O25: 34.5 | P25: =SUM(RC[-8]:RC[-1]) -> 62257.9 | Q25: 0 | R25: 51041.7 | S25: 14642.4 | T25: 1735.6 | U25: 376.2 | V25: 120.2 | W25: 200.1 | X25: 87.1 | Y25: =SUM(RC[-8]:RC[-1]) -> 68203.3
A26: 16 | E26: d. | F26: Tetanus | G26: =RC[9]+RC[18] -> 66129.399999999994 | H26: 24679.5 | I26: 297.7 | J26: 1573.6 | K26: 746.8 | L26: 1203.9000000000001 | M26: 873.3 | N26: 669.5 | O26: 1270.5999999999999 | P26: =SUM(RC[-8]:RC[-1]) -> 31314.899999999998 | Q26: 30389.1 | R26: 259.2 | S26: 938.6 | T26: 685.8 | U26: 624.20000000000005 | V26: 472.8 | W26: 608.6 | X26: 836.2 | Y26: =SUM(RC[-8]:RC[-1]) -> 34814.499999999993
A27: 17 | D27: 6. | E27: Meningitis | G27: =RC[9]+RC[18] -> 395230.2 | H27: 110.2 | I27: 75347.399999999994 | J27: 36922.300000000003 | K27: 33704.800000000003 | L27: 26192.7 | M27: 12391.7 | N27: 11244.3 | O27: 14794.7 | P27: =SUM(RC[-8]:RC[-1]) -> 210708.10000000003 | Q27: 79.599999999999994 | R27: 68297.399999999994 | S27: 36823 | T27: 22995 | U27: 16406 | V27: 10428.299999999999 | W27: 11064.3 | X27: 18428.5 | Y27: =SUM(RC[-8]:RC[-1]) -> 184522.09999999998
A28: 18 | D28: 7. | E28: Encephalitis | G28: =RC[9]+RC[18] -> 77868.599999999991 | H28: 7.5 | I28: 13254.8 | J28: 5990.6 | K28: 6341.9 | L28: 5812.2 | M28: 2713.5 | N28: 2289.6 | O28: 3646.2 | P28: =SUM(RC[-8]:RC[-1]) -> 40056.299999999996 | Q28: 5.9 | R28: 13503.3 | S28: 6832.5 | T28: 4999.2 | U28: 3466.4 | V28: 2142 | W28: 2519.4 | X28: 4343.6000000000004 | Y28: =SUM(RC[-8]:RC[-1]) -> 37812.299999999996
A29: 19 | D29: 8. | E29: Acute hepatitis B | G29: =RC[9]+RC[18] -> 149163.9 | H29: 47.9 | I29: 2744.3 | J29: 4931.8 | K29: 10339.1 | L29: 20310 | M29: 17474.599999999999 | N29: 15955.6 | O29: 15334.5 | P29: =SUM(RC[-8]:RC[-1]) -> 87137.8 | Q29: 31 | R29: 1912.6 | S29: 4229.8999999999996 | T29: 5529.1 | U29: 9623.7999999999993 | V29: 10788.7 | W29: 11689.9 | X29: 18221.099999999999 | Y29: =SUM(RC[-8]:RC[-1]) -> 62026.1
A30: 20 | D30: 9. | E30: Acute hepatitis C | G30: =RC[9]+RC[18] -> 38914.199999999997 | H30: 0.1 | I30: 0.7 | J30: 384.4 | K30: 716.3 | L30: 3893 | M30: 6229.2 | N30: 4306.7 | O30: 4895.7 | P30: =SUM(RC[-8]:RC[-1]) -> 20426.100000000002 | Q30: 0.4 | R30: 0.5 | S30: 334.2 | T30: 646.20000000000005 | U30: 2123.6999999999998 | V30: 3348.5 | W30: 3551.9 | X30: 8482.7000000000007 | Y30: =SUM(RC[-8]:RC[-1]) -> 18488.099999999999
A31: 21 | D31: 10. | E31: Parasitic and vector diseases | G31: =RC[9]+RC[18] -> 786181.89999999991 | H31: 194.9 | I31: 250603.6 | J31: 36869.199999999997 | K31: 31893.7 | L31: 36769.300000000003 | M31: 18440.099999999999 | N31: 16070 | O31: 21089.4 | P31: =SUM(RC[-8]:RC[-1]) -> 411930.2 | Q31: 151.69999999999999 | R31: 241605 | S31: 34808.6 | T31: 23213.200000000001 | U31: 24270.5 | V31: 13162.8 | W31: 14049.1 | X31: 22990.799999999999 | Y31: =SUM(RC[-8]:RC[-1]) -> 374251.69999999995
A32: 22 | E32: a. | F32: Malaria | G32: =RC[9]+RC[18] -> 618247.89999999991 | H32: 0.4 | I32: 241265.6 | J32: 14791 | K32: 16014.2 | L32: 18926.099999999999 | M32: 8982.1 | N32: 7033.5 | O32: 9468.2999999999993 | P32: =SUM(RC[-8]:RC[-1]) -> 316481.19999999995 | Q32: 0.5 | R32: 234925.7 | S32: 17469.400000000001 | T32: 13896.6 | U32: 13335 | V32: 5586.8 | W32: 5857.3 | X32: 10695.4 | Y32: =SUM(RC[-8]:RC[-1]) -> 301766.7
A33: 23 | E33: b. | F33: Trypanosomiasis | G33: =RC[9]+RC[18] -> 17970.5 | H33: 0 | I33: 167.9 | J33: 3108.7 | K33: 3813.1 | L33: 2148.5 | M33: 325.10000000000002 | N33: 80.3 | O33: 17 | P33: =SUM(RC[-8]:RC[-1]) -> 9660.6 | Q33: 0 | R33: 194.4 | S33: 3410.2 | T33: 2624 | U33: 1594.7 | V33: 369.9 | W33: 96.5 | X33: 20.2 | Y33: =SUM(RC[-8]:RC[-1]) -> 8309.9000000000015
A34: 24 | E34: c. | F34: Chagas disease | G34: =RC[9]+RC[18] -> 7805.6999999999989 | H34: 0.5 | I34: 1.5 | J34: 2 | K34: 43.4 | L34: 570.70000000000005 | M34: 840.5 | N34: 1077.8 | O34: 1859.9 | P34: =SUM(RC[-8]:RC[-1]) -> 4396.2999999999993 | Q34: 0.2 | R34: 1.1000000000000001 | S34: 1.2 | T34: 15.4 | U34: 257.5 | V34: 540.9 | W34: 781.8 | X34: 1811.3 | Y34: =SUM(RC[-8]:RC[-1]) -> 3409.3999999999996
A35: 25 | E35: d. | F35: Schistosomiasis | G35: =RC[9]+RC[18] -> 21797 | H35: 0 | I35: 771.6 | J35: 6.2 | K35: 867.9 | L35: 3399.3 | M35: 1775.2 | N35: 1894.6 | O35: 1957.7 | P35: =SUM(RC[-8]:RC[-1]) -> 10672.5 | Q35: 0 | R35: 295.89999999999998 | S35: 11.2 | T35: 342.8 | U35: 2790.2 | V35: 2273.9 | W35: 2251.6999999999998 | X35: 3158.8 | Y35: =SUM(RC[-8]:RC[-1]) -> 11124.5
A36: 26 | E36: e. | F36: Leishmaniasis | G36: =RC[9]+RC[18] -> 48403.8 | H36: 76.900000000000006 | I36: 5383.4 | J36: 10139.1 | K36: 6260.5 | L36: 5602.7 | M36: 2436.9 | N36: 1625 | O36: 1699.6 | P36: =SUM(RC[-8]:RC[-1]) -> 33224.100000000006 | Q36: 48.1 | R36: 2674 | S36: 4664.7 | T36: 2764.9 | U36: 2104.6999999999998 | V36: 1039.0999999999999 | W36: 842.5 | X36: 1041.7 | Y36: =SUM(RC[-8]:RC[-1]) -> 15179.699999999999
A37: 27 | E37: f. | F37: Lymphatic filariasis | G37: =RC[9]+RC[18] -> 1.1000000000000001 | H37: 0 | I37: 0 | J37: 0 | K37: 0 | L37: 0.4 | M37: 0 | N37: 0 | O37: 0 | P37: =SUM(RC[-8]:RC[-1]) -> 0.4 | Q37: 0 | R37: 0 | S37: 0 | T37: 0 | U37: 0 | V37: 0.3 | W37: 0.4 | X37: 0 | Y37: =SUM(RC[-8]:RC[-1]) -> 0.7
A38: 28 | E38: g. | F38: Onchocerciasis | G38: =RC[9]+RC[18] -> 0.8 | H38: 0 | I38: 0 | J38: 0 | K38: 0 | L38: 0 | M38: 0 | N38: 0 | O38: 0 | P38: =SUM(RC[-8]:RC[-1]) -> 0 | Q38: 0 | R38: 0 | S38: 0 | T38: 0 | U38: 0 | V38: 0 | W38: 0 | X38: 0.8 | Y38: =SUM(RC[-8]:RC[-1]) -> 0.8
A39: 29 | E39: h. | F39: Leprosy | G39: =RC[9]+RC[18] -> 7789.6 | H39: 0 | I39: 0 | J39: 58.2 | K39: 12.6 | L39: 743.5 | M39: 1074.2 | N39: 1456.8 | O39: 1461.2 | P39: =SUM(RC[-8]:RC[-1]) -> 4806.5 | Q39: 0 | R39: 244 | S39: 34.299999999999997 | T39: 65.3 | U39: 303.2 | V39: 568.6 | W39: 766.5 | X39: 1001.2 | Y39: =SUM(RC[-8]:RC[-1]) -> 2983.1000000000004
A40: 30 | E40: i. | F40: Dengue | G40: =RC[9]+RC[18] -> 28755 | H40: 113.2 | I40: 1497.4 | J40: 2076.9 | K40: 1916.2 | L40: 2253.6999999999998 | M40: 1365.5 | N40: 1405.6 | O40: 3058.7 | P40: =SUM(RC[-8]:RC[-1]) -> 13687.2 | Q40: 101.2 | R40: 1860.4 | S40: 1894 | T40: 1568.9 | U40: 2096.4 | V40: 1488.4 | W40: 2124.6999999999998 | X40: 3933.8 | Y40: =SUM(RC[-8]:RC[-1]) -> 15067.8
A41: 31 | E41: j. | F41: Trachoma | G41: =RC[9]+RC[18] -> 0.4 | H41: 0 | I41: 0 | J41: 0 | K41: 0 | L41: 0 | M41: 0 | N41: 0.4 | O41: 0 | P41: =SUM(RC[-8]:RC[-1]) -> 0.4 | Q41: 0 | R41: 0 | S41: 0 | T41: 0 | U41: 0 | V41: 0 | W41: 0 | X41: 0 | Y41: =SUM(RC[-8]:RC[-1]) -> 0
A42: 32 | E42: k. | F42: Rabies | G42: =RC[9]+RC[18] -> 35410 | H42: 3.9 | I42: 1516.1 | J42: 6687.1 | K42: 2965.8 | L42: 3124.6 | M42: 1640.7 | N42: 1496.1 | O42: 1567 | P42: =SUM(RC[-8]:RC[-1]) -> 19001.300000000003 | Q42: 1.7 | R42: 1409.6 | S42: 7323.6 | T42: 1935.2 | U42: 1788.7 | V42: 1294.8 | W42: 1327.6 | X42: 1327.5 | Y42: =SUM(RC[-8]:RC[-1]) -> 16408.7
A43: 33 | D43: 11. | E43: Intestinal nematode infections | G43: =RC[9]+RC[18] -> 3303.7000000000003 | H43: 7.5 | I43: 601.29999999999995 | J43: 390.3 | K43: 56.1 | L43: 94.4 | M43: 145.19999999999999 | N43: 163 | O43: 264.60000000000002 | P43: =SUM(RC[-8]:RC[-1]) -> 1722.4 | Q43: 5.9 | R43: 519.6 | S43: 372.9 | T43: 45.1 | U43: 97.9 | V43: 76.8 | W43: 154.4 | X43: 308.7 | Y43: =SUM(RC[-8]:RC[-1]) -> 1581.3000000000002
A44: 34 | E44: a. | F44: Ascariasis | G44: =RC[9]+RC[18] -> 3302.1000000000004 | H44: 7.5 | I44: 601.20000000000005 | J44: 390.3 | K44: 55.9 | L44: 94.4 | M44: 145.19999999999999 | N44: 163 | O44: 264.3 | P44: =SUM(RC[-8]:RC[-1]) -> 1721.8000000000002 | Q44: 5.9 | R44: 519.6 | S44: 372.9 | T44: 45.1 | U44: 96.9 | V44: 76.8 | W44: 154.4 | X44: 308.7 | Y44: =SUM(RC[-8]:RC[-1]) -> 1580.3000000000002
A45: 35 | E45: b. | F45: Trichuriasis | G45: =RC[9]+RC[18] -> 0 | H45: 0 | I45: 0 | J45: 0 | K45: 0 | L45: 0 | M45: 0 | N45: 0 | O45: 0 | P45: =SUM(RC[-8]:RC[-1]) -> 0 | Q45: 0 | R45: 0 | S45: 0 | T45: 0 | U45: 0 | V45: 0 | W45: 0 | X45: 0 | Y45: =SUM(RC[-8]:RC[-1]) -> 0
A46: 36 | E46: c. | F46: Hookworm disease | G46: =RC[9]+RC[18] -> 1.7 | H46: 0 | I46: 0.2 | J46: 0 | K46: 0.2 | L46: 0 | M46: 0 | N46: 0 | O46: 0.3 | P46: =SUM(RC[-8]:RC[-1]) -> 0.7 | Q46: 0 | R46: 0 | S46: 0 | T46: 0 | U46: 1 | V46: 0 | W46: 0 | X46: 0 | Y46: =SUM(RC[-8]:RC[-1]) -> 1
A47: 37 | D47: 12. | E47: Other infectious diseases | G47: =RC[9]+RC[18] -> 663507.30000000005 | H47: 7673.2 | I47: 48873 | J47: 55249.9 | K47: 42892.5 | L47: 43483.1 | M47: 28371.7 | N47: 35837.800000000003 | O47: 86824 | P47: =SUM(RC[-8]:RC[-1]) -> 349205.2 | Q47: 6071.8 | R47: 41302.1 | S47: 47399 | T47: 33627.699999999997 | U47: 29898.1 | V47: 21312.1 | W47: 30735.599999999999 | X47: 103955.7 | Y47: =SUM(RC[-8]:RC[-1]) -> 314302.09999999998
A48: 38 | C48: B. | D48: Respiratory infections | G48: =RC[9]+RC[18] -> 3060836.5999999996 | H48: 79798.100000000006 | I48: 469438.1 | J48: 61176.6 | K48: 55168.1 | L48: 93535.3 | M48: 91549.9 | N48: 144658.5 | O48: 603631.30000000005 | P48: =SUM(RC[-8]:RC[-1]) -> 1598955.9 | Q48: 62716.4 | R48: 386084.6 | S48: 61465.9 | T48: 48259.1 | U48: 61609.7 | V48: 59395.1 | W48: 111542.39999999999 | X48: 670807.5 | Y48: =SUM(RC[-8]:RC[-1]) -> 1461880.7
A49: 39 | D49: 1. | E49: Lower respiratory infections | G49: =RC[9]+RC[18] -> 3051988.1000000006 | H49: 79587.3 | I49: 467770.6 | J49: 60857.8 | K49: 54946.3 | L49: 93190.1 | M49: 91269.4 | N49: 144231.70000000001 | O49: 602556.80000000005 | P49: =SUM(RC[-8]:RC[-1]) -> 1594410.0000000002 | Q49: 62544 | R49: 384711.4 | S49: 61185.2 | T49: 48059.6 | U49: 61351.7 | V49: 59186.8 | W49: 111224.3 | X49: 669315.1 | Y49: =SUM(RC[-8]:RC[-1]) -> 1457578.1
A50: 40 | D50: 2. | E50: Upper respiratory infections | G50: =RC[9]+RC[18] -> 6038.2 | H50: 167.1 | I50: 1017.4 | J50: 164.3 | K50: 122 | L50: 219.6 | M50: 185 | N50: 277.7 | O50: 927.9 | P50: =SUM(RC[-8]:RC[-1]) -> 3081 | Q50: 131.30000000000001 | R50: 799.5 | S50: 127.2 | T50: 118.9 | U50: 126.1 | V50: 113.2 | W50: 238 | X50: 1303 | Y50: =SUM(RC[-8]:RC[-1]) -> 2957.2
A51: 41 | D51: 3. | E51: Otitis media | G51: =RC[9]+RC[18] -> 2809.7 | H51: 43.6 | I51: 650.1 | J51: 154.4 | K51: 99.8 | L51: 125.6 | M51: 95.5 | N51: 149.1 | O51: 146.5 | P51: =SUM(RC[-8]:RC[-1]) -> 1464.6 | Q51: 41.1 | R51: 573.6 | S51: 153.5 | T51: 80.5 | U51: 131.9 | V51: 95 | W51: 80.099999999999994 | X51: 189.4 | Y51: =SUM(RC[-8]:RC[-1]) -> 1345.1
A52: 42 | C52: C. | D52: Maternal conditions | G52: =RC[9]+RC[18] -> 296001.70000000007 | H52: 0 | I52: 0 | J52: 0 | K52: 0 | L52: 0 | M52: 0 | N52: 0 | O52: 0 | P52: =SUM(RC[-8]:RC[-1]) -> 0 | Q52: 0 | R52: 0 | S52: 52.8 | T52: 150983.4 | U52: 144899.70000000001 | V52: 58.2 | W52: 3.9 | X52: 3.7 | Y52: =SUM(RC[-8]:RC[-1]) -> 296001.70000000007
A53: 49 | C53: D. | D53: Neonatal conditions | G53: =RC[9]+RC[18] -> 2475074.7000000002 | H53: 1248674.3 | I53: 129409 | J53: 39 | K53: 35.6 | L53: 25.2 | M53: 4.3 | N53: 18.2 | O53: 22 | P53: =SUM(RC[-8]:RC[-1]) -> 1378227.6 | Q53: 1007414.1 | R53: 89198 | S53: 162.6 | T53: 17.8 | U53: 9.9 | V53: 26.9 | W53: 4.3 | X53: 13.5 | Y53: =SUM(RC[-8]:RC[-1]) -> 1096847.1000000001
A54: 50 | D54: 1. | E54: Preterm birth complications | G54: =RC[9]+RC[18] -> 1134953.7999999998 | H54: 546058.69999999995 | I54: 75286.899999999994 | J54: 4.5 | K54: 5 | L54: 0.7 | M54: 0 | N54: 0.4 | O54: 1.6 | P54: =SUM(RC[-8]:RC[-1]) -> 621357.79999999993 | Q54: 460369.5 | R54: 53215 | S54: 3.1 | T54: 1.1000000000000001 | U54: 1 | V54: 0 | W54: 0.4 | X54: 5.9 | Y54: =SUM(RC[-8]:RC[-1]) -> 513596
A55: 51 | D55: 2. | E55: Birth asphyxia and birth trauma | G55: =RC[9]+RC[18] -> 743908.39999999991 | H55: 389098.6 | I55: 36956.9 | J55: 23.3 | K55: 30.1 | L55: 13.3 | M55: 4.3 | N55: 3.3 | O55: 16.3 | P55: =SUM(RC[-8]:RC[-1]) -> 426146.09999999992 | Q55: 294380 | R55: 23331.200000000001 | S55: 17.2 | T55: 16.7 | U55: 7.9 | V55: 2.8 | W55: 3.9 | X55: 2.6 | Y55: =SUM(RC[-8]:RC[-1]) -> 317762.30000000005
A56: 52 | D56: 3. | E56: Neonatal sepsis and infections | G56: =RC[9]+RC[18] -> 431067.4 | H56: 240558.9 | I56: 36.799999999999997 | J56: 11.2 | K56: 0.5 | L56: 11.3 | M56: 0 | N56: 14.5 | O56: 4.0999999999999996 | P56: =SUM(RC[-8]:RC[-1]) -> 240637.3 | Q56: 190218.3 | R56: 39.200000000000003 | S56: 142.4 | T56: 0 | U56: 1 | V56: 24.2 | W56: 0 | X56: 5 | Y56: =SUM(RC[-8]:RC[-1]) -> 190430.1
A57: 53 | D57: 4. | E57: Other neonatal conditions | G57: =RC[9]+RC[18] -> 165145.40000000002 | H57: 72958.100000000006 | I57: 17128.3 | J57: 0 | K57: 0 | L57: 0 | M57: 0 | N57: 0 | O57: 0 | P57: =SUM(RC[-8]:RC[-1]) -> 90086.400000000009 | Q57: 62446.3 | R57: 12612.7 | S57: 0 | T57: 0 | U57: 0 | V57: 0 | W57: 0 | X57: 0 | Y57: =SUM(RC[-8]:RC[-1]) -> 75059
A58: 54 | C58: E. | D58: Nutritional deficiencies | G58: =RC[9]+RC[18] -> 559172.39999999991 | H58: 292.7 | I58: 81498.3 | J58: 29829.4 | K58: 22386.799999999999 | L58: 25025 | M58: 14219.7 | N58: 20600.3 | O58: 62941.2 | P58: =SUM(RC[-8]:RC[-1]) -> 256793.39999999997 | Q58: 255.5 | R58: 75073.2 | S58: 32950.800000000003 | T58: 26247.1 | U58: 27112.6 | V58: 16098.9 | W58: 24636.6 | X58: 100004.3 | Y58: =SUM(RC[-8]:RC[-1]) -> 302379
A59: 55 | D59: 1. | E59: Protein-energy malnutrition | G59: =RC[9]+RC[18] -> 456507.6 | H59: 262.10000000000002 | I59: 76922.399999999994 | J59: 25112.3 | K59: 15175.6 | L59: 18887.2 | M59: 11068.6 | N59: 15978.6 | O59: 47633.4 | P59: =SUM(RC[-8]:RC[-1]) -> 211040.2 | Q59: 230.3 | R59: 70942.899999999994 | S59: 27433.200000000001 | T59: 17505.3 | U59: 20440.7 | V59: 12610.4 | W59: 19509.599999999999 | X59: 76795 | Y59: =SUM(RC[-8]:RC[-1]) -> 245467.4
A60: 56 | D60: 2. | E60: Iodine deficiency | G60: =RC[9]+RC[18] -> 3245.6000000000004 | H60: 0.1 | I60: 103.4 | J60: 129.6 | K60: 739.8 | L60: 310.5 | M60: 51.7 | N60: 69.900000000000006 | O60: 166.3 | P60: =SUM(RC[-8]:RC[-1]) -> 1571.3000000000002 | Q60: 0.5 | R60: 74.599999999999994 | S60: 135.19999999999999 | T60: 743.4 | U60: 315.60000000000002 | V60: 61.4 | W60: 72.900000000000006 | X60: 270.7 | Y60: =SUM(RC[-8]:RC[-1]) -> 1674.3000000000002
A61: 57 | D61: 3. | E61: Vitamin A deficiency | G61: =RC[9]+RC[18] -> 121.19999999999999 | H61: 0 | I61: 0 | J61: 0 | K61: 0 | L61: 0.4 | M61: 0.4 | N61: 1.2 | O61: 1.1000000000000001 | P61: =SUM(RC[-8]:RC[-1]) -> 3.1 | Q61: 0 | R61: 0 | S61: 0 | T61: 0.3 | U61: 38.6 | V61: 1.9 | W61: 1.9 | X61: 75.400000000000006 | Y61: =SUM(RC[-8]:RC[-1]) -> 118.1
A62: 58 | D62: 4. | E62: Iron-deficiency anaemia | G62: =RC[9]+RC[18] -> 90160.2 | H62: 21.4 | I62: 4186 | J62: 4503.2 | K62: 6319.3 | L62: 5530.8 | M62: 2836 | N62: 4107.8 | O62: 12584.2 | P62: =SUM(RC[-8]:RC[-1]) -> 40088.699999999997 | Q62: 18.2 | R62: 3778.9 | S62: 5264.6 | T62: 7821.1 | U62: 6029.1 | V62: 3180.1 | W62: 4723.5 | X62: 19256 | Y62: =SUM(RC[-8]:RC[-1]) -> 50071.5
A63: 59 | D63: 5. | E63: Other nutritional deficiencies | G63: =RC[9]+RC[18] -> 9138.1 | H63: 9.1 | I63: 286.5 | J63: 84.2 | K63: 152.1 | L63: 296.10000000000002 | M63: 263 | N63: 442.9 | O63: 2556.1999999999998 | P63: =SUM(RC[-8]:RC[-1]) -> 4090.1 | Q63: 6.7 | R63: 276.8 | S63: 117.9 | T63: 176.9 | U63: 288.5 | V63: 245.1 | W63: 328.7 | X63: 3607.4 | Y63: =SUM(RC[-8]:RC[-1]) -> 5048
A64: 60 | B64: II. | C64: Noncommunicable diseases | G64: =RC[9]+RC[18] -> 37892227 | H64: 147967 | I64: 223613.4 | J64: 165876 | K64: 426782.3 | L64: 1735468.4 | M64: 2643997.7000000002 | N64: 4130605.7 | O64: 10288890.300000001 | P64: =SUM(RC[-8]:RC[-1]) -> 19763200.800000001 | Q64: 126915.6 | R64: 212001.2 | S64: 164317.6 | T64: 333697.8 | U64: 1188226.7 | V64: 1687668.3 | W64: 2879050.9 | X64: 11537148.1 | Y64: =SUM(RC[-8]:RC[-1]) -> 18129026.199999999
A65: 61 | C65: A. | D65: Malignant neoplasms | G65: =RC[9]+RC[18] -> 8206216 | H65: 8.3000000000000007 | I65: 16843.099999999999 | J65: 29653.200000000001 | K65: 73653 | L65: 421759.5 | M65: 771135.2 | N65: 1136346.8999999999 | O65: 2211903.2000000002 | P65: =SUM(RC[-8]:RC[-1]) -> 4661302.4000000004 | Q65: 8.9 | R65: 13255.1 | S65: 19907.2 | T65: 63841.599999999999 | U65: 456830.1 | V65: 585342.19999999995 | W65: 747943 | X65: 1657785.5 | Y65: =SUM(RC[-8]:RC[-1]) -> 3544913.5999999996
A66: 62 | D66: 1. | E66: Mouth and oropharynx cancers | G66: =RC[9]+RC[18] -> 298027.3 | H66: 0 | I66: 14.7 | J66: 469.9 | K66: 3558.6 | L66: 39509 | M66: 57051.5 | N66: 58032.2 | O66: 57110.1 | P66: =SUM(RC[-8]:RC[-1]) -> 215746 | Q66: 0 | R66: 17.600000000000001 | S66: 408.6 | T66: 2064.8000000000002 | U66: 14077.8 | V66: 17437.400000000001 | W66: 19907.400000000001 | X66: 28367.7 | Y66: =SUM(RC[-8]:RC[-1]) -> 82281.3
A67: 63 | D67: 2. | E67: Oesophagus cancer | G67: =RC[9]+RC[18] -> 405802.7 | H67: 0 | I67: 2.9 | J67: 0.8 | K67: 720 | L67: 20359.7 | M67: 57438.1 | N67: 83291.7 | O67: 123458.8 | P67: =SUM(RC[-8]:RC[-1]) -> 285272 | Q67: 0 | R67: 0 | S67: 1.1000000000000001 | T67: 746.5 | U67: 9276.9 | V67: 16558.5 | W67: 28336.9 | X67: 65610.8 | Y67: =SUM(RC[-8]:RC[-1]) -> 120530.70000000001
A68: 64 | D68: 3. | E68: Stomach cancer | G68: =RC[9]+RC[18] -> 733499.4 | H68: 0 | I68: 5.5 | J68: 8.1 | K68: 3243.4 | L68: 38879.800000000003 | M68: 80237 | N68: 122874.9 | O68: 230633 | P68: =SUM(RC[-8]:RC[-1]) -> 475881.7 | Q68: 0 | R68: 0.8 | S68: 6.1 | T68: 2214.9 | U68: 24744.1 | V68: 34491.199999999997 | W68: 51273.8 | X68: 144886.79999999999 | Y68: =SUM(RC[-8]:RC[-1]) -> 257617.69999999998
A69: 65 | D69: 4. | E69: Colon and rectum cancers | G69: =RC[9]+RC[18] -> 723912.7 | H69: 0 | I69: 7.5 | J69: 18.899999999999999 | K69: 3858 | L69: 31189.9 | M69: 55560.6 | N69: 91131.9 | O69: 208703 | P69: =SUM(RC[-8]:RC[-1]) -> 390469.8 | Q69: 0 | R69: 3 | S69: 11.5 | T69: 3576.4 | U69: 26244.9 | V69: 39774.699999999997 | W69: 61228.7 | X69: 202603.7 | Y69: =SUM(RC[-8]:RC[-1]) -> 333442.90000000002
A70: 66 | D70: 5. | E70: Liver cancer | G70: =RC[9]+RC[18] -> 740372.9 | H70: 0 | I70: 92.3 | J70: 1670.5 | K70: 8156 | L70: 85627.3 | M70: 114293.8 | N70: 121367.9 | O70: 185490.7 | P70: =SUM(RC[-8]:RC[-1]) -> 516698.50000000006 | Q70: 0 | R70: 71.8 | S70: 838.9 | T70: 2671.7 | U70: 22898.400000000001 | V70: 35387.599999999999 | W70: 48123.1 | X70: 113682.9 | Y70: =SUM(RC[-8]:RC[-1]) -> 223674.4
A71: 67 | D71: 6. | E71: Pancreas cancer | G71: =RC[9]+RC[18] -> 331918.40000000002 | H71: 0 | I71: 1.5 | J71: 4.5999999999999996 | K71: 507.6 | L71: 10432.1 | M71: 29839.5 | N71: 48646.3 | O71: 85444.7 | P71: =SUM(RC[-8]:RC[-1]) -> 174876.3 | Q71: 0 | R71: 1.4 | S71: 3.4 | T71: 391.6 | U71: 6841.3 | V71: 18455.2 | W71: 34657.800000000003 | X71: 96691.4 | Y71: =SUM(RC[-8]:RC[-1]) -> 157042.1
A72: 68 | D72: 7. | E72: Trachea, bronchus, lung cancers | G72: =RC[9]+RC[18] -> 1599557 | H72: 0 | I72: 29.4 | J72: 39.299999999999997 | K72: 2243.3000000000002 | L72: 62111.8 | M72: 184124.2 | N72: 301534.90000000002 | O72: 556552.6 | P72: =SUM(RC[-8]:RC[-1]) -> 1106635.5 | Q72: 0 | R72: 18.2 | S72: 25.3 | T72: 1409.9 | U72: 30812.1 | V72: 70689.600000000006 | W72: 115529 | X72: 274437.40000000002 | Y72: =SUM(RC[-8]:RC[-1]) -> 492921.5
A73: 69 | D73: 8. | E73: Melanoma and other skin cancers | G73: =RC[9]+RC[18] -> 94972.7 | H73: 0 | I73: 9.1999999999999993 | J73: 6.7 | K73: 880.7 | L73: 5242.9 | M73: 7975.2 | N73: 12123.5 | O73: 27874.3 | P73: =SUM(RC[-8]:RC[-1]) -> 54112.5 | Q73: 0 | R73: 6.5 | S73: 17.899999999999999 | T73: 724.8 | U73: 4260.8999999999996 | V73: 5214.1000000000004 | W73: 7119.7 | X73: 23516.3 | Y73: =SUM(RC[-8]:RC[-1]) -> 40860.199999999997
A74: 70 | D74: 9. | E74: Breast cancer | G74: =RC[9]+RC[18] -> 536521.4 | H74: 0 | I74: 0.3 | J74: 0 | K74: 0 | L74: 0 | M74: 0 | N74: 0 | O74: 0 | P74: =SUM(RC[-8]:RC[-1]) -> 0.3 | Q74: 0 | R74: 1.1000000000000001 | S74: 3.7 | T74: 7972.7 | U74: 123726.8 | V74: 118224.2 | W74: 111156.5 | X74: 175436.1 | Y74: =SUM(RC[-8]:RC[-1]) -> 536521.1
A75: 71 | D75: 10. | E75: Cervix uteri cancer | G75: =RC[9]+RC[18] -> 264224.89999999997 | H75: 0 | I75: 0 | J75: 0 | K75: 0 | L75: 0 | M75: 0 | N75: 0 | O75: 0 | P75: =SUM(RC[-8]:RC[-1]) -> 0 | Q75: 0 | R75: 0.5 | S75: 1.3 | T75: 4607.7 | U75: 73084 | V75: 68478.8 | W75: 56925.3 | X75: 61127.3 | Y75: =SUM(RC[-8]:RC[-1]) -> 264224.89999999997
A76: 72 | D76: 11. | E76: Corpus uteri cancer | G76: =RC[9]+RC[18] -> 78669.899999999994 | H76: 0 | I76: 0 | J76: 0 | K76: 0 | L76: 0 | M76: 0 | N76: 0 | O76: 0 | P76: =SUM(RC[-8]:RC[-1]) -> 0 | Q76: 0 | R76: 0.5 | S76: 0.7 | T76: 482.1 | U76: 7026.9 | V76: 14622.4 | W76: 20444.3 | X76: 36093 | Y76: =SUM(RC[-8]:RC[-1]) -> 78669.899999999994
A77: 73 | D77: 12. | E77: Ovary cancer | G77: =RC[9]+RC[18] -> 151039.29999999999 | H77: 0 | I77: 0 | J77: 0 | K77: 0 | L77: 0 | M77: 0 | N77: 0 | O77: 0 | P77: =SUM(RC[-8]:RC[-1]) -> 0 | Q77: 0 | R77: 4.2 | S77: 34.200000000000003 | T77: 3307.2 | U77: 23369.7 | V77: 33335.4 | W77: 36975.9 | X77: 54012.7 | Y77: =SUM(RC[-8]:RC[-1]) -> 151039.29999999999
A78: 74 | D78: 13. | E78: Prostate cancer | G78: =RC[9]+RC[18] -> 321728.3 | H78: 0 | I78: 4.9000000000000004 | J78: 2.2999999999999998 | K78: 537.4 | L78: 1816.1 | M78: 10199.799999999999 | N78: 47669.1 | O78: 261498.6 | P78: =SUM(RC[-8]:RC[-1]) -> 321728.2 | Q78: 0 | R78: 0.1 | S78: 0 | T78: 0 | U78: 0 | V78: 0 | W78: 0 | X78: 0 | Y78: =SUM(RC[-8]:RC[-1]) -> 0.1
A79: 75 | D79: 14. | E79: Bladder cancer | G79: =RC[9]+RC[18] -> 172813.3 | H79: 0 | I79: 5.6 | J79: 3.9 | K79: 348 | L79: 4027.5 | M79: 11909.2 | N79: 26083 | O79: 86423.6 | P79: =SUM(RC[-8]:RC[-1]) -> 128800.8 | Q79: 0 | R79: 1.8 | S79: 1.1000000000000001 | T79: 133.19999999999999 | U79: 1642.8 | V79: 3683.9 | W79: 6822.6 | X79: 31727.1 | Y79: =SUM(RC[-8]:RC[-1]) -> 44012.5
A80: 76 | D80: 15. | E80: Lymphomas, multiple myeloma | G80: =RC[9]+RC[18] -> 312302.09999999998 | H80: 0.3 | I80: 1568.9 | J80: 4104.6000000000004 | K80: 8139.6 | L80: 20925.8 | M80: 26878.2 | N80: 39797.4 | O80: 75984.399999999994 | P80: =SUM(RC[-8]:RC[-1]) -> 177399.19999999998 | Q80: 0.9 | R80: 1172.0999999999999 | S80: 1724.8 | T80: 4910.8999999999996 | U80: 12557.7 | V80: 17101.400000000001 | W80: 26802.6 | X80: 70632.5 | Y80: =SUM(RC[-8]:RC[-1]) -> 134902.9
A81: 77 | D81: 16. | E81: Leukaemia | G81: =RC[9]+RC[18] -> 276097.30000000005 | H81: 0 | I81: 8235.5 | J81: 10391 | K81: 16736.3 | L81: 21610.799999999999 | M81: 18013.599999999999 | N81: 25945.4 | O81: 55560.800000000003 | P81: =SUM(RC[-8]:RC[-1]) -> 156493.40000000002 | Q81: 0 | R81: 6438.6 | S81: 6330.6 | T81: 10800.1 | U81: 17795.7 | V81: 14081.7 | W81: 18057.900000000001 | X81: 46099.3 | Y81: =SUM(RC[-8]:RC[-1]) -> 119603.90000000001
A82: 78 | E82: Other malignant neoplasms | G82: =RC[9]+RC[18] -> 1164756.1000000001 | H82: 7.9 | I82: 6865 | J82: 12932.7 | K82: 24724.1 | L82: 80026.8 | M82: 117614.5 | N82: 157848.70000000001 | O82: 257168.6 | P82: =SUM(RC[-8]:RC[-1]) -> 657188.30000000005 | Q82: 8 | R82: 5516.8 | S82: 10497.8 | T82: 17827.099999999999 | U82: 58470 | V82: 77806.100000000006 | W82: 104581.3 | X82: 232860.7 | Y82: =SUM(RC[-8]:RC[-1]) -> 507567.8
A83: 79 | C83: B. | D83: Other neoplasms | G83: =RC[9]+RC[18] -> 193024.59999999998 | H83: 38.799999999999997 | I83: 1354.1 | J83: 1923.4 | K83: 4669.5 | L83: 9562.5 | M83: 13037.3 | N83: 19611.3 | O83: 50012.7 | P83: =SUM(RC[-8]:RC[-1]) -> 100209.59999999999 | Q83: 27.5 | R83: 1233.7 | S83: 1583.5 | T83: 2366.5 | U83: 11312.2 | V83: 10532.8 | W83: 14540.1 | X83: 51218.7 | Y83: =SUM(RC[-8]:RC[-1]) -> 92815
A84: 80 | C84: C. | D84: Diabetes mellitus | G84: =RC[9]+RC[18] -> 1497370.8 | H84: 763.6 | I84: 2451.1999999999998 | J84: 2263.1 | K84: 10250.700000000001 | L84: 60549.1 | M84: 107092.3 | N84: 169426 | O84: 331549.5 | P84: =SUM(RC[-8]:RC[-1]) -> 684345.5 | Q84: 753.2 | R84: 2400.5 | S84: 4065 | T84: 10811.8 | U84: 45451.6 | V84: 92951 | W84: 183234.4 | X84: 473357.8 | Y84: =SUM(RC[-8]:RC[-1]) -> 813025.3
A85: 81 | C85: D. | D85: Endocrine, blood, immune disorders | G85: =RC[9]+RC[18] -> 410518.2 | H85: 0 | I85: 13987.2 | J85: 16064.9 | K85: 16889.2 | L85: 22538.2 | M85: 19347.5 | N85: 25699.9 | O85: 60059.9 | P85: =SUM(RC[-8]:RC[-1]) -> 174586.8 | Q85: 0 | R85: 21368.1 | S85: 26772.5 | T85: 23439.5 | U85: 23796.5 | V85: 18849.099999999999 | W85: 27167.1 | X85: 94538.6 | Y85: =SUM(RC[-8]:RC[-1]) -> 235931.40000000002
A86: 82 | C86: E. | D86: Mental and behavioral disorders | G86: =RC[9]+RC[18] -> 257338.59999999998 | H86: 0 | I86: 171.4 | J86: 2068.6999999999998 | K86: 22328 | L86: 61399.7 | M86: 39603.800000000003 | N86: 26217.5 | O86: 26565.5 | P86: =SUM(RC[-8]:RC[-1]) -> 178354.59999999998 | Q86: 0 | R86: 87.3 | S86: 1613.9 | T86: 8146.7 | U86: 19432.900000000001 | V86: 14241.9 | W86: 10696.5 | X86: 24764.799999999999 | Y86: =SUM(RC[-8]:RC[-1]) -> 78984
A87: 83 | D87: 1. | E87: Unipolar depressive disorders | G87: =RC[9]+RC[18] -> 4320.3999999999996 | H87: 0 | I87: 0 | J87: 0.8 | K87: 23.9 | L87: 176.6 | M87: 176.2 | N87: 204.9 | O87: 998.3 | P87: =SUM(RC[-8]:RC[-1]) -> 1580.6999999999998 | Q87: 0 | R87: 0.3 | S87: 0.7 | T87: 25.9 | U87: 175.9 | V87: 201.8 | W87: 232.2 | X87: 2102.9 | Y87: =SUM(RC[-8]:RC[-1]) -> 2739.7
A88: 84 | D88: 2. | E88: Bipolar disorder | G88: =RC[9]+RC[18] -> 738.40000000000009 | H88: 0 | I88: 0 | J88: 0 | K88: 8 | L88: 32 | M88: 43.2 | N88: 50.9 | O88: 159 | P88: =SUM(RC[-8]:RC[-1]) -> 293.10000000000002 | Q88: 0 | R88: 0 | S88: 0 | T88: 3.1 | U88: 33.200000000000003 | V88: 45.8 | W88: 88.7 | X88: 274.5 | Y88: =SUM(RC[-8]:RC[-1]) -> 445.3
A89: 85 | D89: 3. | E89: Schizophrenia | G89: =RC[9]+RC[18] -> 21102 | H89: 0 | I89: 0 | J89: 1.4 | K89: 563.20000000000005 | L89: 3083.1 | M89: 2048.1999999999998 | N89: 2141.1999999999998 | O89: 3037.8 | P89: =SUM(RC[-8]:RC[-1]) -> 10874.9 | Q89: 0 | R89: 0 | S89: 0 | T89: 435.1 | U89: 2620.1 | V89: 1665.2 | W89: 1737.7 | X89: 3769 | Y89: =SUM(RC[-8]:RC[-1]) -> 10227.099999999999
A90: 86 | D90: 4. | E90: Alcohol use disorders | G90: =RC[9]+RC[18] -> 107260.5 | H90: 0 | I90: 0 | J90: 0 | K90: 3386.1 | L90: 29483.7 | M90: 26436.1 | N90: 17093.7 | O90: 9643.9 | P90: =SUM(RC[-8]:RC[-1]) -> 86043.5 | Q90: 0 | R90: 0 | S90: 0.1 | T90: 775.9 | U90: 6104.6 | V90: 6440.1 | W90: 4403.6000000000004 | X90: 3492.7 | Y90: =SUM(RC[-8]:RC[-1]) -> 21217.000000000004
A91: 87 | D91: 5. | E91: Drug use disorders | G91: =RC[9]+RC[18] -> 93254.700000000012 | H91: 0 | I91: 0 | J91: 1578.5 | K91: 17142.8 | L91: 26381.8 | M91: 9088.4 | N91: 4507.5 | O91: 5487.3 | P91: =SUM(RC[-8]:RC[-1]) -> 64186.3 | Q91: 0 | R91: 0 | S91: 1289.0999999999999 | T91: 5940.5 | U91: 8970.7000000000007 | V91: 4813.7 | W91: 2830.4 | X91: 5224 | Y91: =SUM(RC[-8]:RC[-1]) -> 29068.400000000001
A92: 88 | D92: 6. | E92: Anxiety disorders | G92: =RC[9]+RC[18] -> 66.099999999999994 | H92: 0 | I92: 0 | J92: 0 | K92: 1.4 | L92: 7 | M92: 5.8 | N92: 11.3 | O92: 19.8 | P92: =SUM(RC[-8]:RC[-1]) -> 45.3 | Q92: 0 | R92: 0 | S92: 0 | T92: 0.7 | U92: 3.4 | V92: 2.5 | W92: 2.4 | X92: 11.8 | Y92: =SUM(RC[-8]:RC[-1]) -> 20.8
A93: 89 | D93: 7. | E93: Eating disorders | G93: =RC[9]+RC[18] -> 9118.4 | H93: 0 | I93: 0 | J93: 180.2 | K93: 551.79999999999995 | L93: 562.6 | M93: 251.3 | N93: 312.2 | O93: 1740.1 | P93: =SUM(RC[-8]:RC[-1]) -> 3598.2 | Q93: 0 | R93: 0 | S93: 166 | T93: 734.5 | U93: 852.3 | V93: 385.4 | W93: 393.3 | X93: 2988.7 | Y93: =SUM(RC[-8]:RC[-1]) -> 5520.2
A94: 90 | D94: 8. | E94: Pervasive developmental disorders | G94: =RC[9]+RC[18] -> 0 | H94: 0 | I94: 0 | J94: 0 | K94: 0 | L94: 0 | M94: 0 | N94: 0 | O94: 0 | P94: =SUM(RC[-8]:RC[-1]) -> 0 | Q94: 0 | R94: 0 | S94: 0 | T94: 0 | U94: 0 | V94: 0 | W94: 0 | X94: 0 | Y94: =SUM(RC[-8]:RC[-1]) -> 0
A95: 91 | D95: 9. | E95: Childhood behavioural disorders | G95: =RC[9]+RC[18] -> 0 | H95: 0 | I95: 0 | J95: 0 | K95: 0 | L95: 0 | M95: 0 | N95: 0 | O95: 0 | P95: =SUM(RC[-8]:RC[-1]) -> 0 | Q95: 0 | R95: 0 | S95: 0 | T95: 0 | U95: 0 | V95: 0 | W95: 0 | X95: 0 | Y95: =SUM(RC[-8]:RC[-1]) -> 0
A96: 92 | D96: 10. | E96: Idiopathic intellectual disability | G96: =RC[9]+RC[18] -> 1768.1 | H96: 0 | I96: 8.4 | J96: 25.5 | K96: 102.3 | L96: 209.1 | M96: 191.6 | N96: 221.3 | O96: 225.1 | P96: =SUM(RC[-8]:RC[-1]) -> 983.30000000000007 | Q96: 0 | R96: 14.9 | S96: 28.9 | T96: 68.2 | U96: 196.5 | V96: 115.4 | W96: 119.5 | X96: 241.4 | Y96: =SUM(RC[-8]:RC[-1]) -> 784.8
A97: 93 | D97: 11. | E97: Other mental and behavioural disorders | G97: =RC[9]+RC[18] -> 19710.8 | H97: 0 | I97: 163.1 | J97: 282.3 | K97: 548.70000000000005 | L97: 1463.8 | M97: 1363.1 | N97: 1674.6 | O97: 5254.2 | P97: =SUM(RC[-8]:RC[-1]) -> 10749.8 | Q97: 0 | R97: 72 | S97: 129.19999999999999 | T97: 162.80000000000001 | U97: 476.3 | V97: 572.1 | W97: 888.7 | X97: 6659.9 | Y97: =SUM(RC[-8]:RC[-1]) -> 8961
A98: 94 | C98: F. | D98: Neurological conditions | G98: =RC[9]+RC[18] -> 1420296.5 | H98: 113.1 | I98: 18412.7 | J98: 28325.5 | K98: 51072.3 | L98: 58796.4 | M98: 41712.699999999997 | N98: 60438.9 | O98: 340152.4 | P98: =SUM(RC[-8]:RC[-1]) -> 599024 | Q98: 101.8 | R98: 21236.799999999999 | S98: 26384.5 | T98: 38153.699999999997 | U98: 46084.9 | V98: 38102.400000000001 | W98: 60557 | X98: 590651.4 | Y98: =SUM(RC[-8]:RC[-1]) -> 821272.5
A99: 95 | D99: 1. | E99: Alzheimer's disease and other dementias | G99: =RC[9]+RC[18] -> 700833.9 | H99: 8.4 | I99: 113.2 | J99: 1560.1 | K99: 899.5 | L99: 2210.6 | M99: 3699.7 | N99: 13695.2 | O99: 215880.7 | P99: =SUM(RC[-8]:RC[-1]) -> 238067.40000000002 | Q99: 8.1999999999999993 | R99: 81.8 | S99: 1307.0999999999999 | T99: 934.6 | U99: 1526.4 | V99: 3292.6 | W99: 12215.4 | X99: 443400.4 | Y99: =SUM(RC[-8]:RC[-1]) -> 462766.5
A100: 96 | D100: 2. | E100: Parkinson's disease | G100: =RC[9]+RC[18] -> 119282.4 | H100: 0.1 | I100: 1.5 | J100: 0.5 | K100: 302.10000000000002 | L100: 692.2 | M100: 1567.8 | N100: 6598.8 | O100: 56421.2 | P100: =SUM(RC[-8]:RC[-1]) -> 65584.2 | Q100: 0 | R100: 0.7 | S100: 0 | T100: 294.2 | U100: 586.5 | V100: 1170 | W100: 4084.8 | X100: 47562 | Y100: =SUM(RC[-8]:RC[-1]) -> 53698.2
A101: 97 | D101: 3. | E101: Epilepsy | G101: =RC[9]+RC[18] -> 204824.9 | H101: 23.4 | I101: 9016.7000000000007 | J101: 16055.2 | K101: 29383 | L101: 26750.799999999999 | M101: 10700 | N101: 8378.9 | O101: 13345.8 | P101: =SUM(RC[-8]:RC[-1]) -> 113653.8 | Q101: 22.2 | R101: 10168.5 | S101: 16039.4 | T101: 20976.5 | U101: 16038.2 | V101: 6500.7 | W101: 6125.9 | X101: 15299.7 | Y101: =SUM(RC[-8]:RC[-1]) -> 91171.099999999991
A102: 98 | D102: 4. | E102: Multiple sclerosis | G102: =RC[9]+RC[18] -> 19051.3 | H102: 0 | I102: 0 | J102: 2.7 | K102: 262.5 | L102: 1686.4 | M102: 1790.1 | N102: 1911.6 | O102: 1925.8 | P102: =SUM(RC[-8]:RC[-1]) -> 7579.0999999999995 | Q102: 0 | R102: 0 | S102: 4.0999999999999996 | T102: 398 | U102: 2387.5 | V102: 2499.8000000000002 | W102: 2823.4 | X102: 3359.4 | Y102: =SUM(RC[-8]:RC[-1]) -> 11472.199999999999
A103: 99 | D103: 5. | E103: Migraine | G103: =RC[9]+RC[18] -> 9.6999999999999993 | H103: 0 | I103: 0 | J103: 0.4 | K103: 0 | L103: 0.3 | M103: 0.7 | N103: 0.3 | O103: 0.7 | P103: =SUM(RC[-8]:RC[-1]) -> 2.4 | Q103: 0 | R103: 0 | S103: 0 | T103: 0.6 | U103: 2.2999999999999998 | V103: 0.7 | W103: 0.4 | X103: 3.3 | Y103: =SUM(RC[-8]:RC[-1]) -> 7.2999999999999989
A104: 100 | D104: 6. | E104: Non-migraine headache | G104: =RC[9]+RC[18] -> 0 | H104: 0 | I104: 0 | J104: 0 | K104: 0 | L104: 0 | M104: 0 | N104: 0 | O104: 0 | P104: =SUM(RC[-8]:RC[-1]) -> 0 | Q104: 0 | R104: 0 | S104: 0 | T104: 0 | U104: 0 | V104: 0 | W104: 0 | X104: 0 | Y104: =SUM(RC[-8]:RC[-1]) -> 0
A105: 101 | D105: 7. | E105: Other neurological conditions | G105: =RC[9]+RC[18] -> 376294.40000000002 | H105: 81.2 | I105: 9281.2999999999993 | J105: 10706.7 | K105: 20225.2 | L105: 27456.1 | M105: 23954.3 | N105: 29854.1 | O105: 52578.2 | P105: =SUM(RC[-8]:RC[-1]) -> 174137.09999999998 | Q105: 71.400000000000006 | R105: 10985.8 | S105: 9033.9 | T105: 15549.9 | U105: 25543.9 | V105: 24638.7 | W105: 35307.1 | X105: 81026.600000000006 | Y105: =SUM(RC[-8]:RC[-1]) -> 202157.30000000002
A106: 102 | C106: G. | D106: Sense organ diseases | G106: =RC[9]+RC[18] -> 657.59999999999991 | H106: 0 | I106: 2.2999999999999998 | J106: 0 | K106: 1.2 | L106: 0.7 | M106: 40.5 | N106: 37.6 | O106: 177.6 | P106: =SUM(RC[-8]:RC[-1]) -> 259.89999999999998 | Q106: 0 | R106: 0 | S106: 0 | T106: 72.099999999999994 | U106: 12.3 | V106: 47 | W106: 42.1 | X106: 224.2 | Y106: =SUM(RC[-8]:RC[-1]) -> 397.69999999999993
A107: 103 | D107: 1. | E107: Glaucoma | G107: =RC[9]+RC[18] -> 37.9 | H107: 0 | I107: 0 | J107: 0 | K107: 0 | L107: 0.7 | M107: 0.3 | N107: 0.6 | O107: 14 | P107: =SUM(RC[-8]:RC[-1]) -> 15.6 | Q107: 0 | R107: 0 | S107: 0 | T107: 0 | U107: 0 | V107: 0 | W107: 0.4 | X107: 21.9 | Y107: =SUM(RC[-8]:RC[-1]) -> 22.299999999999997
A108: 104 | D108: 2. | E108: Cataracts | G108: =RC[9]+RC[18] -> 15.9 | H108: 0 | I108: 0 | J108: 0 | K108: 0 | L108: 0 | M108: 0 | N108: 0.7 | O108: 5.8 | P108: =SUM(RC[-8]:RC[-1]) -> 6.5 | Q108: 0 | R108: 0 | S108: 0 | T108: 0 | U108: 0 | V108: 0 | W108: 0.3 | X108: 9.1 | Y108: =SUM(RC[-8]:RC[-1]) -> 9.4
A109: 105 | D109: 3. | E109: Refractive errors | G109: =RC[9]+RC[18] -> 1.2000000000000002 | H109: 0 | I109: 0 | J109: 0 | K109: 0 | L109: 0 | M109: 0 | N109: 0 | O109: 0.4 | P109: =SUM(RC[-8]:RC[-1]) -> 0.4 | Q109: 0 | R109: 0 | S109: 0 | T109: 0 | U109: 0 | V109: 0 | W109: 0 | X109: 0.8 | Y109: =SUM(RC[-8]:RC[-1]) -> 0.8
A110: 106 | D110: 4. | E110: Macular degeneration | G110: =RC[9]+RC[18] -> 0 | H110: 0 | I110: 0 | J110: 0 | K110: 0 | L110: 0 | M110: 0 | N110: 0 | O110: 0 | P110: =SUM(RC[-8]:RC[-1]) -> 0 | Q110: 0 | R110: 0 | S110: 0 | T110: 0 | U110: 0 | V110: 0 | W110: 0 | X110: 0 | Y110: =SUM(RC[-8]:RC[-1]) -> 0
A111: 107 | D111: 5. | E111: Other vision loss | G111: =RC[9]+RC[18] -> 0 | H111: 0 | I111: 0 | J111: 0 | K111: 0 | L111: 0 | M111: 0 | N111: 0 | O111: 0 | P111: =SUM(RC[-8]:RC[-1]) -> 0 | Q111: 0 | R111: 0 | S111: 0 | T111: 0 | U111: 0 | V111: 0 | W111: 0 | X111: 0 | Y111: =SUM(RC[-8]:RC[-1]) -> 0
A112: 108 | D112: 6. | E112: Other hearing loss | G112: =RC[9]+RC[18] -> 6.3000000000000007 | H112: 0 | I112: 0 | J112: 0 | K112: 0 | L112: 0 | M112: 0 | N112: 1.6 | O112: 1.8 | P112: =SUM(RC[-8]:RC[-1]) -> 3.4000000000000004 | Q112: 0 | R112: 0 | S112: 0 | T112: 0 | U112: 0 | V112: 0 | W112: 0.3 | X112: 2.6 | Y112: =SUM(RC[-8]:RC[-1]) -> 2.9
A113: 109 | D113: 7. | E113: other sense organ disorders | G113: =RC[9]+RC[18] -> 596.29999999999995 | H113: 0 | I113: 2.2999999999999998 | J113: 0 | K113: 1.2 | L113: 0 | M113: 40.200000000000003 | N113: 34.700000000000003 | O113: 155.5 | P113: =SUM(RC[-8]:RC[-1]) -> 233.9 | Q113: 0 | R113: 0 | S113: 0 | T113: 72.099999999999994 | U113: 12.3 | V113: 47 | W113: 41.1 | X113: 189.9 | Y113: =SUM(RC[-8]:RC[-1]) -> 362.4
A114: 110 | C114: H. | D114: Cardiovascular diseases | G114: =RC[9]+RC[18] -> 17519300.700000003 | H114: 9.6 | I114: 16497.400000000001 | J114: 21898.1 | K114: 116772.8 | L114: 639510.80000000005 | M114: 1075354.2 | N114: 1813604.1 | O114: 5011736.8 | P114: =SUM(RC[-8]:RC[-1]) -> 8695383.8000000007 | Q114: 7.4 | R114: 16128 | S114: 23291 | T114: 85330.9 | U114: 341681.5 | V114: 602609.1 | W114: 1245037.8 | X114: 6509831.2000000002 | Y114: =SUM(RC[-8]:RC[-1]) -> 8823916.9000000004
A115: 111 | D115: 1. | E115: Rheumatic heart disease | G115: =RC[9]+RC[18] -> 337334.7 | H115: 0.5 | I115: 610.9 | J115: 2559 | K115: 10183 | L115: 27559.8 | M115: 24073.1 | N115: 28849.1 | O115: 55927.8 | P115: =SUM(RC[-8]:RC[-1]) -> 149763.20000000001 | Q115: 1 | R115: 960.6 | S115: 3550.3 | T115: 11810.6 | U115: 24984 | V115: 24669.3 | W115: 34534.6 | X115: 87061.1 | Y115: =SUM(RC[-8]:RC[-1]) -> 187571.5
A116: 112 | D116: 2. | E116: Hypertensive heart disease | G116: =RC[9]+RC[18] -> 1141204.8999999999 | H116: 3 | I116: 691.7 | J116: 629.20000000000005 | K116: 5003.7 | L116: 32579.599999999999 | M116: 56428.7 | N116: 99677.3 | O116: 299902.59999999998 | P116: =SUM(RC[-8]:RC[-1]) -> 494915.8 | Q116: 1.7 | R116: 1210.0999999999999 | S116: 1018.2 | T116: 3847.5 | U116: 24148.400000000001 | V116: 44743.1 | W116: 91494.399999999994 | X116: 479825.7 | Y116: =SUM(RC[-8]:RC[-1]) -> 646289.1
A117: 113 | D117: 3. | E117: Ischaemic heart disease | G117: =RC[9]+RC[18] -> 7356061 | H117: 6.2 | I117: 4363.2 | J117: 4169.3999999999996 | K117: 43166.3 | L117: 315738 | M117: 546460.6 | N117: 837052 | O117: 2148173.5 | P117: =SUM(RC[-8]:RC[-1]) -> 3899129.2 | Q117: 4.7 | R117: 4035.7 | S117: 3905.4 | T117: 24519.599999999999 | U117: 114761 | V117: 221952.2 | W117: 481550.5 | X117: 2606202.7000000002 | Y117: =SUM(RC[-8]:RC[-1]) -> 3456931.8000000003
A118: 114 | D118: 4. | E118: Stroke | G118: =RC[9]+RC[18] -> 6670933.7000000002 | H118: 0 | I118: 0 | J118: 7579 | K118: 30297.4 | L118: 169324.7 | M118: 341471.8 | N118: 681816.1 | O118: 1932718.6 | P118: =SUM(RC[-8]:RC[-1]) -> 3163207.6 | Q118: 0 | R118: 0 | S118: 6468.6 | T118: 23201.4 | U118: 124445.1 | V118: 251206.3 | W118: 533364 | X118: 2569040.7000000002 | Y118: =SUM(RC[-8]:RC[-1]) -> 3507726.1
A119: 115 | D119: 5. | E119: Cardiomyopathy, myocarditis, endocarditis | G119: =RC[9]+RC[18] -> 472290.39999999997 | H119: 0 | I119: 6299.3 | J119: 3417.1 | K119: 13007.9 | L119: 45880.2 | M119: 46336 | N119: 54773.3 | O119: 104833.4 | P119: =SUM(RC[-8]:RC[-1]) -> 274547.19999999995 | Q119: 0 | R119: 5278.6 | S119: 3304.3 | T119: 8084.7 | U119: 18507.599999999999 | V119: 19914.3 | W119: 29671.4 | X119: 112982.3 | Y119: =SUM(RC[-8]:RC[-1]) -> 197743.2
A120: 116 | D120: 6. | E120: Other circulatory diseases | G120: =RC[9]+RC[18] -> 1541476 | H120: 0 | I120: 4532.2 | J120: 3544.4 | K120: 15114.6 | L120: 48428.4 | M120: 60584 | N120: 111436.3 | O120: 470180.9 | P120: =SUM(RC[-8]:RC[-1]) -> 713820.8 | Q120: 0 | R120: 4643 | S120: 5044.2 | T120: 13867.1 | U120: 34835.300000000003 | V120: 40123.9 | W120: 74423 | X120: 654718.69999999995 | Y120: =SUM(RC[-8]:RC[-1]) -> 827655.2
A121: 117 | C121: I. | D121: Respiratory diseases | G121: =RC[9]+RC[18] -> 4042072.7 | H121: 22.8 | I121: 25839 | J121: 9684.9 | K121: 23913.9 | L121: 90622 | M121: 204213.8 | N121: 461383.9 | O121: 1469359.6 | P121: =SUM(RC[-8]:RC[-1]) -> 2285039.9000000004 | Q121: 15.7 | R121: 18874.900000000001 | S121: 7768.7 | T121: 17918.099999999999 | U121: 55508.7 | V121: 115245.4 | W121: 292934.09999999998 | X121: 1248767.2 | Y121: =SUM(RC[-8]:RC[-1]) -> 1757032.7999999998
A122: 118 | D122: 1. | E122: Chronic obstructive pulmonary disease | G122: =RC[9]+RC[18] -> 3104329.8 | H122: 16.5 | I122: 9176.6 | J122: 2008.9 | K122: 6880.1 | L122: 47541.2 | M122: 146026.29999999999 | N122: 365331.5 | O122: 1175876.8999999999 | P122: =SUM(RC[-8]:RC[-1]) -> 1752858 | Q122: 12.7 | R122: 6693.9 | S122: 1293.8 | T122: 6091.4 | U122: 28695.5 | V122: 83336.399999999994 | W122: 235474.6 | X122: 989873.5 | Y122: =SUM(RC[-8]:RC[-1]) -> 1351471.8
A123: 119 | D123: 2. | E123: Asthma | G123: =RC[9]+RC[18] -> 386318 | H123: 6.2 | I123: 3791 | J123: 4299.6000000000004 | K123: 8947.5 | L123: 23779.599999999999 | M123: 33143.9 | N123: 49449.9 | O123: 99827.9 | P123: =SUM(RC[-8]:RC[-1]) -> 223245.59999999998 | Q123: 3 | R123: 2892.6 | S123: 2929.6 | T123: 5539.8 | U123: 15230.1 | V123: 18466 | W123: 31066.9 | X123: 86944.4 | Y123: =SUM(RC[-8]:RC[-1]) -> 163072.4
A124: 120 | D124: 3. | E124: Other respiratory diseases | G124: =RC[9]+RC[18] -> 551424.89999999991 | H124: 0 | I124: 12871.4 | J124: 3376.4 | K124: 8086.3 | L124: 19301.3 | M124: 25043.599999999999 | N124: 46602.400000000001 | O124: 193654.8 | P124: =SUM(RC[-8]:RC[-1]) -> 308936.19999999995 | Q124: 0 | R124: 9288.4 | S124: 3545.4 | T124: 6286.8 | U124: 11583.1 | V124: 13443.1 | W124: 26392.6 | X124: 171949.3 | Y124: =SUM(RC[-8]:RC[-1]) -> 242488.69999999998
A125: 121 | C125: J. | D125: Digestive diseases | G125: =RC[9]+RC[18] -> 2264073.4 | H125: 144.9 | I125: 16185.2 | J125: 20632.3 | K125: 59739.6 | L125: 279800.5 | M125: 272363.40000000002 | N125: 277136.59999999998 | O125: 408527.3 | P125: =SUM(RC[-8]:RC[-1]) -> 1334529.8 | Q125: 88.4 | R125: 16056.7 | S125: 21023.1 | T125: 34269.1 | U125: 100206.6 | V125: 121715.2 | W125: 170833.7 | X125: 465350.8 | Y125: =SUM(RC[-8]:RC[-1]) -> 929543.6
A126: 122 | D126: 1. | E126: Peptic ulcer disease | G126: =RC[9]+RC[18] -> 262910.69999999995 | H126: 0.3 | I126: 1003.9 | J126: 1638.8 | K126: 7381.8 | L126: 24587.4 | M126: 25219.200000000001 | N126: 30676.7 | O126: 56519.8 | P126: =SUM(RC[-8]:RC[-1]) -> 147027.9 | Q126: 0.3 | R126: 1152.9000000000001 | S126: 1883.6 | T126: 5512.5 | U126: 12576.1 | V126: 13225.5 | W126: 21388.799999999999 | X126: 60143.1 | Y126: =SUM(RC[-8]:RC[-1]) -> 115882.79999999999
A127: 123 | D127: 2. | E127: Cirrhosis of the liver | G127: =RC[9]+RC[18] -> 1020891.2 | H127: 1.9 | I127: 4307.2 | J127: 5265.4 | K127: 20359.2 | L127: 171580.3 | M127: 179175.1 | N127: 160166.29999999999 | O127: 135436.5 | P127: =SUM(RC[-8]:RC[-1]) -> 676291.89999999991 | Q127: 1.6 | R127: 4477.8 | S127: 5319.7 | T127: 11890.9 | U127: 54592.3 | V127: 69792.3 | W127: 83020.800000000003 | X127: 115503.9 | Y127: =SUM(RC[-8]:RC[-1]) -> 344599.30000000005
A128: 124 | D128: 3. | E128: Appendicitis | G128: =RC[9]+RC[18] -> 39551 | H128: 0.8 | I128: 1458.7 | J128: 2409.1999999999998 | K128: 2658.3 | L128: 3539.4 | M128: 2612.3000000000002 | N128: 3368.6 | O128: 5388.3 | P128: =SUM(RC[-8]:RC[-1]) -> 21435.600000000002 | Q128: 0.4 | R128: 1204.8 | S128: 2430.9 | T128: 1801.3 | U128: 2063.5 | V128: 1800.1 | W128: 2624.6 | X128: 6189.8 | Y128: =SUM(RC[-8]:RC[-1]) -> 18115.400000000001
A129: 125 | E129: Other digestive diseases | G129: =RC[9]+RC[18] -> 940720.6 | H129: 141.9 | I129: 9415.5 | J129: 11318.9 | K129: 29340.3 | L129: 80093.399999999994 | M129: 65356.800000000003 | N129: 82925 | O129: 211182.7 | P129: =SUM(RC[-8]:RC[-1]) -> 489774.5 | Q129: 86.1 | R129: 9221.1 | S129: 11388.9 | T129: 15064.5 | U129: 30974.6 | V129: 36897.300000000003 | W129: 63799.6 | X129: 283514 | Y129: =SUM(RC[-8]:RC[-1]) -> 450946.1
A130: 126 | C130: K. | D130: Genitourinary diseases | G130: =RC[9]+RC[18] -> 1195553.2 | H130: 1241.3 | I130: 14910.5 | J130: 11872.9 | K130: 27354.400000000001 | L130: 68998.399999999994 | M130: 80597 | N130: 113966.5 | O130: 305652.59999999998 | P130: =SUM(RC[-8]:RC[-1]) -> 624593.6 | Q130: 782.6 | R130: 11175.6 | S130: 11641.3 | T130: 24833.9 | U130: 60773 | V130: 63834.6 | W130: 93838 | X130: 304080.59999999998 | Y130: =SUM(RC[-8]:RC[-1]) -> 570959.6
A131: 127 | D131: 1. | E131: Kidney diseases | G131: =RC[9]+RC[18] -> 864225.8 | H131: 40.200000000000003 | I131: 11256.5 | J131: 9394.7999999999993 | K131: 21840.400000000001 | L131: 55254.2 | M131: 62978.8 | N131: 83858.899999999994 | O131: 208410.2 | P131: =SUM(RC[-8]:RC[-1]) -> 453034 | Q131: 30.9 | R131: 9514.7000000000007 | S131: 9451.9 | T131: 18365.599999999999 | U131: 45393.7 | V131: 49036.7 | W131: 70807.199999999997 | X131: 208591.1 | Y131: =SUM(RC[-8]:RC[-1]) -> 411191.80000000005
A132: 128 | D132: 2. | E132: Hyperplasia of prostate | G132: =RC[9]+RC[18] -> 5870.2000000000007 | H132: 0 | I132: 0.1 | J132: 0.2 | K132: 9.3000000000000007 | L132: 10 | M132: 80.3 | N132: 442.2 | O132: 5310.5 | P132: =SUM(RC[-8]:RC[-1]) -> 5852.6 | Q132: 0 | R132: 0 | S132: 0 | T132: 0 | U132: 0 | V132: 0 | W132: 7.9 | X132: 9.6999999999999993 | Y132: =SUM(RC[-8]:RC[-1]) -> 17.600000000000001
A133: 129 | D133: 3. | E133: Urolithiasis | G133: =RC[9]+RC[18] -> 31453.4 | H133: 0 | I133: 0 | J133: 369 | K133: 480.6 | L133: 1688.6 | M133: 2576.1 | N133: 3934.3 | O133: 10300.4 | P133: =SUM(RC[-8]:RC[-1]) -> 19349 | Q133: 0 | R133: 0 | S133: 311.5 | T133: 385.6 | U133: 1398.1 | V133: 1469.4 | W133: 2253.3000000000002 | X133: 6286.5 | Y133: =SUM(RC[-8]:RC[-1]) -> 12104.4
A134: 130 | D134: 4. | E134: Other genitourinary diseases | G134: =RC[9]+RC[18] -> 285252 | H134: 1201.0999999999999 | I134: 3653.9 | J134: 2108.9 | K134: 5024.1000000000004 | L134: 12045.7 | M134: 14961.8 | N134: 25731.1 | O134: 81631.5 | P134: =SUM(RC[-8]:RC[-1]) -> 146358.1 | Q134: 751.6 | R134: 1660.9 | S134: 1877.9 | T134: 4970.7 | U134: 11341.3 | V134: 12096.8 | W134: 19534.8 | X134: 86659.9 | Y134: =SUM(RC[-8]:RC[-1]) -> 138893.9
A135: 131 | D135: 5. | E135: Infertility | G135: =RC[9]+RC[18] -> 0 | H135: 0 | I135: 0 | J135: 0 | K135: 0 | L135: 0 | M135: 0 | N135: 0 | O135: 0 | P135: =SUM(RC[-8]:RC[-1]) -> 0 | Q135: 0 | R135: 0 | S135: 0 | T135: 0 | U135: 0 | V135: 0 | W135: 0 | X135: 0 | Y135: =SUM(RC[-8]:RC[-1]) -> 0
A136: 132 | D136: 6. | E136: Gynecological diseases | G136: =RC[9]+RC[18] -> 8751.7000000000007 | H136: 0 | I136: 0 | J136: 0 | K136: 0 | L136: 0 | M136: 0 | N136: 0 | O136: 0 | P136: =SUM(RC[-8]:RC[-1]) -> 0 | Q136: 0 | R136: 0 | S136: 0 | T136: 1112 | U136: 2639.9 | V136: 1231.7 | W136: 1234.7 | X136: 2533.4 | Y136: =SUM(RC[-8]:RC[-1]) -> 8751.7000000000007
A137: 133 | C137: L. | D137: Skin diseases | G137: =RC[9]+RC[18] -> 111177.60000000001 | H137: 6.1 | I137: 4016.7 | J137: 1748.4 | K137: 2966.9 | L137: 6281.6 | M137: 5807 | N137: 8335 | O137: 24988.1 | P137: =SUM(RC[-8]:RC[-1]) -> 54149.8 | Q137: 7.6 | R137: 3685.2 | S137: 1808.3 | T137: 2891 | U137: 4565.6000000000004 | V137: 4333.5 | W137: 6529.7 | X137: 33206.9 | Y137: =SUM(RC[-8]:RC[-1]) -> 57027.8
A138: 134 | C138: M. | D138: Musculoskeletal diseases | G138: =RC[9]+RC[18] -> 216729.59999999998 | H138: 6.9 | I138: 58.6 | J138: 2038.5 | K138: 4796 | L138: 8047.2 | M138: 9492.6 | N138: 13800.9 | O138: 39005.800000000003 | P138: =SUM(RC[-8]:RC[-1]) -> 77246.5 | Q138: 6.2 | R138: 53.7 | S138: 3098.1 | T138: 9771.9 | U138: 15748.9 | V138: 16081.3 | W138: 21531.3 | X138: 73191.7 | Y138: =SUM(RC[-8]:RC[-1]) -> 139483.09999999998
A139: 135 | D139: 1. | E139: Rheumatoid arthritis | G139: =RC[9]+RC[18] -> 66007.600000000006 | H139: 0 | I139: 0 | J139: 637.1 | K139: 1154.3 | L139: 2243.1 | M139: 3201.4 | N139: 5724.7 | O139: 14752.5 | P139: =SUM(RC[-8]:RC[-1]) -> 27713.1 | Q139: 0 | R139: 0.8 | S139: 930.3 | T139: 1203.2 | U139: 2815.8 | V139: 5132.7 | W139: 7137.6 | X139: 21074.1 | Y139: =SUM(RC[-8]:RC[-1]) -> 38294.5
A140: 136 | D140: 2. | E140: Osteoarthritis | G140: =RC[9]+RC[18] -> 4148.8999999999996 | H140: 0 | I140: 0.8 | J140: 0 | K140: 2 | L140: 15.5 | M140: 31.9 | N140: 103.9 | O140: 1089.5999999999999 | P140: =SUM(RC[-8]:RC[-1]) -> 1243.6999999999998 | Q140: 0 | R140: 0.5 | S140: 0.4 | T140: 0.6 | U140: 13.1 | V140: 31.3 | W140: 143.6 | X140: 2715.7 | Y140: =SUM(RC[-8]:RC[-1]) -> 2905.2
A141: 137 | D141: 3. | E141: Gout | G141: =RC[9]+RC[18] -> 552.90000000000009 | H141: 0 | I141: 0 | J141: 0 | K141: 0.9 | L141: 41.5 | M141: 57.9 | N141: 69.8 | O141: 249.5 | P141: =SUM(RC[-8]:RC[-1]) -> 419.6 | Q141: 0 | R141: 0 | S141: 0 | T141: 0.6 | U141: 0.8 | V141: 6.4 | W141: 4.8 | X141: 120.7 | Y141: =SUM(RC[-8]:RC[-1]) -> 133.30000000000001
A142: 138 | D142: 4. | E142: Back and neck pain | G142: =RC[9]+RC[18] -> 3870.5 | H142: 0.1 | I142: 0.5 | J142: 1.4 | K142: 6.7 | L142: 62.2 | M142: 156 | N142: 351 | O142: 1443.4 | P142: =SUM(RC[-8]:RC[-1]) -> 2021.3000000000002 | Q142: 0.1 | R142: 0.6 | S142: 0.4 | T142: 2.2999999999999998 | U142: 26.9 | V142: 70 | W142: 196.6 | X142: 1552.3 | Y142: =SUM(RC[-8]:RC[-1]) -> 1849.1999999999998
A143: 139 | E143: Other musculoskeletal disorders | G143: =RC[9]+RC[18] -> 142149.70000000001 | H143: 6.8 | I143: 57.3 | J143: 1400 | K143: 3632.2 | L143: 5685 | M143: 6045.3 | N143: 7551.5 | O143: 21470.799999999999 | P143: =SUM(RC[-8]:RC[-1]) -> 45848.899999999994 | Q143: 6 | R143: 51.8 | S143: 2167.1 | T143: 8565.1 | U143: 12892.5 | V143: 10840.8 | W143: 14048.6 | X143: 47728.9 | Y143: =SUM(RC[-8]:RC[-1]) -> 96300.800000000003
A144: 140 | C144: N. | D144: Congenital anomalies | G144: =RC[9]+RC[18] -> 556326.5 | H144: 145611.29999999999 | I144: 92881.4 | J144: 17701.7 | K144: 12355.2 | L144: 7548.7 | M144: 4114.1000000000004 | N144: 4465.3999999999996 | O144: 8818.6 | P144: =SUM(RC[-8]:RC[-1]) -> 293496.39999999997 | Q144: 125115.9 | R144: 86441.7 | S144: 15358.9 | T144: 11836.6 | U144: 6769.3 | V144: 3674.6 | W144: 4002.3 | X144: 9630.7999999999993 | Y144: =SUM(RC[-8]:RC[-1]) -> 262830.09999999998
A145: 141 | D145: 1. | E145: Neural tube defects | G145: =RC[9]+RC[18] -> 87527.099999999991 | H145: 31057.4 | I145: 9538.2999999999993 | J145: 1801.5 | K145: 747.4 | L145: 448 | M145: 178.6 | N145: 171.5 | O145: 365.7 | P145: =SUM(RC[-8]:RC[-1]) -> 44308.399999999994 | Q145: 29468.6 | R145: 10070 | S145: 1714.5 | T145: 922.3 | U145: 383.6 | V145: 157.19999999999999 | W145: 143.5 | X145: 359 | Y145: =SUM(RC[-8]:RC[-1]) -> 43218.7
A146: 142 | D146: 2. | E146: Cleft lip and cleft palate | G146: =RC[9]+RC[18] -> 4368.1000000000004 | H146: 1809.5 | I146: 1257.0999999999999 | J146: 0.4 | K146: 0.4 | L146: 0.3 | M146: 0 | N146: 0.4 | O146: 2.2000000000000002 | P146: =SUM(RC[-8]:RC[-1]) -> 3070.3 | Q146: 801.6 | R146: 492.7 | S146: 0.7 | T146: 0.7 | U146: 0 | V146: 0.7 | W146: 0 | X146: 1.4 | Y146: =SUM(RC[-8]:RC[-1]) -> 1297.8000000000002
A147: 143 | D147: 3. | E147: Down's syndrome | G147: =RC[9]+RC[18] -> 19135.3 | H147: 2101.3000000000002 | I147: 2928.1 | J147: 678.8 | K147: 668.3 | L147: 788.9 | M147: 871.7 | N147: 708 | O147: 94.6 | P147: =SUM(RC[-8]:RC[-1]) -> 8839.6999999999989 | Q147: 2592.5 | R147: 3756.9 | S147: 778 | T147: 685.4 | U147: 769.9 | V147: 859.2 | W147: 715 | X147: 138.69999999999999 | Y147: =SUM(RC[-8]:RC[-1]) -> 10295.6
A148: 144 | D148: 4. | E148: Congenital heart anomalies | G148: =RC[9]+RC[18] -> 230239.9 | H148: 59149.1 | I148: 37727.9 | J148: 7872.5 | K148: 7435.4 | L148: 3653.3 | M148: 1420.3 | N148: 1591 | O148: 4425.5 | P148: =SUM(RC[-8]:RC[-1]) -> 123275 | Q148: 48214.8 | R148: 33086.1 | S148: 6844.1 | T148: 6892.5 | U148: 3617.5 | V148: 1267.7 | W148: 1434 | X148: 5608.2 | Y148: =SUM(RC[-8]:RC[-1]) -> 106964.9
A149: 145 | D149: 5. | E149: Other chromosomal anomalies | G149: =RC[9]+RC[18] -> 23115.599999999999 | H149: 6301 | I149: 2714.6 | J149: 469.3 | K149: 290 | L149: 155 | M149: 101.1 | N149: 114.2 | O149: 87.8 | P149: =SUM(RC[-8]:RC[-1]) -> 10233 | Q149: 6954 | R149: 4361.8 | S149: 592.1 | T149: 385.1 | U149: 190.6 | V149: 107.6 | W149: 168 | X149: 123.4 | Y149: =SUM(RC[-8]:RC[-1]) -> 12882.6
A150: 146 | D150: 6. | E150: Other congenital anomalies | G150: =RC[9]+RC[18] -> 191940.7 | H150: 45193.2 | I150: 38715.5 | J150: 6879.3 | K150: 3213.6 | L150: 2503.3000000000002 | M150: 1542.5 | N150: 1880.4 | O150: 3842.8 | P150: =SUM(RC[-8]:RC[-1]) -> 103770.6 | Q150: 37084.400000000001 | R150: 34674.1 | S150: 5429.4 | T150: 2950.5 | U150: 1807.7 | V150: 1282.2 | W150: 1541.8 | X150: 3400 | Y150: =SUM(RC[-8]:RC[-1]) -> 88170.099999999991
A151: 147 | C151: O. | D151: Oral conditions | G151: =RC[9]+RC[18] -> 1570.1 | H151: 0.1 | I151: 2.5 | J151: 0.3 | K151: 19.5 | L151: 53 | M151: 86.3 | N151: 135.30000000000001 | O151: 380.7 | P151: =SUM(RC[-8]:RC[-1]) -> 677.7 | Q151: 0.3 | R151: 4 | S151: 1.5 | T151: 14.4 | U151: 52.6 | V151: 108.1 | W151: 163.69999999999999 | X151: 547.79999999999995 | Y151: =SUM(RC[-8]:RC[-1]) -> 892.39999999999986
A152: 148 | D152: 1. | E152: Dental caries | G152: =RC[9]+RC[18] -> 1122.7 | H152: 0.1 | I152: 2.5 | J152: 0.3 | K152: 19.2 | L152: 50.1 | M152: 44 | N152: 96.8 | O152: 276.60000000000002 | P152: =SUM(RC[-8]:RC[-1]) -> 489.6 | Q152: 0.3 | R152: 4 | S152: 1.2 | T152: 14.4 | U152: 51.9 | V152: 52.1 | W152: 74.099999999999994 | X152: 435.1 | Y152: =SUM(RC[-8]:RC[-1]) -> 633.1
A153: 149 | D153: 2. | E153: Periodontal disease | G153: =RC[9]+RC[18] -> 40.5 | H153: 0 | I153: 0 | J153: 0 | K153: 0.3 | L153: 2.9 | M153: 4.4000000000000004 | N153: 5 | O153: 7.9 | P153: =SUM(RC[-8]:RC[-1]) -> 20.5 | Q153: 0 | R153: 0 | S153: 0.3 | T153: 0 | U153: 0.8 | V153: 3.3 | W153: 2.7 | X153: 12.9 | Y153: =SUM(RC[-8]:RC[-1]) -> 20
A154: 150 | D154: 3. | E154: Edentulism | G154: =RC[9]+RC[18] -> 407.1 | H154: 0 | I154: 0 | J154: 0 | K154: 0 | L154: 0 | M154: 38 | N154: 33.5 | O154: 96.2 | P154: =SUM(RC[-8]:RC[-1]) -> 167.7 | Q154: 0 | R154: 0 | S154: 0 | T154: 0 | U154: 0 | V154: 52.7 | W154: 86.9 | X154: 99.8 | Y154: =SUM(RC[-8]:RC[-1]) -> 239.40000000000003
A155: 151 | B155: III. | C155: Injuries | G155: =RC[9]+RC[18] -> 5144336 | H155: 20730.900000000001 | I155: 185467.7 | J155: 223292.4 | K155: 877163.7 | L155: 941002.4 | M155: 394597.7 | N155: 302109.59999999998 | O155: 471038.3 | P155: =SUM(RC[-8]:RC[-1]) -> 3415402.7 | Q155: 18884.2 | R155: 147438.6 | S155: 144247.79999999999 | T155: 311048.2 | U155: 293119.40000000002 | V155: 154654.6 | W155: 170809 | X155: 488731.5 | Y155: =SUM(RC[-8]:RC[-1]) -> 1728933.3
A156: 152 | C156: A. | D156: Unintentional injuries | G156: =RC[9]+RC[18] -> 3716386.4 | H156: 18378.599999999999 | I156: 177568.7 | J156: 194764.1 | K156: 505810.9 | L156: 586983.1 | M156: 281563.2 | N156: 232007.1 | O156: 391656.8 | P156: =SUM(RC[-8]:RC[-1]) -> 2388732.5 | Q156: 16437 | R156: 139800.70000000001 | S156: 123912.7 | T156: 173006.3 | U156: 188451.3 | V156: 114082.1 | W156: 134869 | X156: 437094.8 | Y156: =SUM(RC[-8]:RC[-1]) -> 1327653.8999999999
A157: 153 | D157: 1. | E157: Road injury | G157: =RC[9]+RC[18] -> 1254525.8999999999 | H157: 1293.8 | I157: 27859 | J157: 52090.9 | K157: 258058.1 | L157: 286764.3 | M157: 115559.8 | N157: 82370.2 | O157: 90766.1 | P157: =SUM(RC[-8]:RC[-1]) -> 914762.2 | Q157: 1315.2 | R157: 20722.900000000001 | S157: 31512.9 | T157: 67678.100000000006 | U157: 77697.600000000006 | V157: 41963.1 | W157: 40675.199999999997 | X157: 58198.7 | Y157: =SUM(RC[-8]:RC[-1]) -> 339763.7
A158: 154 | D158: 2. | E158: Poisonings | G158: =RC[9]+RC[18] -> 193460.3 | H158: 1065 | I158: 11683.5 | J158: 6097 | K158: 23366.9 | L158: 34374.6 | M158: 16717.099999999999 | N158: 11933.7 | O158: 12469.1 | P158: =SUM(RC[-8]:RC[-1]) -> 117706.90000000001 | Q158: 821.8 | R158: 9781.5 | S158: 5754.5 | T158: 14925.7 | U158: 18022.900000000001 | V158: 8875 | W158: 6516.6 | X158: 11055.4 | Y158: =SUM(RC[-8]:RC[-1]) -> 75753.399999999994
A159: 155 | D159: 3. | E159: Falls | G159: =RC[9]+RC[18] -> 693131 | H159: 1413.7 | I159: 17430 | J159: 18664.599999999999 | K159: 33550.9 | L159: 59134.6 | M159: 45249.599999999999 | N159: 51598.3 | O159: 145894.9 | P159: =SUM(RC[-8]:RC[-1]) -> 372936.6 | Q159: 1331.8 | R159: 12691.3 | S159: 12133.5 | T159: 10744.4 | U159: 17001.900000000001 | V159: 19231.2 | W159: 37605.599999999999 | X159: 209454.7 | Y159: =SUM(RC[-8]:RC[-1]) -> 320194.40000000002
A160: 156 | D160: 4. | E160: Fire, heat and hot substances | G160: =RC[9]+RC[18] -> 267889.09999999998 | H160: 1327.7 | I160: 32001.8 | J160: 21770.5 | K160: 22972.1 | L160: 24945.5 | M160: 11654.9 | N160: 9866.2000000000007 | O160: 16719 | P160: =SUM(RC[-8]:RC[-1]) -> 141257.70000000001 | Q160: 1505.6 | R160: 27820.400000000001 | S160: 19804.5 | T160: 26094.5 | U160: 18178.400000000001 | V160: 6783.2 | W160: 7504.1 | X160: 18940.7 | Y160: =SUM(RC[-8]:RC[-1]) -> 126631.4
A161: 157 | D161: 5. | E161: Drowning | G161: =RC[9]+RC[18] -> 372441.8 | H161: 892.6 | I161: 37869.599999999999 | J161: 49295.5 | K161: 57829.7 | L161: 46521.599999999999 | M161: 20730.7 | N161: 16799.900000000001 | O161: 20413.5 | P161: =SUM(RC[-8]:RC[-1]) -> 250353.1 | Q161: 629.79999999999995 | R161: 26614.3 | S161: 24917 | T161: 18003.3 | U161: 14188.5 | V161: 8773.7000000000007 | W161: 9319.6 | X161: 19642.5 | Y161: =SUM(RC[-8]:RC[-1]) -> 122088.7
A162: 158 | D162: 6. | E162: Exposure to forces of nature | G162: =RC[9]+RC[18] -> 2455.1 | H162: 0 | I162: 0 | J162: 236.7 | K162: 379.2 | L162: 385 | M162: 183.5 | N162: 147.80000000000001 | O162: 140.30000000000001 | P162: =SUM(RC[-8]:RC[-1]) -> 1472.5 | Q162: 0 | R162: 0 | S162: 162.19999999999999 | T162: 182.5 | U162: 226 | V162: 131.6 | W162: 123.3 | X162: 157 | Y162: =SUM(RC[-8]:RC[-1]) -> 982.6
A163: 159 | D163: 7. | E163: Other unintentional injuries | G163: =RC[9]+RC[18] -> 932483.9 | H163: 12385.9 | I163: 50724.7 | J163: 46609 | K163: 109654 | L163: 134857.5 | M163: 71467.7 | N163: 59291 | O163: 105254 | P163: =SUM(RC[-8]:RC[-1]) -> 590243.80000000005 | Q163: 10832.9 | R163: 42170.400000000001 | S163: 29628.2 | T163: 35377.9 | U163: 43136 | V163: 28324.3 | W163: 33124.6 | X163: 119645.8 | Y163: =SUM(RC[-8]:RC[-1]) -> 342240.1
A164: 160 | C164: B. | D164: Intentional injuries | G164: =RC[9]+RC[18] -> 1427949.4 | H164: 2352.1999999999998 | I164: 7899 | J164: 28528.3 | K164: 371352.8 | L164: 354019.3 | M164: 113034.5 | N164: 70102.5 | O164: 79381.5 | P164: =SUM(RC[-8]:RC[-1]) -> 1026670.1 | Q164: 2447.1999999999998 | R164: 7637.8 | S164: 20335.099999999999 | T164: 138041.9 | U164: 104668.1 | V164: 40572.5 | W164: 35940 | X164: 51636.7 | Y164: =SUM(RC[-8]:RC[-1]) -> 401279.3
A165: 161 | D165: 1. | E165: Self-harm | G165: =RC[9]+RC[18] -> 803899.7 | H165: 0 | I165: 0 | J165: 7699 | K165: 143929.60000000001 | L165: 170194.4 | M165: 74925.5 | N165: 52882.5 | O165: 67956 | P165: =SUM(RC[-8]:RC[-1]) -> 517587 | Q165: 0 | R165: 0 | S165: 6920.8 | T165: 98973.9 | U165: 73776.3 | V165: 32528 | W165: 30313.1 | X165: 43800.6 | Y165: =SUM(RC[-8]:RC[-1]) -> 286312.7
A166: 162 | D166: 2. | E166: Interpersonal violence | G166: =RC[9]+RC[18] -> 504587.10000000003 | H166: 2343.4 | I166: 7346.5 | J166: 12435 | K166: 178705.7 | L166: 148333.4 | M166: 32916.9 | N166: 14570.5 | O166: 10051.5 | P166: =SUM(RC[-8]:RC[-1]) -> 406702.9 | Q166: 2437.9 | R166: 7081.5 | S166: 9377.6 | T166: 32813.199999999997 | U166: 26755.9 | V166: 6950.2 | W166: 5061.5 | X166: 7406.4 | Y166: =SUM(RC[-8]:RC[-1]) -> 97884.2
A167: 163 | D167: 3. | E167: Collective violence and legal intervention | G167: =RC[9]+RC[18] -> 119462.5 | H167: 8.9 | I167: 552.5 | J167: 8394.2000000000007 | K167: 48717.4 | L167: 35491.5 | M167: 5192.1000000000004 | N167: 2649.4 | O167: 1374 | P167: =SUM(RC[-8]:RC[-1]) -> 102380 | Q167: 9.3000000000000007 | R167: 556.4 | S167: 4036.7 | T167: 6254.8 | U167: 4135.8999999999996 | V167: 1094.3 | W167: 565.4 | X167: 429.7 | Y167: =SUM(RC[-8]:RC[-1]) -> 17082.5

Sheet: Global2000
A1: Global Health Estimates (GHE) 2014: Deaths by age, sex and cause
A2: Region: | C2: Global
A3: Year: | C3: 2000
A4: GlobalGlobal | H4: 10 | I4: 12 | J4: 15 | K4: 115 | L4: 130 | M4: 150 | N4: 160 | O4: 170 | Q4: 20 | R4: 22 | S4: 25 | T4: 215 | U4: 230 | V4: 250 | W4: 260 | X4: 270
F5: Sex | G5: Both sexes | H5: Male | Q5: Female
F6: Age group | G6: Total | H6: 0-27 days | I6: 1-59 months | J6: 5-14 years | K6: 15-29 years | L6: 30-49 years | M6: 50-59 years | N6: 60-69 years | O6: 70+ years | P6: Total | Q6: 0-27 days | R6: 1-59 months | S6: 5-14 years | T6: 15-29 years | U6: 30-49 years | V6: 50-59 years | W6: 60-69 years | X6: 70+ years | Y6: Total
A7: Population (thousands) | G7: =RC[9]+RC[18] -> 6123850 | H7: 5287 | I7: 306593 | J7: 638735 | K7: 810010 | L7: 815310 | M7: 233998 | N7: 162752 | O7: 111885 | P7: =SUM(RC[-8]:RC[-1]) -> 3084570 | Q7: 4960 | R7: 287262 | S7: 602885 | T7: 778918 | U7: 792915 | V7: 237513 | W7: 176745 | X7: 158082 | Y7: =SUM(RC[-8]:RC[-1]) -> 3039280
A8: Live births (thousands) | G8: 129123.7
A9: GHE code | C9: GHE cause category
A10: 0 | C10: All Causes | G10: =RC[9]+RC[18] -> 52806017.400000006 | H10: 2019320.4 | I10: 3207909 | J10: 909748.5 | K10: 1827899.3 | L10: 3814645.3 | M10: 2783376.3 | N10: 4496454.7 | O10: 9034308.5999999996 | P10: =SUM(RC[-8]:RC[-1]) -> 28093662.100000001 | Q10: 1686270.5 | R10: 2934823.5 | S10: 840375.4 | T10: 1395260.6 | U10: 2435566.7000000002 | V10: 1766197.3 | W10: 3141920.3 | X10: 10511941 | Y10: =SUM(RC[-8]:RC[-1]) -> 24712355.300000001
A11: 1 | B11: I. | C11: Communicable, maternal, perinatal and nutritional conditions | G11: =RC[9]+RC[18] -> 16310155 | H11: 1841766.1 | I11: 2698474 | J11: 456930.7 | K11: 450961.7 | L11: 1065327.2 | M11: 423817.2 | N11: 504404.4 | O11: 981413.4 | P11: =SUM(RC[-8]:RC[-1]) -> 8423094.7000000011 | Q11: 1534053.1 | R11: 2497114.9 | S11: 486202.1 | T11: 693012.3 | U11: 976660.6 | V11: 295083.5 | W11: 378545 | X11: 1026388.8 | Y11: =SUM(RC[-8]:RC[-1]) -> 7887060.2999999989
A12: 2 | C12: A. | D12: Infectious and parasitic diseases | G12: =RC[9]+RC[18] -> 8645489.5 | H12: 138100.5 | I12: 1666954.4 | J12: 337986.8 | K12: 363926.8 | L12: 936059.6 | M12: 330344.59999999998 | N12: 349917 | O12: 459654.8 | P12: =SUM(RC[-8]:RC[-1]) -> 4582944.5 | Q12: 138385.20000000001 | R12: 1628054.3 | S12: 356683.1 | T12: 395884.2 | U12: 680431.5 | V12: 225323.2 | W12: 245869.4 | X12: 391914.1 | Y12: =SUM(RC[-8]:RC[-1]) -> 4062545.0000000005
A13: 3 | D13: 1. | E13: Tuberculosis | G13: =RC[9]+RC[18] -> 1343084.1 | H13: 97.3 | I13: 39875.699999999997 | J13: 6270.6 | K13: 49233.5 | L13: 232812.4 | M13: 135914.6 | N13: 184812.7 | O13: 212250 | P13: =SUM(RC[-8]:RC[-1]) -> 861266.8 | Q13: 80.3 | R13: 38038.199999999997 | S13: 9146.1 | T13: 48451.6 | U13: 125822.9 | V13: 67294.899999999994 | W13: 89097.4 | X13: 103885.9 | Y13: =SUM(RC[-8]:RC[-1]) -> 481817.30000000005
A14: 4 | D14: 2. | E14: STDs excluding HIV | G14: =RC[9]+RC[18] -> 130510.7 | H14: 33654.199999999997 | I14: 19067.7 | J14: 5393.4 | K14: 1105 | L14: 1548.5 | M14: 663.5 | N14: 787.9 | O14: 972.2 | P14: =SUM(RC[-8]:RC[-1]) -> 63192.399999999994 | Q14: 37717.300000000003 | R14: 17582.599999999999 | S14: 5884.5 | T14: 1573.9 | U14: 1794 | V14: 654.29999999999995 | W14: 675.3 | X14: 1436.4 | Y14: =SUM(RC[-8]:RC[-1]) -> 67318.3
A15: 5 | E15: a. | F15: Syphilis | G15: =RC[9]+RC[18] -> 124757.6 | H15: 33654.199999999997 | I15: 19067.7 | J15: 5393 | K15: 1100.5999999999999 | L15: 1545.4 | M15: 663.5 | N15: 786.9 | O15: 971.2 | P15: =SUM(RC[-8]:RC[-1]) -> 63182.499999999993 | Q15: 37717.300000000003 | R15: 17582.599999999999 | S15: 5584.1 | T15: 76.400000000000006 | U15: 99.4 | V15: 88.5 | W15: 142 | X15: 284.8 | Y15: =SUM(RC[-8]:RC[-1]) -> 61575.100000000006
A16: 6 | E16: b. | F16: Chlamydia | G16: =RC[9]+RC[18] -> 1169.4000000000001 | H16: 0 | I16: 0 | J16: 0 | K16: 0 | L16: 0 | M16: 0 | N16: 0 | O16: 0 | P16: =SUM(RC[-8]:RC[-1]) -> 0 | Q16: 0 | R16: 0 | S16: 70.5 | T16: 331.9 | U16: 353.9 | V16: 114 | W16: 110.1 | X16: 189 | Y16: =SUM(RC[-8]:RC[-1]) -> 1169.4000000000001
A17: 7 | E17: c. | F17: Gonorrhoea | G17: =RC[9]+RC[18] -> 883.59999999999991 | H17: 0 | I17: 0 | J17: 0.4 | K17: 4.4000000000000004 | L17: 3.2 | M17: 0 | N17: 1 | O17: 1 | P17: =SUM(RC[-8]:RC[-1]) -> 10 | Q17: 0 | R17: 0 | S17: 50.2 | T17: 248 | U17: 264.60000000000002 | V17: 88.3 | W17: 79.900000000000006 | X17: 142.6 | Y17: =SUM(RC[-8]:RC[-1]) -> 873.59999999999991
A18: 8 | E18: d. | F18: Trichomoniasis | G18: =RC[9]+RC[18] -> 0 | H18: 0 | I18: 0 | J18: 0 | K18: 0 | L18: 0 | M18: 0 | N18: 0 | O18: 0 | P18: =SUM(RC[-8]:RC[-1]) -> 0 | Q18: 0 | R18: 0 | S18: 0 | T18: 0 | U18: 0 | V18: 0 | W18: 0 | X18: 0 | Y18: =SUM(RC[-8]:RC[-1]) -> 0
A19: 9 | E19: e. | F19: Other STDs | G19: =RC[9]+RC[18] -> 3700.5 | H19: 0 | I19: 0 | J19: 0 | K19: 0 | L19: 0 | M19: 0 | N19: 0 | O19: 0 | P19: =SUM(RC[-8]:RC[-1]) -> 0 | Q19: 0 | R19: 0 | S19: 179.8 | T19: 917.7 | U19: 1076.0999999999999 | V19: 363.5 | W19: 343.4 | X19: 820 | Y19: =SUM(RC[-8]:RC[-1]) -> 3700.5
A20: 10 | D20: 3. | E20: HIV/AIDS | G20: =RC[9]+RC[18] -> 1678215.6 | H20: 1078.5999999999999 | I20: 105019 | J20: 23287.200000000001 | K20: 125656.6 | L20: 495239.5 | M20: 79370.8 | N20: 24112 | O20: 8179 | P20: =SUM(RC[-8]:RC[-1]) -> 861942.70000000007 | Q20: 1047 | R20: 102864.8 | S20: 22984.3 | T20: 188762 | U20: 410232.9 | V20: 64845.5 | W20: 18951.5 | X20: 6584.9 | Y20: =SUM(RC[-8]:RC[-1]) -> 816272.9
A21: 11 | D21: 4. | E21: Diarrhoeal diseases | G21: =RC[9]+RC[18] -> 2171247.5 | H21: 21949.1 | I21: 590425.69999999995 | J21: 86376.9 | K21: 45668.6 | L21: 69950.899999999994 | M21: 44150.400000000001 | N21: 66712.2 | O21: 130418.9 | P21: =SUM(RC[-8]:RC[-1]) -> 1055652.7 | Q21: 20212.400000000001 | R21: 602561.80000000005 | S21: 101091.9 | T21: 56064.3 | U21: 60693.3 | V21: 43307.3 | W21: 75360.899999999994 | X21: 156302.9 | Y21: =SUM(RC[-8]:RC[-1]) -> 1115594.8000000003
A22: 12 | D22: 5. | E22: Childhood-cluster diseases | G22: =RC[9]+RC[18] -> 867104.1 | H22: 74144.7 | I22: 287423.09999999998 | J22: 59212.5 | K22: 8898.5 | L22: 3696.8 | M22: 1885.7 | N22: 1349.3 | O22: 2101 | P22: =SUM(RC[-8]:RC[-1]) -> 438711.6 | Q22: 73526.2 | R22: 273222.7 | S22: 66805.100000000006 | T22: 8682.5 | U22: 2439.4 | V22: 1163.5999999999999 | W22: 1205.5999999999999 | X22: 1347.4 | Y22: =SUM(RC[-8]:RC[-1]) -> 428392.5
A23: 13 | E23: a. | F23: Whooping cough | G23: =RC[9]+RC[18] -> 68752.3 | H23: 1317.5 | I23: 31166.6 | J23: 3392.6 | K23: 797.2 | L23: 271.39999999999998 | M23: 164.9 | N23: 14 | O23: 11.3 | P23: =SUM(RC[-8]:RC[-1]) -> 37135.5 | Q23: 1301.2 | R23: 26397.599999999999 | S23: 3078 | T23: 492.6 | U23: 180.2 | V23: 114.7 | W23: 14.1 | X23: 38.4 | Y23: =SUM(RC[-8]:RC[-1]) -> 31616.799999999999
A24: 14 | E24: b. | F24: Diphtheria | G24: =RC[9]+RC[18] -> 5764.4 | H24: 8.6 | I24: 1427.9 | J24: 1232.3 | K24: 91.2 | L24: 63.9 | M24: 36.6 | N24: 2 | O24: 7.6 | P24: =SUM(RC[-8]:RC[-1]) -> 2870.1 | Q24: 3.7 | R24: 1459.2 | S24: 1303.9000000000001 | T24: 69.3 | U24: 33.5 | V24: 22.7 | W24: 0 | X24: 2 | Y24: =SUM(RC[-8]:RC[-1]) -> 2894.3
A25: 15 | E25: c. | F25: Measles | G25: =RC[9]+RC[18] -> 620937.80000000005 | H25: 0 | I25: 253996.9 | J25: 49440.4 | K25: 6017.3 | L25: 715.2 | M25: 229.5 | N25: 44.8 | O25: 10.7 | P25: =SUM(RC[-8]:RC[-1]) -> 310454.8 | Q25: 0 | R25: 244705.3 | S25: 58893.599999999999 | T25: 6033.2 | U25: 633.4 | V25: 152.9 | W25: 47.2 | X25: 17.399999999999999 | Y25: =SUM(RC[-8]:RC[-1]) -> 310483.00000000006
A26: 16 | E26: d. | F26: Tetanus | G26: =RC[9]+RC[18] -> 171649.4 | H26: 72818.5 | I26: 831.7 | J26: 5147.2 | K26: 1992.8 | L26: 2646.2 | M26: 1454.6 | N26: 1288.5 | O26: 2071.4 | P26: =SUM(RC[-8]:RC[-1]) -> 88250.9 | Q26: 72221.399999999994 | R26: 660.6 | S26: 3529.5 | T26: 2087.4 | U26: 1592.4 | V26: 873.3 | W26: 1144.3 | X26: 1289.5999999999999 | Y26: =SUM(RC[-8]:RC[-1]) -> 83398.5
A27: 17 | D27: 6. | E27: Meningitis | G27: =RC[9]+RC[18] -> 512085.10000000009 | H27: 335.3 | I27: 143802.20000000001 | J27: 39478.1 | K27: 32779.800000000003 | L27: 23773.599999999999 | M27: 10387.799999999999 | N27: 10011.1 | O27: 11346.7 | P27: =SUM(RC[-8]:RC[-1]) -> 271914.60000000003 | Q27: 257.10000000000002 | R27: 129891.8 | S27: 39919.800000000003 | T27: 22670 | U27: 14913 | V27: 8869 | W27: 9701.7000000000007 | X27: 13948.1 | Y27: =SUM(RC[-8]:RC[-1]) -> 240170.50000000003
A28: 18 | D28: 7. | E28: Encephalitis | G28: =RC[9]+RC[18] -> 109026.5 | H28: 31.6 | I28: 29006.799999999999 | J28: 8272.6 | K28: 6084.5 | L28: 4988.3999999999996 | M28: 1896.6 | N28: 1949.5 | O28: 2734.1 | P28: =SUM(RC[-8]:RC[-1]) -> 54964.1 | Q28: 23.7 | R28: 27772.6 | S28: 10240.6 | T28: 5565.8 | U28: 3424.4 | V28: 1734.7 | W28: 2180.4 | X28: 3120.2 | Y28: =SUM(RC[-8]:RC[-1]) -> 54062.400000000001
A29: 19 | D29: 8. | E29: Acute hepatitis B | G29: =RC[9]+RC[18] -> 123734.2 | H29: 100.5 | I29: 2451.8000000000002 | J29: 6773.7 | K29: 10484.700000000001 | L29: 18668.3 | M29: 12334.5 | N29: 11700.2 | O29: 10684.6 | P29: =SUM(RC[-8]:RC[-1]) -> 73198.3 | Q29: 61.2 | R29: 1903 | S29: 7821.5 | T29: 6459.7 | U29: 8394.7999999999993 | V29: 6588.8 | W29: 8037.7 | X29: 11269.2 | Y29: =SUM(RC[-8]:RC[-1]) -> 50535.899999999994
A30: 20 | D30: 9. | E30: Acute hepatitis C | G30: =RC[9]+RC[18] -> 23053 | H30: 0.1 | I30: 1.3 | J30: 525.6 | K30: 701.6 | L30: 3610 | M30: 2274.4 | N30: 2333.1 | O30: 2899.1 | P30: =SUM(RC[-8]:RC[-1]) -> 12345.2 | Q30: 0 | R30: 0.5 | S30: 464.6 | T30: 705.4 | U30: 1689.3 | V30: 1430.6 | W30: 2238.4 | X30: 4179 | Y30: =SUM(RC[-8]:RC[-1]) -> 10707.8
A31: 21 | D31: 10. | E31: Parasitic and vector diseases | G31: =RC[9]+RC[18] -> 1109237 | H31: 176 | I31: 395059.7 | J31: 50726.1 | K31: 40916.1 | L31: 40550.800000000003 | M31: 18570.7 | N31: 17059.599999999999 | O31: 19589.5 | P31: =SUM(RC[-8]:RC[-1]) -> 582648.49999999988 | Q31: 120.3 | R31: 385829.2 | S31: 46369.3 | T31: 26544 | U31: 24553 | V31: 12781.4 | W31: 13278.3 | X31: 17113 | Y31: =SUM(RC[-8]:RC[-1]) -> 526588.5
A32: 22 | E32: a. | F32: Malaria | G32: =RC[9]+RC[18] -> 875062.2 | H32: 2.1 | I32: 380525.4 | J32: 11315.6 | K32: 13441.6 | L32: 16065 | M32: 8003.4 | N32: 7045.9 | O32: 8290.1 | P32: =SUM(RC[-8]:RC[-1]) -> 444689.1 | Q32: 2.6 | R32: 375908.3 | S32: 13199.7 | T32: 11708.8 | U32: 10937.4 | V32: 5250.6 | W32: 5658.1 | X32: 7707.6 | Y32: =SUM(RC[-8]:RC[-1]) -> 430373.09999999992
A33: 23 | E33: b. | F33: Trypanosomiasis | G33: =RC[9]+RC[18] -> 53163.799999999996 | H33: 0 | I33: 424.4 | J33: 9924.4 | K33: 11321.4 | L33: 6453.8 | M33: 974.7 | N33: 261.3 | O33: 42.5 | P33: =SUM(RC[-8]:RC[-1]) -> 29402.499999999996 | Q33: 0 | R33: 477.7 | S33: 10775.9 | T33: 6755.3 | U33: 4200.5 | V33: 1172.3 | W33: 305 | X33: 74.599999999999994 | Y33: =SUM(RC[-8]:RC[-1]) -> 23761.3
A34: 24 | E34: c. | F34: Chagas disease | G34: =RC[9]+RC[18] -> 8758.0999999999985 | H34: 0 | I34: 3.2 | J34: 2.8 | K34: 93.7 | L34: 938.9 | M34: 1168.9000000000001 | N34: 1261.7 | O34: 1646.5 | P34: =SUM(RC[-8]:RC[-1]) -> 5115.7 | Q34: 0.7 | R34: 1.9 | S34: 4 | T34: 44.8 | U34: 477.4 | V34: 673.1 | W34: 943.8 | X34: 1496.7 | Y34: =SUM(RC[-8]:RC[-1]) -> 3642.3999999999996
A35: 25 | E35: d. | F35: Schistosomiasis | G35: =RC[9]+RC[18] -> 22611.1 | H35: 0.8 | I35: 196.7 | J35: 11.3 | K35: 359.8 | L35: 2941 | M35: 2358.3000000000002 | N35: 2727 | O35: 3176.4 | P35: =SUM(RC[-8]:RC[-1]) -> 11771.3 | Q35: 0 | R35: 585.70000000000005 | S35: 16.5 | T35: 463.8 | U35: 2775 | V35: 2077.8000000000002 | W35: 2103.9 | X35: 2817.1 | Y35: =SUM(RC[-8]:RC[-1]) -> 10839.800000000001
A36: 26 | E36: e. | F36: Leishmaniasis | G36: =RC[9]+RC[18] -> 69511.299999999988 | H36: 105.2 | I36: 9795.6 | J36: 14955.2 | K36: 9259 | L36: 7545.1 | M36: 2659.6 | N36: 2030.2 | O36: 1992.2 | P36: =SUM(RC[-8]:RC[-1]) -> 48342.099999999991 | Q36: 60.3 | R36: 4665.8 | S36: 7123.7 | T36: 3725.2 | U36: 2520.6999999999998 | V36: 1087.0999999999999 | W36: 927.1 | X36: 1059.3 | Y36: =SUM(RC[-8]:RC[-1]) -> 21169.199999999997
A37: 27 | E37: f. | F37: Lymphatic filariasis | G37: =RC[9]+RC[18] -> 1.4 | H37: 0 | I37: 0 | J37: 0 | K37: 0 | L37: 0 | M37: 0 | N37: 0 | O37: 0 | P37: =SUM(RC[-8]:RC[-1]) -> 0 | Q37: 0 | R37: 0 | S37: 0 | T37: 0 | U37: 1.4 | V37: 0 | W37: 0 | X37: 0 | Y37: =SUM(RC[-8]:RC[-1]) -> 1.4
A38: 28 | E38: g. | F38: Onchocerciasis | G38: =RC[9]+RC[18] -> 1.7 | H38: 0 | I38: 1.7 | J38: 0 | K38: 0 | L38: 0 | M38: 0 | N38: 0 | O38: 0 | P38: =SUM(RC[-8]:RC[-1]) -> 1.7 | Q38: 0 | R38: 0 | S38: 0 | T38: 0 | U38: 0 | V38: 0 | W38: 0 | X38: 0 | Y38: =SUM(RC[-8]:RC[-1]) -> 0
A39: 29 | E39: h. | F39: Leprosy | G39: =RC[9]+RC[18] -> 6767.6 | H39: 0 | I39: 0 | J39: 0 | K39: 19.100000000000001 | L39: 743.3 | M39: 993.7 | N39: 1261.3 | O39: 1198.8 | P39: =SUM(RC[-8]:RC[-1]) -> 4216.2 | Q39: 0 | R39: 0.1 | S39: 37.299999999999997 | T39: 71.599999999999994 | U39: 328.4 | V39: 461.5 | W39: 765 | X39: 887.5 | Y39: =SUM(RC[-8]:RC[-1]) -> 2551.4
A40: 30 | E40: i. | F40: Dengue | G40: =RC[9]+RC[18] -> 17619.699999999997 | H40: 62.7 | I40: 1251.9000000000001 | J40: 1891.6 | K40: 1418.4 | L40: 1390.5 | M40: 653.79999999999995 | N40: 835.9 | O40: 1556 | P40: =SUM(RC[-8]:RC[-1]) -> 9060.7999999999993 | Q40: 53.9 | R40: 1511.2 | S40: 1866.6 | T40: 875.9 | U40: 946.4 | V40: 581.79999999999995 | W40: 1043.8 | X40: 1679.3 | Y40: =SUM(RC[-8]:RC[-1]) -> 8558.9
A41: 31 | E41: j. | F41: Trachoma | G41: =RC[9]+RC[18] -> 0 | H41: 0 | I41: 0 | J41: 0 | K41: 0 | L41: 0 | M41: 0 | N41: 0 | O41: 0 | P41: =SUM(RC[-8]:RC[-1]) -> 0 | Q41: 0 | R41: 0 | S41: 0 | T41: 0 | U41: 0 | V41: 0 | W41: 0 | X41: 0 | Y41: =SUM(RC[-8]:RC[-1]) -> 0
A42: 32 | E42: k. | F42: Rabies | G42: =RC[9]+RC[18] -> 55739.9 | H42: 5.2 | I42: 2860.8 | J42: 12625.3 | K42: 5003.2 | L42: 4473.1000000000004 | M42: 1758.2 | N42: 1636.2 | O42: 1687 | P42: =SUM(RC[-8]:RC[-1]) -> 30049 | Q42: 2.7 | R42: 2678.5 | S42: 13345.7 | T42: 2898.5 | U42: 2365.9 | V42: 1477.2 | W42: 1531.6 | X42: 1390.8 | Y42: =SUM(RC[-8]:RC[-1]) -> 25690.9
A43: 33 | D43: 11. | E43: Intestinal nematode infections | G43: =RC[9]+RC[18] -> 3130.5 | H43: 11.1 | I43: 708.4 | J43: 443.2 | K43: 63.5 | L43: 71.8 | M43: 72.599999999999994 | N43: 112.8 | O43: 164.5 | P43: =SUM(RC[-8]:RC[-1]) -> 1647.8999999999999 | Q43: 10.5 | R43: 628.79999999999995 | S43: 407.6 | T43: 54.6 | U43: 70.5 | V43: 47.9 | W43: 87.3 | X43: 175.4 | Y43: =SUM(RC[-8]:RC[-1]) -> 1482.6000000000001
A44: 34 | E44: a. | F44: Ascariasis | G44: =RC[9]+RC[18] -> 3124.2 | H44: 11.1 | I44: 708.4 | J44: 443.2 | K44: 63.5 | L44: 69.099999999999994 | M44: 72.599999999999994 | N44: 111.9 | O44: 163.6 | P44: =SUM(RC[-8]:RC[-1]) -> 1643.3999999999999 | Q44: 10.1 | R44: 628.5 | S44: 407.6 | T44: 54.6 | U44: 70.5 | V44: 47.9 | W44: 86.2 | X44: 175.4 | Y44: =SUM(RC[-8]:RC[-1]) -> 1480.8000000000002
A45: 35 | E45: b. | F45: Trichuriasis | G45: =RC[9]+RC[18] -> 0 | H45: 0 | I45: 0 | J45: 0 | K45: 0 | L45: 0 | M45: 0 | N45: 0 | O45: 0 | P45: =SUM(RC[-8]:RC[-1]) -> 0 | Q45: 0 | R45: 0 | S45: 0 | T45: 0 | U45: 0 | V45: 0 | W45: 0 | X45: 0 | Y45: =SUM(RC[-8]:RC[-1]) -> 0
A46: 36 | E46: c. | F46: Hookworm disease | G46: =RC[9]+RC[18] -> 6.3 | H46: 0 | I46: 0 | J46: 0 | K46: 0 | L46: 2.7 | M46: 0 | N46: 0.9 | O46: 0.9 | P46: =SUM(RC[-8]:RC[-1]) -> 4.5 | Q46: 0.4 | R46: 0.3 | S46: 0 | T46: 0 | U46: 0 | V46: 0 | W46: 1.1000000000000001 | X46: 0 | Y46: =SUM(RC[-8]:RC[-1]) -> 1.8
A47: 37 | D47: 12. | E47: Other infectious diseases | G47: =RC[9]+RC[18] -> 575061 | H47: 6522 | I47: 54113 | J47: 51226.9 | K47: 42334.5 | L47: 41148.6 | M47: 22823.1 | N47: 28976.400000000001 | O47: 58315.3 | P47: =SUM(RC[-8]:RC[-1]) -> 305459.8 | Q47: 5328.9 | R47: 47758.400000000001 | S47: 45547.9 | T47: 30350.2 | U47: 26404 | V47: 16605.2 | W47: 25054.9 | X47: 72551.7 | Y47: =SUM(RC[-8]:RC[-1]) -> 269601.2
A48: 38 | C48: B. | D48: Respiratory infections | G48: =RC[9]+RC[18] -> 3502488.5 | H48: 133260.70000000001 | I48: 765039.7 | J48: 81975.399999999994 | K48: 61232.5 | L48: 101626.6 | M48: 78807 | N48: 133077.9 | O48: 465993.3 | P48: =SUM(RC[-8]:RC[-1]) -> 1821013.0999999999 | Q48: 110528.3 | R48: 661751.69999999995 | S48: 90203.5 | T48: 48712.3 | U48: 61081.599999999999 | V48: 53410 | W48: 107242.6 | X48: 548545.4 | Y48: =SUM(RC[-8]:RC[-1]) -> 1681475.4
A49: 39 | D49: 1. | E49: Lower respiratory infections | G49: =RC[9]+RC[18] -> 3490568.3 | H49: 132987.29999999999 | I49: 762676.7 | J49: 81610 | K49: 60979.199999999997 | L49: 101259.4 | M49: 78542.3 | N49: 132668.79999999999 | O49: 464483.9 | P49: =SUM(RC[-8]:RC[-1]) -> 1815207.6 | Q49: 110286.3 | R49: 659683.1 | S49: 89801.1 | T49: 48495 | U49: 60818.5 | V49: 53194.1 | W49: 106892.9 | X49: 546189.69999999995 | Y49: =SUM(RC[-8]:RC[-1]) -> 1675360.7
A50: 40 | D50: 2. | E50: Upper respiratory infections | G50: =RC[9]+RC[18] -> 8502.4 | H50: 218.8 | I50: 1458.3 | J50: 177.5 | K50: 129.30000000000001 | L50: 238.3 | M50: 173.1 | N50: 328 | O50: 1378.2 | P50: =SUM(RC[-8]:RC[-1]) -> 4101.5 | Q50: 182.6 | R50: 1251.5999999999999 | S50: 194.5 | T50: 100 | U50: 138.19999999999999 | V50: 112.4 | W50: 250.9 | X50: 2170.6999999999998 | Y50: =SUM(RC[-8]:RC[-1]) -> 4400.8999999999996
A51: 41 | D51: 3. | E51: Otitis media | G51: =RC[9]+RC[18] -> 3417.9 | H51: 54.7 | I51: 904.7 | J51: 187.9 | K51: 124 | L51: 128.9 | M51: 91.6 | N51: 81.099999999999994 | O51: 131.19999999999999 | P51: =SUM(RC[-8]:RC[-1]) -> 1704.1000000000001 | Q51: 59.4 | R51: 816.9 | S51: 207.9 | T51: 117.3 | U51: 124.9 | V51: 103.6 | W51: 98.8 | X51: 185 | Y51: =SUM(RC[-8]:RC[-1]) -> 1713.8
A52: 42 | C52: C. | D52: Maternal conditions | G52: =RC[9]+RC[18] -> 427264.3 | H52: 0 | I52: 0 | J52: 0 | K52: 0 | L52: 0 | M52: 0 | N52: 0 | O52: 0 | P52: =SUM(RC[-8]:RC[-1]) -> 0 | Q52: 0 | R52: 0 | S52: 46.3 | T52: 220183.1 | U52: 207009.7 | V52: 23.9 | W52: 0 | X52: 1.3 | Y52: =SUM(RC[-8]:RC[-1]) -> 427264.3
A53: 49 | C53: D. | D53: Neonatal conditions | G53: =RC[9]+RC[18] -> 3096997.5999999996 | H53: 1569295.4 | I53: 145838.79999999999 | J53: 28.9 | K53: 15.2 | L53: 5.0999999999999996 | M53: 1.7 | N53: 1 | O53: 0.3 | P53: =SUM(RC[-8]:RC[-1]) -> 1715186.4 | Q53: 1284243.8999999999 | R53: 97538.1 | S53: 20.9 | T53: 5.0999999999999996 | U53: 0.9 | V53: 1 | W53: 0.3 | X53: 1 | Y53: =SUM(RC[-8]:RC[-1]) -> 1381811.2
A54: 50 | D54: 1. | E54: Preterm birth complications | G54: =RC[9]+RC[18] -> 1316104.3999999999 | H54: 636709.6 | I54: 82047.399999999994 | J54: 1.3 | K54: 3.5 | L54: 1.3 | M54: 0 | N54: 1 | O54: 0.3 | P54: =SUM(RC[-8]:RC[-1]) -> 718764.40000000014 | Q54: 540759 | R54: 56575.7 | S54: 3.1 | T54: 1.2 | U54: 0 | V54: 0 | W54: 0 | X54: 1 | Y54: =SUM(RC[-8]:RC[-1]) -> 597339.99999999988
A55: 51 | D55: 2. | E55: Birth asphyxia and birth trauma | G55: =RC[9]+RC[18] -> 1045373.9999999999 | H55: 559207.6 | I55: 38584.5 | J55: 27.6 | K55: 11.7 | L55: 3.7 | M55: 1.7 | N55: 0 | O55: 0 | P55: =SUM(RC[-8]:RC[-1]) -> 597836.79999999981 | Q55: 424765.7 | R55: 22747.7 | S55: 17.7 | T55: 3.9 | U55: 0.9 | V55: 1 | W55: 0.3 | X55: 0 | Y55: =SUM(RC[-8]:RC[-1]) -> 447537.20000000007
A56: 52 | D56: 3. | E56: Neonatal sepsis and infections | G56: =RC[9]+RC[18] -> 544388.80000000005 | H56: 293770.2 | I56: 26 | J56: 0 | K56: 0 | L56: 0 | M56: 0 | N56: 0 | O56: 0 | P56: =SUM(RC[-8]:RC[-1]) -> 293796.2 | Q56: 250569.2 | R56: 23.4 | S56: 0 | T56: 0 | U56: 0 | V56: 0 | W56: 0 | X56: 0 | Y56: =SUM(RC[-8]:RC[-1]) -> 250592.6
A57: 53 | D57: 4. | E57: Other neonatal conditions | G57: =RC[9]+RC[18] -> 191130 | H57: 79607.899999999994 | I57: 25180.9 | J57: 0 | K57: 0 | L57: 0 | M57: 0 | N57: 0 | O57: 0 | P57: =SUM(RC[-8]:RC[-1]) -> 104788.79999999999 | Q57: 68150 | R57: 18191.2 | S57: 0 | T57: 0 | U57: 0 | V57: 0 | W57: 0 | X57: 0 | Y57: =SUM(RC[-8]:RC[-1]) -> 86341.2
A58: 54 | C58: E. | D58: Nutritional deficiencies | G58: =RC[9]+RC[18] -> 637915.6 | H58: 1109.5 | I58: 120641.1 | J58: 36939.599999999999 | K58: 25787.3 | L58: 27636 | M58: 14663.8 | N58: 21408.5 | O58: 55765 | P58: =SUM(RC[-8]:RC[-1]) -> 303950.8 | Q58: 895.7 | R58: 109770.9 | S58: 39248.400000000001 | T58: 28227.7 | U58: 28136.9 | V58: 16325.4 | W58: 25432.799999999999 | X58: 85927 | Y58: =SUM(RC[-8]:RC[-1]) -> 333964.79999999999
A59: 55 | D59: 1. | E59: Protein-energy malnutrition | G59: =RC[9]+RC[18] -> 552596.69999999995 | H59: 971 | I59: 115183.5 | J59: 32354.400000000001 | K59: 19076 | L59: 22268.5 | M59: 12165.1 | N59: 17427.2 | O59: 45245 | P59: =SUM(RC[-8]:RC[-1]) -> 264690.7 | Q59: 770 | R59: 105352.9 | S59: 34216.199999999997 | T59: 20660.5 | U59: 22675.3 | V59: 13669.8 | W59: 21363 | X59: 69198.3 | Y59: =SUM(RC[-8]:RC[-1]) -> 287905.99999999994
A60: 56 | D60: 2. | E60: Iodine deficiency | G60: =RC[9]+RC[18] -> 1239.0999999999999 | H60: 0.6 | I60: 84.2 | J60: 39.9 | K60: 276.7 | L60: 118.7 | M60: 23.7 | N60: 30.8 | O60: 73.900000000000006 | P60: =SUM(RC[-8]:RC[-1]) -> 648.5 | Q60: 0.1 | R60: 65.900000000000006 | S60: 39 | T60: 229.4 | U60: 103.8 | V60: 23.2 | W60: 30 | X60: 99.2 | Y60: =SUM(RC[-8]:RC[-1]) -> 590.6
A61: 57 | D61: 3. | E61: Vitamin A deficiency | G61: =RC[9]+RC[18] -> 8.5 | H61: 0 | I61: 0 | J61: 0 | K61: 0 | L61: 0 | M61: 0 | N61: 0 | O61: 4.0999999999999996 | P61: =SUM(RC[-8]:RC[-1]) -> 4.0999999999999996 | Q61: 0 | R61: 0 | S61: 0 | T61: 0 | U61: 0 | V61: 0 | W61: 0.3 | X61: 4.0999999999999996 | Y61: =SUM(RC[-8]:RC[-1]) -> 4.3999999999999995
A62: 58 | D62: 4. | E62: Iron-deficiency anaemia | G62: =RC[9]+RC[18] -> 76725.399999999994 | H62: 103.5 | I62: 4898.8999999999996 | J62: 4439.7 | K62: 6269.5 | L62: 4939.2 | M62: 2222.1 | N62: 3569.4 | O62: 8887.2999999999993 | P62: =SUM(RC[-8]:RC[-1]) -> 35329.599999999999 | Q62: 84 | R62: 3951 | S62: 4879 | T62: 7094.6 | U62: 5079.8 | V62: 2457.6 | W62: 3737.8 | X62: 14112 | Y62: =SUM(RC[-8]:RC[-1]) -> 41395.800000000003
A63: 59 | D63: 5. | E63: Other nutritional deficiencies | G63: =RC[9]+RC[18] -> 7346.2000000000007 | H63: 34.5 | I63: 474.6 | J63: 105.5 | K63: 165.1 | L63: 309.7 | M63: 253 | N63: 381.2 | O63: 1554.8 | P63: =SUM(RC[-8]:RC[-1]) -> 3278.4 | Q63: 41.5 | R63: 401.1 | S63: 114.2 | T63: 243.1 | U63: 278 | V63: 174.8 | W63: 301.7 | X63: 2513.4 | Y63: =SUM(RC[-8]:RC[-1]) -> 4067.8
A64: 60 | B64: II. | C64: Noncommunicable diseases | G64: =RC[9]+RC[18] -> 31469737.100000001 | H64: 151832.5 | I64: 269794.3 | J64: 184540 | K64: 442662.6 | L64: 1779696.3 | M64: 2055299.4 | N64: 3732350.9 | O64: 7724635 | P64: =SUM(RC[-8]:RC[-1]) -> 16340811 | Q64: 128620.3 | R64: 246831.3 | S64: 177594.3 | T64: 335175.09999999998 | U64: 1140313.7 | V64: 1346342.9 | W64: 2614709 | X64: 9139339.5 | Y64: =SUM(RC[-8]:RC[-1]) -> 15128926.1
A65: 61 | C65: A. | D65: Malignant neoplasms | G65: =RC[9]+RC[18] -> 6413008.6000000006 | H65: 8.1999999999999993 | I65: 17937.7 | J65: 34503.300000000003 | K65: 79444.600000000006 | L65: 444747.3 | M65: 581206.9 | N65: 952979.6 | O65: 1509396.3 | P65: =SUM(RC[-8]:RC[-1]) -> 3620223.9000000004 | Q65: 10.4 | R65: 14452.4 | S65: 24172.799999999999 | T65: 60201.2 | U65: 414944.7 | V65: 436062.5 | W65: 615103.6 | X65: 1227837.1000000001 | Y65: =SUM(RC[-8]:RC[-1]) -> 2792784.7
A66: 62 | D66: 1. | E66: Mouth and oropharynx cancers | G66: =RC[9]+RC[18] -> 223949.5 | H66: 0 | I66: 39.799999999999997 | J66: 609.20000000000005 | K66: 3330.4 | L66: 33381.1 | M66: 38888.9 | N66: 44126.7 | O66: 39580.9 | P66: =SUM(RC[-8]:RC[-1]) -> 159957 | Q66: 0 | R66: 22.3 | S66: 522.70000000000005 | T66: 1882.9 | U66: 11916.5 | V66: 12744.6 | W66: 15868.9 | X66: 21034.6 | Y66: =SUM(RC[-8]:RC[-1]) -> 63992.5
A67: 63 | D67: 2. | E67: Oesophagus cancer | G67: =RC[9]+RC[18] -> 334236.80000000005 | H67: 0 | I67: 1 | J67: 2.1 | K67: 853.3 | L67: 21689.3 | M67: 46008.6 | N67: 69680.2 | O67: 85184.6 | P67: =SUM(RC[-8]:RC[-1]) -> 223419.1 | Q67: 0 | R67: 1.1000000000000001 | S67: 1.1000000000000001 | T67: 922 | U67: 10218.4 | V67: 15586.4 | W67: 28347.9 | X67: 55740.800000000003 | Y67: =SUM(RC[-8]:RC[-1]) -> 110817.70000000001
A68: 64 | D68: 3. | E68: Stomach cancer | G68: =RC[9]+RC[18] -> 670981.9 | H68: 0 | I68: 13.2 | J68: 11.6 | K68: 3864.7 | L68: 49173.5 | M68: 72540.600000000006 | N68: 123203.3 | O68: 181859.1 | P68: =SUM(RC[-8]:RC[-1]) -> 430666 | Q68: 0 | R68: 10 | S68: 11.2 | T68: 2438.5 | U68: 27435.8 | V68: 30611.4 | W68: 52931.1 | X68: 126877.9 | Y68: =SUM(RC[-8]:RC[-1]) -> 240315.9
A69: 65 | D69: 4. | E69: Colon and rectum cancers | G69: =RC[9]+RC[18] -> 564448.30000000005 | H69: 0 | I69: 13.2 | J69: 25.3 | K69: 3803.8 | L69: 28709.4 | M69: 41657.5 | N69: 77730.3 | O69: 148195.5 | P69: =SUM(RC[-8]:RC[-1]) -> 300135 | Q69: 0 | R69: 3.7 | S69: 17.899999999999999 | T69: 2834.8 | U69: 22180.7 | V69: 28765 | W69: 52796 | X69: 157715.20000000001 | Y69: =SUM(RC[-8]:RC[-1]) -> 264313.30000000005
A70: 66 | D70: 5. | E70: Liver cancer | G70: =RC[9]+RC[18] -> 552206.89999999991 | H70: 0 | I70: 100.2 | J70: 2298.1 | K70: 11423.8 | L70: 102507.8 | M70: 79375.899999999994 | N70: 91761.4 | O70: 110476.8 | P70: =SUM(RC[-8]:RC[-1]) -> 397943.99999999994 | Q70: 0 | R70: 71.8 | S70: 1064.3 | T70: 2535 | U70: 20554.7 | V70: 22998.9 | W70: 35693.5 | X70: 71344.7 | Y70: =SUM(RC[-8]:RC[-1]) -> 154262.9
A71: 67 | D71: 6. | E71: Pancreas cancer | G71: =RC[9]+RC[18] -> 228658 | H71: 0 | I71: 3.5 | J71: 1.4 | K71: 454 | L71: 10345.9 | M71: 21172.5 | N71: 35804.5 | O71: 53457.3 | P71: =SUM(RC[-8]:RC[-1]) -> 121239.1 | Q71: 0 | R71: 1.9 | S71: 5.5 | T71: 336.1 | U71: 5753.2 | V71: 12271.9 | W71: 24684.5 | X71: 64365.8 | Y71: =SUM(RC[-8]:RC[-1]) -> 107418.9
A72: 68 | D72: 7. | E72: Trachea, bronchus, lung cancers | G72: =RC[9]+RC[18] -> 1164428.3999999999 | H72: 0 | I72: 23 | J72: 45.7 | K72: 2762.8 | L72: 69788 | M72: 140278.1 | N72: 255345 | O72: 366187.4 | P72: =SUM(RC[-8]:RC[-1]) -> 834430 | Q72: 0 | R72: 32.200000000000003 | S72: 21.6 | T72: 1423.7 | U72: 27944.6 | V72: 46804.9 | W72: 81620.7 | X72: 172150.7 | Y72: =SUM(RC[-8]:RC[-1]) -> 329998.40000000002
A73: 69 | D73: 8. | E73: Melanoma and other skin cancers | G73: =RC[9]+RC[18] -> 66579.399999999994 | H73: 0 | I73: 4.5999999999999996 | J73: 13.8 | K73: 917.3 | L73: 5535.3 | M73: 5846.1 | N73: 8596.7999999999993 | O73: 15617.6 | P73: =SUM(RC[-8]:RC[-1]) -> 36531.5 | Q73: 0 | R73: 9.3000000000000007 | S73: 13.5 | T73: 737.7 | U73: 4361.3999999999996 | V73: 3841.9 | W73: 5490.7 | X73: 15593.4 | Y73: =SUM(RC[-8]:RC[-1]) -> 30047.9
A74: 70 | D74: 9. | E74: Breast cancer | G74: =RC[9]+RC[18] -> 435493 | H74: 0 | I74: 0 | J74: 0 | K74: 0 | L74: 0 | M74: 0 | N74: 0 | O74: 0 | P74: =SUM(RC[-8]:RC[-1]) -> 0 | Q74: 0 | R74: 1.5 | S74: 8.9 | T74: 6380.5 | U74: 110785.8 | V74: 91456.7 | W74: 90191.3 | X74: 136668.29999999999 | Y74: =SUM(RC[-8]:RC[-1]) -> 435493
A75: 71 | D75: 10. | E75: Cervix uteri cancer | G75: =RC[9]+RC[18] -> 226515.40000000002 | H75: 0 | I75: 0 | J75: 0 | K75: 0 | L75: 0 | M75: 0 | N75: 0 | O75: 0 | P75: =SUM(RC[-8]:RC[-1]) -> 0 | Q75: 0 | R75: 0 | S75: 1.1000000000000001 | T75: 4555.5 | U75: 67048.3 | V75: 54563.8 | W75: 50336.9 | X75: 50009.8 | Y75: =SUM(RC[-8]:RC[-1]) -> 226515.40000000002
A76: 72 | D76: 11. | E76: Corpus uteri cancer | G76: =RC[9]+RC[18] -> 63554.8 | H76: 0 | I76: 0 | J76: 0 | K76: 0 | L76: 0 | M76: 0 | N76: 0 | O76: 0 | P76: =SUM(RC[-8]:RC[-1]) -> 0 | Q76: 0 | R76: 0 | S76: 3.3 | T76: 553.5 | U76: 5821.2 | V76: 10081.9 | W76: 17144.2 | X76: 29950.7 | Y76: =SUM(RC[-8]:RC[-1]) -> 63554.8
A77: 73 | D77: 12. | E77: Ovary cancer | G77: =RC[9]+RC[18] -> 121124.4 | H77: 0 | I77: 0 | J77: 0 | K77: 0 | L77: 0 | M77: 0 | N77: 0 | O77: 0 | P77: =SUM(RC[-8]:RC[-1]) -> 0 | Q77: 0 | R77: 1.9 | S77: 44.1 | T77: 3090.9 | U77: 20712.7 | V77: 24601.599999999999 | W77: 30202.2 | X77: 42471 | Y77: =SUM(RC[-8]:RC[-1]) -> 121124.4
A78: 74 | D78: 13. | E78: Prostate cancer | G78: =RC[9]+RC[18] -> 237949.9 | H78: 0 | I78: 2.1 | J78: 0 | K78: 456.4 | L78: 1767.6 | M78: 7457.1 | N78: 40376.800000000003 | O78: 187889.9 | P78: =SUM(RC[-8]:RC[-1]) -> 237949.9 | Q78: 0 | R78: 0 | S78: 0 | T78: 0 | U78: 0 | V78: 0 | W78: 0 | X78: 0 | Y78: =SUM(RC[-8]:RC[-1]) -> 0
A79: 75 | D79: 14. | E79: Bladder cancer | G79: =RC[9]+RC[18] -> 135265.79999999999 | H79: 0 | I79: 8.5 | J79: 6.1 | K79: 369.9 | L79: 4093.3 | M79: 9376.2999999999993 | N79: 23869.8 | O79: 61115.1 | P79: =SUM(RC[-8]:RC[-1]) -> 98839 | Q79: 0 | R79: 0 | S79: 1.1000000000000001 | T79: 148.5 | U79: 1685.5 | V79: 2966.1 | W79: 6322 | X79: 25303.599999999999 | Y79: =SUM(RC[-8]:RC[-1]) -> 36426.800000000003
A80: 76 | D80: 15. | E80: Lymphomas, multiple myeloma | G80: =RC[9]+RC[18] -> 258313.49999999997 | H80: 0.5 | I80: 1597.2 | J80: 4548.8 | K80: 8548.7999999999993 | L80: 20459.400000000001 | M80: 20732.7 | N80: 34050.199999999997 | O80: 54132.6 | P80: =SUM(RC[-8]:RC[-1]) -> 144070.19999999998 | Q80: 1.3 | R80: 1235.9000000000001 | S80: 2086.6999999999998 | T80: 4857 | U80: 12031.7 | V80: 14012.3 | W80: 23916.2 | X80: 56102.2 | Y80: =SUM(RC[-8]:RC[-1]) -> 114243.29999999999
A81: 77 | D81: 16. | E81: Leukaemia | G81: =RC[9]+RC[18] -> 242826.19999999998 | H81: 0 | I81: 9826.2999999999993 | J81: 13468.8 | K81: 19255.099999999999 | L81: 22466.6 | M81: 13499.8 | N81: 21310.7 | O81: 37445.599999999999 | P81: =SUM(RC[-8]:RC[-1]) -> 137272.9 | Q81: 0 | R81: 7742.9 | S81: 8980.7999999999993 | T81: 11824.5 | U81: 17000.5 | V81: 10451.6 | W81: 15060.1 | X81: 34492.9 | Y81: =SUM(RC[-8]:RC[-1]) -> 105553.29999999999
A82: 78 | E82: Other malignant neoplasms | G82: =RC[9]+RC[18] -> 886476.4 | H82: 7.7 | I82: 6305.2 | J82: 13472.5 | K82: 23404.2 | L82: 74830 | M82: 84372.9 | N82: 127123.9 | O82: 168253.8 | P82: =SUM(RC[-8]:RC[-1]) -> 497770.2 | Q82: 9.1 | R82: 5318 | S82: 11388.9 | T82: 15680.1 | U82: 49493.9 | V82: 54303.199999999997 | W82: 84497.5 | X82: 168015.5 | Y82: =SUM(RC[-8]:RC[-1]) -> 388706.2
A83: 79 | C83: B. | D83: Other neoplasms | G83: =RC[9]+RC[18] -> 144349.09999999998 | H83: 40.200000000000003 | I83: 1378.4 | J83: 1895.4 | K83: 3988.9 | L83: 8253.4 | M83: 9495 | N83: 15718.3 | O83: 33700.300000000003 | P83: =SUM(RC[-8]:RC[-1]) -> 74469.899999999994 | Q83: 36.299999999999997 | R83: 1274.0999999999999 | S83: 1667.3 | T83: 2229.8000000000002 | U83: 9068.2999999999993 | V83: 7410.2 | W83: 11303.2 | X83: 36890 | Y83: =SUM(RC[-8]:RC[-1]) -> 69879.199999999997
A84: 80 | C84: C. | D84: Diabetes mellitus | G84: =RC[9]+RC[18] -> 1045755.2 | H84: 693.3 | I84: 2705.1 | J84: 2415.5 | K84: 10097.1 | L84: 50361.1 | M84: 68966.600000000006 | N84: 120467.3 | O84: 211549.7 | P84: =SUM(RC[-8]:RC[-1]) -> 467255.7 | Q84: 707 | R84: 2615.8000000000002 | S84: 4047.7 | T84: 10691.5 | U84: 39016 | V84: 65700.899999999994 | W84: 141416.1 | X84: 314304.5 | Y84: =SUM(RC[-8]:RC[-1]) -> 578499.5
A85: 81 | C85: D. | D85: Endocrine, blood, immune disorders | G85: =RC[9]+RC[18] -> 283382.09999999998 | H85: 0 | I85: 13016.1 | J85: 13284.6 | K85: 13194.2 | L85: 15804.6 | M85: 10762.7 | N85: 15057.3 | O85: 36327.5 | P85: =SUM(RC[-8]:RC[-1]) -> 117447 | Q85: 0 | R85: 18906.8 | S85: 21156.6 | T85: 18940.2 | U85: 17673.099999999999 | V85: 11199.9 | W85: 16756.7 | X85: 61301.8 | Y85: =SUM(RC[-8]:RC[-1]) -> 165935.09999999998
A86: 82 | C86: E. | D86: Mental and behavioral disorders | G86: =RC[9]+RC[18] -> 200364.90000000002 | H86: 0.6 | I86: 188.9 | J86: 1500.8 | K86: 18091.900000000001 | L86: 59463.9 | M86: 25050.799999999999 | N86: 18987.400000000001 | O86: 17168.7 | P86: =SUM(RC[-8]:RC[-1]) -> 140453.00000000003 | Q86: 0.6 | R86: 96 | S86: 1245.2 | T86: 6775.7 | U86: 16490.900000000001 | V86: 8235.7999999999993 | W86: 7400.2 | X86: 19667.5 | Y86: =SUM(RC[-8]:RC[-1]) -> 59911.899999999994
A87: 83 | D87: 1. | E87: Unipolar depressive disorders | G87: =RC[9]+RC[18] -> 3232.7 | H87: 0.4 | I87: 2 | J87: 0 | K87: 27.7 | L87: 115.2 | M87: 87.5 | N87: 100 | O87: 810.7 | P87: =SUM(RC[-8]:RC[-1]) -> 1143.5 | Q87: 0.6 | R87: 3.4 | S87: 0 | T87: 23.3 | U87: 78.3 | V87: 94.3 | W87: 138.9 | X87: 1750.4 | Y87: =SUM(RC[-8]:RC[-1]) -> 2089.1999999999998
A88: 84 | D88: 2. | E88: Bipolar disorder | G88: =RC[9]+RC[18] -> 384.6 | H88: 0 | I88: 0 | J88: 0 | K88: 2.2999999999999998 | L88: 17.3 | M88: 15.6 | N88: 19.5 | O88: 69.900000000000006 | P88: =SUM(RC[-8]:RC[-1]) -> 124.60000000000001 | Q88: 0 | R88: 0 | S88: 0 | T88: 1.3 | U88: 18.3 | V88: 25 | W88: 32 | X88: 183.4 | Y88: =SUM(RC[-8]:RC[-1]) -> 260
A89: 85 | D89: 3. | E89: Schizophrenia | G89: =RC[9]+RC[18] -> 24619.5 | H89: 0 | I89: 0 | J89: 0 | K89: 1238.3 | L89: 5239.5 | M89: 1841.2 | N89: 1990.2 | O89: 2801.2 | P89: =SUM(RC[-8]:RC[-1]) -> 13110.400000000001 | Q89: 0 | R89: 0 | S89: 2.4 | T89: 666.6 | U89: 3621.2 | V89: 1615.5 | W89: 1715.8 | X89: 3887.6 | Y89: =SUM(RC[-8]:RC[-1]) -> 11509.1
A90: 86 | D90: 4. | E90: Alcohol use disorders | G90: =RC[9]+RC[18] -> 93231.2 | H90: 0 | I90: 0 | J90: 0.3 | K90: 3801 | L90: 34627.199999999997 | M90: 18631.400000000001 | N90: 13448.6 | O90: 6328.2 | P90: =SUM(RC[-8]:RC[-1]) -> 76836.7 | Q90: 0 | R90: 0 | S90: 0 | T90: 750.3 | U90: 5973.6 | V90: 4156.3999999999996 | W90: 3260 | X90: 2254.1999999999998 | Y90: =SUM(RC[-8]:RC[-1]) -> 16394.5
A91: 87 | D91: 5. | E91: Drug use disorders | G91: =RC[9]+RC[18] -> 54385.2 | H91: 0 | I91: 0 | J91: 1028.4000000000001 | K91: 11632 | L91: 17442.2 | M91: 3327.2 | N91: 1908.9 | O91: 2133.3000000000002 | P91: =SUM(RC[-8]:RC[-1]) -> 37472 | Q91: 0 | R91: 0 | S91: 938.9 | T91: 4404.8 | U91: 5557.6 | V91: 1682.6 | W91: 1288.2 | X91: 3041.1 | Y91: =SUM(RC[-8]:RC[-1]) -> 16913.2
A92: 88 | D92: 6. | E92: Anxiety disorders | G92: =RC[9]+RC[18] -> 57.5 | H92: 0 | I92: 0 | J92: 0 | K92: 1.1000000000000001 | L92: 4.3 | M92: 2 | N92: 3.5 | O92: 10.9 | P92: =SUM(RC[-8]:RC[-1]) -> 21.8 | Q92: 0 | R92: 0 | S92: 0 | T92: 1.1000000000000001 | U92: 1.1000000000000001 | V92: 0 | W92: 6.6 | X92: 26.9 | Y92: =SUM(RC[-8]:RC[-1]) -> 35.700000000000003
A93: 89 | D93: 7. | E93: Eating disorders | G93: =RC[9]+RC[18] -> 7609.9 | H93: 0 | I93: 0 | J93: 172.7 | K93: 651.1 | L93: 532 | M93: 163 | N93: 226.8 | O93: 1209.3 | P93: =SUM(RC[-8]:RC[-1]) -> 2954.8999999999996 | Q93: 0 | R93: 0 | S93: 156 | T93: 709 | U93: 689.6 | V93: 233.8 | W93: 255.3 | X93: 2611.3000000000002 | Y93: =SUM(RC[-8]:RC[-1]) -> 4655
A94: 90 | D94: 8. | E94: Pervasive developmental disorders | G94: =RC[9]+RC[18] -> 0 | H94: 0 | I94: 0 | J94: 0 | K94: 0 | L94: 0 | M94: 0 | N94: 0 | O94: 0 | P94: =SUM(RC[-8]:RC[-1]) -> 0 | Q94: 0 | R94: 0 | S94: 0 | T94: 0 | U94: 0 | V94: 0 | W94: 0 | X94: 0 | Y94: =SUM(RC[-8]:RC[-1]) -> 0
A95: 91 | D95: 9. | E95: Childhood behavioural disorders | G95: =RC[9]+RC[18] -> 0 | H95: 0 | I95: 0 | J95: 0 | K95: 0 | L95: 0 | M95: 0 | N95: 0 | O95: 0 | P95: =SUM(RC[-8]:RC[-1]) -> 0 | Q95: 0 | R95: 0 | S95: 0 | T95: 0 | U95: 0 | V95: 0 | W95: 0 | X95: 0 | Y95: =SUM(RC[-8]:RC[-1]) -> 0
A96: 92 | D96: 10. | E96: Idiopathic intellectual disability | G96: =RC[9]+RC[18] -> 1241.5 | H96: 0.3 | I96: 10.6 | J96: 25.7 | K96: 100.2 | L96: 167.9 | M96: 108.3 | N96: 94.8 | O96: 138.6 | P96: =SUM(RC[-8]:RC[-1]) -> 646.40000000000009 | Q96: 0 | R96: 18.100000000000001 | S96: 23.6 | T96: 71.5 | U96: 160.69999999999999 | V96: 82 | W96: 86.5 | X96: 152.69999999999999 | Y96: =SUM(RC[-8]:RC[-1]) -> 595.09999999999991
A97: 93 | D97: 11. | E97: Other mental and behavioural disorders | G97: =RC[9]+RC[18] -> 15602.599999999999 | H97: 0 | I97: 176.2 | J97: 273.8 | K97: 638.20000000000005 | L97: 1318.5 | M97: 874.6 | N97: 1195.0999999999999 | O97: 3666.5 | P97: =SUM(RC[-8]:RC[-1]) -> 8142.9 | Q97: 0 | R97: 74.5 | S97: 124.2 | T97: 147.69999999999999 | U97: 390.5 | V97: 346.2 | W97: 616.70000000000005 | X97: 5759.9 | Y97: =SUM(RC[-8]:RC[-1]) -> 7459.7
A98: 94 | C98: F. | D98: Neurological conditions | G98: =RC[9]+RC[18] -> 805868.2 | H98: 124.4 | I98: 16474.099999999999 | J98: 25050.3 | K98: 46648.4 | L98: 48736.9 | M98: 26398.1 | N98: 39228 | O98: 160394.4 | P98: =SUM(RC[-8]:RC[-1]) -> 363054.6 | Q98: 85.5 | R98: 18205.7 | S98: 23697.9 | T98: 30854 | U98: 35276.800000000003 | V98: 22485.3 | W98: 36984.400000000001 | X98: 275224 | Y98: =SUM(RC[-8]:RC[-1]) -> 442813.6
A99: 95 | D99: 1. | E99: Alzheimer's disease and other dementias | G99: =RC[9]+RC[18] -> 297058.59999999998 | H99: 12.5 | I99: 153.30000000000001 | J99: 1627.4 | K99: 1169.4000000000001 | L99: 2369.3000000000002 | M99: 2132.8000000000002 | N99: 7742.3 | O99: 83966.9 | P99: =SUM(RC[-8]:RC[-1]) -> 99173.9 | Q99: 6.8 | R99: 114.3 | S99: 1274.4000000000001 | T99: 996.6 | U99: 1580.3 | V99: 1895.4 | W99: 7333.7 | X99: 184683.2 | Y99: =SUM(RC[-8]:RC[-1]) -> 197884.7
A100: 96 | D100: 2. | E100: Parkinson's disease | G100: =RC[9]+RC[18] -> 73386.299999999988 | H100: 0 | I100: 0 | J100: 2 | K100: 277.2 | L100: 593.29999999999995 | M100: 1051 | N100: 4586.5 | O100: 31944.6 | P100: =SUM(RC[-8]:RC[-1]) -> 38454.6 | Q100: 0.2 | R100: 3.2 | S100: 0.4 | T100: 295.8 | U100: 622.20000000000005 | V100: 810.6 | W100: 3233.6 | X100: 29965.7 | Y100: =SUM(RC[-8]:RC[-1]) -> 34931.699999999997
A101: 97 | D101: 3. | E101: Epilepsy | G101: =RC[9]+RC[18] -> 171079.1 | H101: 24.3 | I101: 8255.2000000000007 | J101: 14292.9 | K101: 28022.6 | L101: 23725 | M101: 7637.3 | N101: 6169.3 | O101: 8595.2000000000007 | P101: =SUM(RC[-8]:RC[-1]) -> 96721.8 | Q101: 16.100000000000001 | R101: 9083.4 | S101: 14690.2 | T101: 18013.099999999999 | U101: 13778.4 | V101: 4739.3 | W101: 4652.5 | X101: 9384.2999999999993 | Y101: =SUM(RC[-8]:RC[-1]) -> 74357.3
A102: 98 | D102: 4. | E102: Multiple sclerosis | G102: =RC[9]+RC[18] -> 15736.7 | H102: 0 | I102: 0 | J102: 0 | K102: 377.3 | L102: 2053.4 | M102: 1592.9 | N102: 1301.9000000000001 | O102: 1388.7 | P102: =SUM(RC[-8]:RC[-1]) -> 6714.2 | Q102: 0 | R102: 1.2 | S102: 2.5 | T102: 437.5 | U102: 2733.3 | V102: 2016.1 | W102: 1696.2 | X102: 2135.6999999999998 | Y102: =SUM(RC[-8]:RC[-1]) -> 9022.5
A103: 99 | D103: 5. | E103: Migraine | G103: =RC[9]+RC[18] -> 12.4 | H103: 0 | I103: 0 | J103: 0 | K103: 0 | L103: 1.1000000000000001 | M103: 1 | N103: 1 | O103: 3.2 | P103: =SUM(RC[-8]:RC[-1]) -> 6.3000000000000007 | Q103: 0 | R103: 0 | S103: 0 | T103: 0 | U103: 2.1 | V103: 1 | W103: 1 | X103: 2 | Y103: =SUM(RC[-8]:RC[-1]) -> 6.1
A104: 100 | D104: 6. | E104: Non-migraine headache | G104: =RC[9]+RC[18] -> 0 | H104: 0 | I104: 0 | J104: 0 | K104: 0 | L104: 0 | M104: 0 | N104: 0 | O104: 0 | P104: =SUM(RC[-8]:RC[-1]) -> 0 | Q104: 0 | R104: 0 | S104: 0 | T104: 0 | U104: 0 | V104: 0 | W104: 0 | X104: 0 | Y104: =SUM(RC[-8]:RC[-1]) -> 0
A105: 101 | D105: 7. | E105: Other neurological conditions | G105: =RC[9]+RC[18] -> 248595.20000000001 | H105: 87.6 | I105: 8065.6 | J105: 9127.9 | K105: 16801.900000000001 | L105: 19994.900000000001 | M105: 13983.1 | N105: 19427 | O105: 34495.800000000003 | P105: =SUM(RC[-8]:RC[-1]) -> 121983.8 | Q105: 62.4 | R105: 9003.6 | S105: 7730.5 | T105: 11111 | U105: 16560.400000000001 | V105: 13022.9 | W105: 20067.400000000001 | X105: 49053.2 | Y105: =SUM(RC[-8]:RC[-1]) -> 126611.40000000001
A106: 102 | C106: G. | D106: Sense organ diseases | G106: =RC[9]+RC[18] -> 1703.7 | H106: 0 | I106: 0.1 | J106: 0 | K106: 19.8 | L106: 42.8 | M106: 122.5 | N106: 131.69999999999999 | O106: 366.8 | P106: =SUM(RC[-8]:RC[-1]) -> 683.7 | Q106: 0 | R106: 0 | S106: 20.399999999999999 | T106: 75.599999999999994 | U106: 57.2 | V106: 47.8 | W106: 88 | X106: 731 | Y106: =SUM(RC[-8]:RC[-1]) -> 1020
A107: 103 | D107: 1. | E107: Glaucoma | G107: =RC[9]+RC[18] -> 172.3 | H107: 0 | I107: 0 | J107: 0 | K107: 1 | L107: 0 | M107: 23.5 | N107: 3.2 | O107: 26.3 | P107: =SUM(RC[-8]:RC[-1]) -> 54 | Q107: 0 | R107: 0 | S107: 0 | T107: 0 | U107: 16.100000000000001 | V107: 0 | W107: 0 | X107: 102.2 | Y107: =SUM(RC[-8]:RC[-1]) -> 118.30000000000001
A108: 104 | D108: 2. | E108: Cataracts | G108: =RC[9]+RC[18] -> 253.29999999999998 | H108: 0 | I108: 0 | J108: 0 | K108: 14.2 | L108: 0 | M108: 0 | N108: 42.8 | O108: 43.6 | P108: =SUM(RC[-8]:RC[-1]) -> 100.6 | Q108: 0 | R108: 0 | S108: 0 | T108: 0 | U108: 0 | V108: 0 | W108: 14.1 | X108: 138.6 | Y108: =SUM(RC[-8]:RC[-1]) -> 152.69999999999999
A109: 105 | D109: 3. | E109: Refractive errors | G109: =RC[9]+RC[18] -> 0 | H109: 0 | I109: 0 | J109: 0 | K109: 0 | L109: 0 | M109: 0 | N109: 0 | O109: 0 | P109: =SUM(RC[-8]:RC[-1]) -> 0 | Q109: 0 | R109: 0 | S109: 0 | T109: 0 | U109: 0 | V109: 0 | W109: 0 | X109: 0 | Y109: =SUM(RC[-8]:RC[-1]) -> 0
A110: 106 | D110: 4. | E110: Macular degeneration | G110: =RC[9]+RC[18] -> 0 | H110: 0 | I110: 0 | J110: 0 | K110: 0 | L110: 0 | M110: 0 | N110: 0 | O110: 0 | P110: =SUM(RC[-8]:RC[-1]) -> 0 | Q110: 0 | R110: 0 | S110: 0 | T110: 0 | U110: 0 | V110: 0 | W110: 0 | X110: 0 | Y110: =SUM(RC[-8]:RC[-1]) -> 0
A111: 107 | D111: 5. | E111: Other vision loss | G111: =RC[9]+RC[18] -> 0 | H111: 0 | I111: 0 | J111: 0 | K111: 0 | L111: 0 | M111: 0 | N111: 0 | O111: 0 | P111: =SUM(RC[-8]:RC[-1]) -> 0 | Q111: 0 | R111: 0 | S111: 0 | T111: 0 | U111: 0 | V111: 0 | W111: 0 | X111: 0 | Y111: =SUM(RC[-8]:RC[-1]) -> 0
A112: 108 | D112: 6. | E112: Other hearing loss | G112: =RC[9]+RC[18] -> 9.9 | H112: 0 | I112: 0 | J112: 0 | K112: 0 | L112: 0 | M112: 0 | N112: 0 | O112: 3.9 | P112: =SUM(RC[-8]:RC[-1]) -> 3.9 | Q112: 0 | R112: 0 | S112: 0 | T112: 0 | U112: 0 | V112: 0 | W112: 0 | X112: 6 | Y112: =SUM(RC[-8]:RC[-1]) -> 6
A113: 109 | D113: 7. | E113: other sense organ disorders | G113: =RC[9]+RC[18] -> 1268 | H113: 0 | I113: 0.1 | J113: 0 | K113: 4.5999999999999996 | L113: 42.8 | M113: 99 | N113: 85.7 | O113: 293.10000000000002 | P113: =SUM(RC[-8]:RC[-1]) -> 525.29999999999995 | Q113: 0 | R113: 0 | S113: 20.399999999999999 | T113: 75.599999999999994 | U113: 41 | V113: 47.8 | W113: 73.8 | X113: 484.1 | Y113: =SUM(RC[-8]:RC[-1]) -> 742.7
A114: 110 | C114: H. | D114: Cardiovascular diseases | G114: =RC[9]+RC[18] -> 14881496.199999999 | H114: 8.9 | I114: 22329.7 | J114: 28117.1 | K114: 125460 | L114: 671380 | M114: 860207.6 | N114: 1708430.1 | O114: 3880229.3 | P114: =SUM(RC[-8]:RC[-1]) -> 7296162.6999999993 | Q114: 7.7 | R114: 21525.3 | S114: 29409.1 | T114: 98468.1 | U114: 356174 | V114: 515462.5 | W114: 1206635.8999999999 | X114: 5357650.9000000004 | Y114: =SUM(RC[-8]:RC[-1]) -> 7585333.5
A115: 111 | D115: 1. | E115: Rheumatic heart disease | G115: =RC[9]+RC[18] -> 371936.69999999995 | H115: 1.4 | I115: 1166.5 | J115: 4548 | K115: 15612.5 | L115: 37171.800000000003 | M115: 25411.7 | N115: 34347.199999999997 | O115: 51993.7 | P115: =SUM(RC[-8]:RC[-1]) -> 170252.79999999999 | Q115: 0.9 | R115: 1630.4 | S115: 6020.2 | T115: 18404.099999999999 | U115: 34364.1 | V115: 26049.1 | W115: 37777.9 | X115: 77437.2 | Y115: =SUM(RC[-8]:RC[-1]) -> 201683.89999999997
A116: 112 | D116: 2. | E116: Hypertensive heart disease | G116: =RC[9]+RC[18] -> 848960 | H116: 1.3 | I116: 1017.7 | J116: 770.7 | K116: 4714.1000000000004 | L116: 29025 | M116: 42051.4 | N116: 90735.4 | O116: 204572.1 | P116: =SUM(RC[-8]:RC[-1]) -> 372887.7 | Q116: 1.3 | R116: 1652.7 | S116: 1130.7 | T116: 4499 | U116: 23852.6 | V116: 38003.5 | W116: 85111.6 | X116: 321820.90000000002 | Y116: =SUM(RC[-8]:RC[-1]) -> 476072.30000000005
A117: 113 | D117: 3. | E117: Ischaemic heart disease | G117: =RC[9]+RC[18] -> 5974059.2999999998 | H117: 6.2 | I117: 6404.4 | J117: 5211.5 | K117: 43599.3 | L117: 328916.2 | M117: 424332.79999999999 | N117: 759713.5 | O117: 1580838.6 | P117: =SUM(RC[-8]:RC[-1]) -> 3149022.5 | Q117: 5.5 | R117: 5768.8 | S117: 4758 | T117: 25688 | U117: 112899.5 | V117: 181796.5 | W117: 449258.1 | X117: 2044862.4 | Y117: =SUM(RC[-8]:RC[-1]) -> 2825036.8
A118: 114 | D118: 4. | E118: Stroke | G118: =RC[9]+RC[18] -> 5661548.5999999996 | H118: 0 | I118: 0 | J118: 9446.2999999999993 | K118: 31698.2 | L118: 178232.5 | M118: 277855.5 | N118: 645725.5 | O118: 1498784.6 | P118: =SUM(RC[-8]:RC[-1]) -> 2641742.6 | Q118: 0 | R118: 0 | S118: 7770.9 | T118: 25305.3 | U118: 126705 | V118: 211752.7 | W118: 511885.1 | X118: 2136387 | Y118: =SUM(RC[-8]:RC[-1]) -> 3019806
A119: 115 | D119: 5. | E119: Cardiomyopathy, myocarditis, endocarditis | G119: =RC[9]+RC[18] -> 401540.3 | H119: 0 | I119: 7633.1 | J119: 4122.3 | K119: 14104.3 | L119: 47112.2 | M119: 35171.199999999997 | N119: 47600.6 | O119: 77305.899999999994 | P119: =SUM(RC[-8]:RC[-1]) -> 233049.59999999998 | Q119: 0 | R119: 6350.8 | S119: 3898.6 | T119: 8886.4 | U119: 17869.599999999999 | V119: 15897.6 | W119: 26999.200000000001 | X119: 88588.5 | Y119: =SUM(RC[-8]:RC[-1]) -> 168490.7
A120: 116 | D120: 6. | E120: Other circulatory diseases | G120: =RC[9]+RC[18] -> 1623451.1 | H120: 0 | I120: 6108.1 | J120: 4018.4 | K120: 15731.5 | L120: 50922.2 | M120: 55385 | N120: 130307.9 | O120: 466734.3 | P120: =SUM(RC[-8]:RC[-1]) -> 729207.39999999991 | Q120: 0 | R120: 6122.6 | S120: 5830.7 | T120: 15685.2 | U120: 40483.199999999997 | V120: 41963.1 | W120: 95604.1 | X120: 688554.8 | Y120: =SUM(RC[-8]:RC[-1]) -> 894243.70000000007
A121: 117 | C121: I. | D121: Respiratory diseases | G121: =RC[9]+RC[18] -> 3937808.1999999993 | H121: 40.299999999999997 | I121: 40309.300000000003 | J121: 12176.8 | K121: 28636.5 | L121: 102218.8 | M121: 182215.3 | N121: 496117.7 | O121: 1285334.8999999999 | P121: =SUM(RC[-8]:RC[-1]) -> 2147049.5999999996 | Q121: 25.5 | R121: 31586.6 | S121: 9977.9 | T121: 22595.7 | U121: 73223.399999999994 | V121: 122066.5 | W121: 333431.09999999998 | X121: 1197851.8999999999 | Y121: =SUM(RC[-8]:RC[-1]) -> 1790758.5999999999
A122: 118 | D122: 1. | E122: Chronic obstructive pulmonary disease | G122: =RC[9]+RC[18] -> 3059315.5 | H122: 17.8 | I122: 14586.2 | J122: 2917.5 | K122: 9235.9 | L122: 55373.4 | M122: 131104.29999999999 | N122: 398797.5 | O122: 1046399.8 | P122: =SUM(RC[-8]:RC[-1]) -> 1658432.4 | Q122: 11.4 | R122: 12060.7 | S122: 2004.4 | T122: 8860.7999999999993 | U122: 42533.5 | V122: 91427 | W122: 272293.90000000002 | X122: 971691.4 | Y122: =SUM(RC[-8]:RC[-1]) -> 1400883.1
A123: 119 | D123: 2. | E123: Asthma | G123: =RC[9]+RC[18] -> 383832.80000000005 | H123: 22.5 | I123: 6271.6 | J123: 5121 | K123: 10238.700000000001 | L123: 25263.8 | M123: 29336.6 | N123: 51417.2 | O123: 91307.5 | P123: =SUM(RC[-8]:RC[-1]) -> 218978.90000000002 | Q123: 14.1 | R123: 5339.4 | S123: 3536.1 | T123: 6817.8 | U123: 17692.099999999999 | V123: 17844.5 | W123: 33188.800000000003 | X123: 80421.100000000006 | Y123: =SUM(RC[-8]:RC[-1]) -> 164853.90000000002
A124: 120 | D124: 3. | E124: Other respiratory diseases | G124: =RC[9]+RC[18] -> 494660 | H124: 0 | I124: 19451.5 | J124: 4138.3 | K124: 9161.9 | L124: 21581.599999999999 | M124: 21774.5 | N124: 45903 | O124: 147627.6 | P124: =SUM(RC[-8]:RC[-1]) -> 269638.40000000002 | Q124: 0 | R124: 14186.5 | S124: 4437.3999999999996 | T124: 6917.1 | U124: 12997.8 | V124: 12795 | W124: 27948.400000000001 | X124: 145739.4 | Y124: =SUM(RC[-8]:RC[-1]) -> 225021.6
A125: 121 | C125: J. | D125: Digestive diseases | G125: =RC[9]+RC[18] -> 2034546.1 | H125: 203.2 | I125: 21240.1 | J125: 25067.7 | K125: 65612.5 | L125: 289948.79999999999 | M125: 221030 | N125: 256458.5 | O125: 339006.7 | P125: =SUM(RC[-8]:RC[-1]) -> 1218567.5 | Q125: 153.4 | R125: 20689 | S125: 25353.5 | T125: 36416.6 | U125: 103603 | V125: 98939.3 | W125: 153283.20000000001 | X125: 377540.6 | Y125: =SUM(RC[-8]:RC[-1]) -> 815978.6
A126: 122 | D126: 1. | E126: Peptic ulcer disease | G126: =RC[9]+RC[18] -> 321507.8 | H126: 0.5 | I126: 2418.6999999999998 | J126: 2842.9 | K126: 12219.9 | L126: 37361.199999999997 | M126: 30797.1 | N126: 41381.699999999997 | O126: 65285.1 | P126: =SUM(RC[-8]:RC[-1]) -> 192307.09999999998 | Q126: 1.1000000000000001 | R126: 2411.9 | S126: 2833 | T126: 8017.5 | U126: 18126.5 | V126: 14839.7 | W126: 24204.3 | X126: 58766.7 | Y126: =SUM(RC[-8]:RC[-1]) -> 129200.7
A127: 123 | D127: 2. | E127: Cirrhosis of the liver | G127: =RC[9]+RC[18] -> 891513.2 | H127: 2.5 | I127: 5047.5 | J127: 5570.2 | K127: 20857.099999999999 | L127: 172444.4 | M127: 137985.5 | N127: 141477.79999999999 | O127: 112142.2 | P127: =SUM(RC[-8]:RC[-1]) -> 595527.19999999995 | Q127: 4.5 | R127: 5315.4 | S127: 6573.8 | T127: 10868.3 | U127: 53291.6 | V127: 52962.2 | W127: 72239.7 | X127: 94730.5 | Y127: =SUM(RC[-8]:RC[-1]) -> 295986
A128: 124 | D128: 3. | E128: Appendicitis | G128: =RC[9]+RC[18] -> 40983.199999999997 | H128: 2.8 | I128: 2100.4 | J128: 3006.9 | K128: 3131.7 | L128: 3981.3 | M128: 2590.1 | N128: 3557.3 | O128: 4906.8 | P128: =SUM(RC[-8]:RC[-1]) -> 23277.3 | Q128: 0.9 | R128: 1427.2 | S128: 2486.6999999999998 | T128: 2023.4 | U128: 2401.1 | V128: 1574.5 | W128: 2496.6999999999998 | X128: 5295.4 | Y128: =SUM(RC[-8]:RC[-1]) -> 17705.900000000001
A129: 125 | E129: Other digestive diseases | G129: =RC[9]+RC[18] -> 780541.5 | H129: 197.3 | I129: 11673.5 | J129: 13647.7 | K129: 29403.8 | L129: 76161.8 | M129: 49657.2 | N129: 70041.7 | O129: 156672.6 | P129: =SUM(RC[-8]:RC[-1]) -> 407455.6 | Q129: 146.80000000000001 | R129: 11534.5 | S129: 13460 | T129: 15507.5 | U129: 29783.9 | V129: 29562.799999999999 | W129: 54342.5 | X129: 218747.9 | Y129: =SUM(RC[-8]:RC[-1]) -> 373085.9
A130: 126 | C130: K. | D130: Genitourinary diseases | G130: =RC[9]+RC[18] -> 900013 | H130: 896.4 | I130: 20873.8 | J130: 14871.9 | K130: 30975.200000000001 | L130: 68921.399999999994 | M130: 56913.599999999999 | N130: 89916.5 | O130: 203625 | P130: =SUM(RC[-8]:RC[-1]) -> 486993.80000000005 | Q130: 493.8 | R130: 14608.5 | S130: 13656.8 | T130: 26487.9 | U130: 53017.5 | V130: 43772.6 | W130: 70528.2 | X130: 190453.9 | Y130: =SUM(RC[-8]:RC[-1]) -> 413019.19999999995
A131: 127 | D131: 1. | E131: Kidney diseases | G131: =RC[9]+RC[18] -> 694146.8 | H131: 44.8 | I131: 17376.099999999999 | J131: 12784 | K131: 26429.3 | L131: 58284.9 | M131: 46695 | N131: 69629.100000000006 | O131: 143433.5 | P131: =SUM(RC[-8]:RC[-1]) -> 374676.7 | Q131: 36.700000000000003 | R131: 13181.2 | S131: 11871.6 | T131: 21338.9 | U131: 42095.8 | V131: 35568.9 | W131: 56563.8 | X131: 138813.20000000001 | Y131: =SUM(RC[-8]:RC[-1]) -> 319470.10000000003
A132: 128 | D132: 2. | E132: Hyperplasia of prostate | G132: =RC[9]+RC[18] -> 8097.3 | H132: 0 | I132: 0 | J132: 0 | K132: 18.5 | L132: 82.3 | M132: 238.5 | N132: 1078.7 | O132: 6679.3 | P132: =SUM(RC[-8]:RC[-1]) -> 8097.3 | Q132: 0 | R132: 0 | S132: 0 | T132: 0 | U132: 0 | V132: 0 | W132: 0 | X132: 0 | Y132: =SUM(RC[-8]:RC[-1]) -> 0
A133: 129 | D133: 3. | E133: Urolithiasis | G133: =RC[9]+RC[18] -> 24882.9 | H133: 0 | I133: 0 | J133: 435.3 | K133: 525.1 | L133: 1697.9 | M133: 1844.8 | N133: 3334 | O133: 7927.5 | P133: =SUM(RC[-8]:RC[-1]) -> 15764.6 | Q133: 0 | R133: 0 | S133: 337 | T133: 365.3 | U133: 1177.5999999999999 | V133: 1031.4000000000001 | W133: 1755.3 | X133: 4451.7 | Y133: =SUM(RC[-8]:RC[-1]) -> 9118.2999999999993
A134: 130 | D134: 4. | E134: Other genitourinary diseases | G134: =RC[9]+RC[18] -> 165906.70000000001 | H134: 851.5 | I134: 3497.6 | J134: 1652.5 | K134: 4002.4 | L134: 8856.2999999999993 | M134: 8135.3 | N134: 15874.7 | O134: 45584.7 | P134: =SUM(RC[-8]:RC[-1]) -> 88455 | Q134: 457.2 | R134: 1427.3 | S134: 1448.2 | T134: 3569.3 | U134: 7232.2 | V134: 6304.9 | W134: 11404.3 | X134: 45608.3 | Y134: =SUM(RC[-8]:RC[-1]) -> 77451.7
A135: 131 | D135: 5. | E135: Infertility | G135: =RC[9]+RC[18] -> 0 | H135: 0 | I135: 0 | J135: 0 | K135: 0 | L135: 0 | M135: 0 | N135: 0 | O135: 0 | P135: =SUM(RC[-8]:RC[-1]) -> 0 | Q135: 0 | R135: 0 | S135: 0 | T135: 0 | U135: 0 | V135: 0 | W135: 0 | X135: 0 | Y135: =SUM(RC[-8]:RC[-1]) -> 0
A136: 132 | D136: 6. | E136: Gynecological diseases | G136: =RC[9]+RC[18] -> 6979.4 | H136: 0 | I136: 0 | J136: 0 | K136: 0 | L136: 0 | M136: 0 | N136: 0 | O136: 0 | P136: =SUM(RC[-8]:RC[-1]) -> 0 | Q136: 0 | R136: 0 | S136: 0 | T136: 1214.4000000000001 | U136: 2511.9 | V136: 867.5 | W136: 804.9 | X136: 1580.7 | Y136: =SUM(RC[-8]:RC[-1]) -> 6979.4
A137: 133 | C137: L. | D137: Skin diseases | G137: =RC[9]+RC[18] -> 95004.400000000009 | H137: 8.6 | I137: 5519.1 | J137: 2065.3000000000002 | K137: 3320.1 | L137: 6070.3 | M137: 4695.2 | N137: 6868.1 | O137: 18662.900000000001 | P137: =SUM(RC[-8]:RC[-1]) -> 47209.600000000006 | Q137: 5.7 | R137: 4918.8999999999996 | S137: 2118.6999999999998 | T137: 3009 | U137: 4447.5 | V137: 3410.5 | W137: 5174 | X137: 24710.5 | Y137: =SUM(RC[-8]:RC[-1]) -> 47794.8
A138: 134 | C138: M. | D138: Musculoskeletal diseases | G138: =RC[9]+RC[18] -> 137634.20000000001 | H138: 12 | I138: 103.8 | J138: 1552.5 | K138: 3740.4 | L138: 6264.3 | M138: 5446 | N138: 8777.4 | O138: 22222.6 | P138: =SUM(RC[-8]:RC[-1]) -> 48119 | Q138: 3.6 | R138: 55.3 | S138: 2058.8000000000002 | T138: 6108.1 | U138: 11116.7 | V138: 8861.7999999999993 | W138: 13610.3 | X138: 47700.6 | Y138: =SUM(RC[-8]:RC[-1]) -> 89515.199999999997
A139: 135 | D139: 1. | E139: Rheumatoid arthritis | G139: =RC[9]+RC[18] -> 47135 | H139: 0 | I139: 0 | J139: 626.1 | K139: 1122.5999999999999 | L139: 2109.1 | M139: 2243.6999999999998 | N139: 4338.2 | O139: 9492.2999999999993 | P139: =SUM(RC[-8]:RC[-1]) -> 19932 | Q139: 0 | R139: 2.2000000000000002 | S139: 653 | T139: 797.4 | U139: 2179.1 | V139: 3260.5 | W139: 5271.2 | X139: 15039.6 | Y139: =SUM(RC[-8]:RC[-1]) -> 27203
A140: 136 | D140: 2. | E140: Osteoarthritis | G140: =RC[9]+RC[18] -> 3516.3 | H140: 0.4 | I140: 2.2000000000000002 | J140: 1.1000000000000001 | K140: 0.3 | L140: 11.6 | M140: 31.1 | N140: 73.7 | O140: 852.6 | P140: =SUM(RC[-8]:RC[-1]) -> 973 | Q140: 0 | R140: 0 | S140: 0 | T140: 1.1000000000000001 | U140: 8.5 | V140: 31.2 | W140: 109.1 | X140: 2393.4 | Y140: =SUM(RC[-8]:RC[-1]) -> 2543.3000000000002
A141: 137 | D141: 3. | E141: Gout | G141: =RC[9]+RC[18] -> 316.10000000000002 | H141: 0.1 | I141: 0.5 | J141: 0 | K141: 0 | L141: 30.4 | M141: 25.9 | N141: 44.3 | O141: 129.9 | P141: =SUM(RC[-8]:RC[-1]) -> 231.1 | Q141: 0 | R141: 0 | S141: 0 | T141: 0 | U141: 0 | V141: 5 | W141: 3 | X141: 77 | Y141: =SUM(RC[-8]:RC[-1]) -> 85
A142: 138 | D142: 4. | E142: Back and neck pain | G142: =RC[9]+RC[18] -> 1910 | H142: 0.3 | I142: 1.4 | J142: 2 | K142: 5.8 | L142: 50.8 | M142: 97.3 | N142: 189.3 | O142: 659.4 | P142: =SUM(RC[-8]:RC[-1]) -> 1006.3 | Q142: 0.1 | R142: 0.7 | S142: 0 | T142: 2.2000000000000002 | U142: 22.4 | V142: 40.1 | W142: 94.8 | X142: 743.4 | Y142: =SUM(RC[-8]:RC[-1]) -> 903.7
A143: 139 | E143: Other musculoskeletal disorders | G143: =RC[9]+RC[18] -> 84756.7 | H143: 11.4 | I143: 99.7 | J143: 923.4 | K143: 2611.6 | L143: 4062.4 | M143: 3048 | N143: 4131.8 | O143: 11088.4 | P143: =SUM(RC[-8]:RC[-1]) -> 25976.699999999997 | Q143: 3.4 | R143: 52.4 | S143: 1405.8 | T143: 5307.5 | U143: 8906.7000000000007 | V143: 5525 | W143: 8132.1 | X143: 29447.1 | Y143: =SUM(RC[-8]:RC[-1]) -> 58780
A144: 140 | C144: N. | D144: Congenital anomalies | G144: =RC[9]+RC[18] -> 587902.70000000007 | H144: 149796.20000000001 | I144: 107708.1 | J144: 22035.3 | K144: 13418.8 | L144: 7428.7 | M144: 2718.2 | N144: 3157.4 | O144: 6471 | P144: =SUM(RC[-8]:RC[-1]) -> 312733.70000000007 | Q144: 127088.6 | R144: 97890.5 | S144: 19011.5 | T144: 12306.7 | U144: 6171.4 | V144: 2625.4 | W144: 2889.8 | X144: 7185.1 | Y144: =SUM(RC[-8]:RC[-1]) -> 275169
A145: 141 | D145: 1. | E145: Neural tube defects | G145: =RC[9]+RC[18] -> 110095.09999999999 | H145: 38544.6 | I145: 13715.7 | J145: 2392.6999999999998 | K145: 896 | L145: 473.1 | M145: 124.5 | N145: 142.5 | O145: 250.1 | P145: =SUM(RC[-8]:RC[-1]) -> 56539.199999999997 | Q145: 34927.9 | R145: 14192.8 | S145: 2398.6 | T145: 1102.5999999999999 | U145: 404.6 | V145: 111 | W145: 127.8 | X145: 290.60000000000002 | Y145: =SUM(RC[-8]:RC[-1]) -> 53555.899999999994
A146: 142 | D146: 2. | E146: Cleft lip and cleft palate | G146: =RC[9]+RC[18] -> 6081.8 | H146: 2432.1 | I146: 2136.5 | J146: 1.4 | K146: 0 | L146: 0.9 | M146: 0 | N146: 0 | O146: 4.8 | P146: =SUM(RC[-8]:RC[-1]) -> 4575.7 | Q146: 890.2 | R146: 613.6 | S146: 0 | T146: 1.2 | U146: 1.1000000000000001 | V146: 0 | W146: 0 | X146: 0 | Y146: =SUM(RC[-8]:RC[-1]) -> 1506.1000000000001
A147: 143 | D147: 3. | E147: Down's syndrome | G147: =RC[9]+RC[18] -> 20158 | H147: 2416.6999999999998 | I147: 3452.8 | J147: 834.4 | K147: 709.9 | L147: 678.3 | M147: 503.7 | N147: 272.3 | O147: 53.6 | P147: =SUM(RC[-8]:RC[-1]) -> 8921.6999999999989 | Q147: 3082 | R147: 4738.7 | S147: 1032.0999999999999 | T147: 754.1 | U147: 695.4 | V147: 514.20000000000005 | W147: 343.1 | X147: 76.7 | Y147: =SUM(RC[-8]:RC[-1]) -> 11236.300000000001
A148: 144 | D148: 4. | E148: Congenital heart anomalies | G148: =RC[9]+RC[18] -> 233631.40000000002 | H148: 55700.2 | I148: 43065.3 | J148: 10269.9 | K148: 8305.6 | L148: 3797.5 | M148: 959.4 | N148: 1244.5999999999999 | O148: 3218.5 | P148: =SUM(RC[-8]:RC[-1]) -> 126561 | Q148: 45433.9 | R148: 36469.199999999997 | S148: 8447.2999999999993 | T148: 7324.9 | U148: 3298 | V148: 925.2 | W148: 1118.3 | X148: 4053.6 | Y148: =SUM(RC[-8]:RC[-1]) -> 107070.40000000001
A149: 145 | D149: 5. | E149: Other chromosomal anomalies | G149: =RC[9]+RC[18] -> 25592.199999999997 | H149: 6906.1 | I149: 3365.4 | J149: 613 | K149: 304.2 | L149: 178.5 | M149: 58.7 | N149: 77.900000000000006 | O149: 56 | P149: =SUM(RC[-8]:RC[-1]) -> 11559.800000000001 | Q149: 7294.6 | R149: 5155.2 | S149: 751.4 | T149: 412.5 | U149: 162.9 | V149: 68.599999999999994 | W149: 110.4 | X149: 76.8 | Y149: =SUM(RC[-8]:RC[-1]) -> 14032.399999999998
A150: 146 | D150: 6. | E150: Other congenital anomalies | G150: =RC[9]+RC[18] -> 192344 | H150: 43796.4 | I150: 41972.3 | J150: 7923.9 | K150: 3203.1 | L150: 2300.4 | M150: 1071.8 | N150: 1420.2 | O150: 2888 | P150: =SUM(RC[-8]:RC[-1]) -> 104576.1 | Q150: 35459.9 | R150: 36721 | S150: 6382 | T150: 2711.4 | U150: 1609.5 | V150: 1006.4 | W150: 1190.2 | X150: 2687.5 | Y150: =SUM(RC[-8]:RC[-1]) -> 87767.89999999998
A151: 147 | C151: O. | D151: Oral conditions | G151: =RC[9]+RC[18] -> 901.2 | H151: 0.2 | I151: 10.1 | J151: 3.4 | K151: 14.4 | L151: 54.1 | M151: 70.900000000000006 | N151: 55.6 | O151: 179 | P151: =SUM(RC[-8]:RC[-1]) -> 387.70000000000005 | Q151: 2.2999999999999998 | R151: 6.5 | S151: 0 | T151: 15 | U151: 33.200000000000003 | V151: 61.9 | W151: 104.4 | X151: 290.2 | Y151: =SUM(RC[-8]:RC[-1]) -> 513.5
A152: 148 | D152: 1. | E152: Dental caries | G152: =RC[9]+RC[18] -> 464.29999999999995 | H152: 0.2 | I152: 10.1 | J152: 3.4 | K152: 11.2 | L152: 53.1 | M152: 28.8 | N152: 19.8 | O152: 78.3 | P152: =SUM(RC[-8]:RC[-1]) -> 204.89999999999998 | Q152: 2.2999999999999998 | R152: 6.5 | S152: 0 | T152: 11.7 | U152: 28.7 | V152: 8.1 | W152: 17.2 | X152: 184.9 | Y152: =SUM(RC[-8]:RC[-1]) -> 259.39999999999998
A153: 149 | D153: 2. | E153: Periodontal disease | G153: =RC[9]+RC[18] -> 28.900000000000002 | H153: 0 | I153: 0 | J153: 0 | K153: 3.2 | L153: 1 | M153: 4.2 | N153: 2.2000000000000002 | O153: 3.3 | P153: =SUM(RC[-8]:RC[-1]) -> 13.900000000000002 | Q153: 0 | R153: 0 | S153: 0 | T153: 3.3 | U153: 4.5 | V153: 1.1000000000000001 | W153: 1 | X153: 5.0999999999999996 | Y153: =SUM(RC[-8]:RC[-1]) -> 15
A154: 150 | D154: 3. | E154: Edentulism | G154: =RC[9]+RC[18] -> 407.90000000000003 | H154: 0 | I154: 0 | J154: 0 | K154: 0 | L154: 0 | M154: 37.9 | N154: 33.6 | O154: 97.3 | P154: =SUM(RC[-8]:RC[-1]) -> 168.8 | Q154: 0 | R154: 0 | S154: 0 | T154: 0 | U154: 0 | V154: 52.7 | W154: 86.2 | X154: 100.2 | Y154: =SUM(RC[-8]:RC[-1]) -> 239.10000000000002
A155: 151 | B155: III. | C155: Injuries | G155: =RC[9]+RC[18] -> 5026125 | H155: 25721.8 | I155: 239640.7 | J155: 268277.7 | K155: 934275 | L155: 969621.8 | M155: 304259.8 | N155: 259699.4 | O155: 328260.09999999998 | P155: =SUM(RC[-8]:RC[-1]) -> 3329756.3 | Q155: 23597 | R155: 190877.2 | S155: 176579 | T155: 367073.2 | U155: 318592.5 | V155: 124771 | W155: 148666.20000000001 | X155: 346212.6 | Y155: =SUM(RC[-8]:RC[-1]) -> 1696368.6999999997
A156: 152 | C156: A. | D156: Unintentional injuries | G156: =RC[9]+RC[18] -> 3530613.1999999997 | H156: 23262.1 | I156: 231598.1 | J156: 236861.1 | K156: 556297.1 | L156: 606686.4 | M156: 204360.5 | N156: 184865.7 | O156: 257574.8 | P156: =SUM(RC[-8]:RC[-1]) -> 2301505.7999999998 | Q156: 20502.3 | R156: 183030.3 | S156: 153355.1 | T156: 196929.4 | U156: 187794.5 | V156: 85013.9 | W156: 110568.6 | X156: 291913.3 | Y156: =SUM(RC[-8]:RC[-1]) -> 1229107.3999999999
A157: 153 | D157: 1. | E157: Road injury | G157: =RC[9]+RC[18] -> 1022261.4999999999 | H157: 1362.3 | I157: 32288.9 | J157: 52749.599999999999 | K157: 242521.2 | L157: 241965 | M157: 68598.2 | N157: 54733.2 | O157: 56298 | P157: =SUM(RC[-8]:RC[-1]) -> 750516.39999999991 | Q157: 1436.8 | R157: 24462.7 | S157: 31876.2 | T157: 62309.3 | U157: 62700.6 | V157: 25406.1 | W157: 26659.3 | X157: 36894.1 | Y157: =SUM(RC[-8]:RC[-1]) -> 271745.09999999998
A158: 154 | D158: 2. | E158: Poisonings | G158: =RC[9]+RC[18] -> 254774.39999999999 | H158: 1772.1 | I158: 16036.3 | J158: 10346.9 | K158: 36157 | L158: 51677.9 | M158: 17131.8 | N158: 13330.9 | O158: 11096.4 | P158: =SUM(RC[-8]:RC[-1]) -> 157549.29999999999 | Q158: 1287 | R158: 12134 | S158: 10572.6 | T158: 24741.599999999999 | U158: 23547.9 | V158: 7891.5 | W158: 7024.5 | X158: 10026 | Y158: =SUM(RC[-8]:RC[-1]) -> 97225.1
A159: 155 | D159: 3. | E159: Falls | G159: =RC[9]+RC[18] -> 526586.30000000005 | H159: 1737.6 | I159: 21681.8 | J159: 20844.099999999999 | K159: 34699.4 | L159: 56000.3 | M159: 29093 | N159: 39246.400000000001 | O159: 89843.3 | P159: =SUM(RC[-8]:RC[-1]) -> 293145.90000000002 | Q159: 1644.3 | R159: 15480.5 | S159: 13091.2 | T159: 10529.2 | U159: 15136.3 | V159: 13741.2 | W159: 31588.400000000001 | X159: 132229.29999999999 | Y159: =SUM(RC[-8]:RC[-1]) -> 233440.4
A160: 156 | D160: 4. | E160: Fire, heat and hot substances | G160: =RC[9]+RC[18] -> 268941.09999999998 | H160: 1555.8 | I160: 35766.300000000003 | J160: 18504.2 | K160: 23819.8 | L160: 26757.200000000001 | M160: 9494.1 | N160: 8721.7000000000007 | O160: 12435.3 | P160: =SUM(RC[-8]:RC[-1]) -> 137054.39999999999 | Q160: 1771.3 | R160: 31646 | S160: 18795.400000000001 | T160: 31566.2 | U160: 19060.5 | V160: 6105.4 | W160: 7475 | X160: 15466.9 | Y160: =SUM(RC[-8]:RC[-1]) -> 131886.70000000001
A161: 157 | D161: 5. | E161: Drowning | G161: =RC[9]+RC[18] -> 442179.80000000005 | H161: 1307.2 | I161: 57557.4 | J161: 71266.399999999994 | K161: 72251 | L161: 54091.7 | M161: 16933.900000000001 | N161: 14120 | O161: 13654.3 | P161: =SUM(RC[-8]:RC[-1]) -> 301181.90000000002 | Q161: 923.3 | R161: 39605.300000000003 | S161: 35832.800000000003 | T161: 21741.1 | U161: 15646.4 | V161: 6318.2 | W161: 6861.5 | X161: 14069.3 | Y161: =SUM(RC[-8]:RC[-1]) -> 140997.9
A162: 158 | D162: 6. | E162: Exposure to forces of nature | G162: =RC[9]+RC[18] -> 1297.6999999999998 | H162: 1.1000000000000001 | I162: 66.599999999999994 | J162: 110.2 | K162: 168.4 | L162: 178.7 | M162: 79 | N162: 63.9 | O162: 60 | P162: =SUM(RC[-8]:RC[-1]) -> 727.9 | Q162: 1.2 | R162: 68.599999999999994 | S162: 91.2 | T162: 99.9 | U162: 119.9 | V162: 63 | W162: 59.3 | X162: 66.7 | Y162: =SUM(RC[-8]:RC[-1]) -> 569.79999999999995
A163: 159 | D163: 7. | E163: Other unintentional injuries | G163: =RC[9]+RC[18] -> 1014572.2999999999 | H163: 15525.9 | I163: 68200.800000000003 | J163: 63039.6 | K163: 146680.4 | L163: 176015.5 | M163: 63030.5 | N163: 54649.7 | O163: 74187.5 | P163: =SUM(RC[-8]:RC[-1]) -> 661329.89999999991 | Q163: 13438.5 | R163: 59633.3 | S163: 43095.8 | T163: 45941.9 | U163: 51582.9 | V163: 25488.5 | W163: 30900.5 | X163: 83161 | Y163: =SUM(RC[-8]:RC[-1]) -> 353242.4
A164: 160 | C164: B. | D164: Intentional injuries | G164: =RC[9]+RC[18] -> 1495511.8 | H164: 2459.6999999999998 | I164: 8042.6 | J164: 31416.6 | K164: 377977.9 | L164: 362935.4 | M164: 99899.3 | N164: 74833.7 | O164: 70685.3 | P164: =SUM(RC[-8]:RC[-1]) -> 1028250.5000000001 | Q164: 3094.8 | R164: 7846.9 | S164: 23224 | T164: 170143.8 | U164: 130797.9 | V164: 39757.1 | W164: 38097.599999999999 | X164: 54299.199999999997 | Y164: =SUM(RC[-8]:RC[-1]) -> 467261.3
A165: 161 | D165: 1. | E165: Self-harm | G165: =RC[9]+RC[18] -> 883488.7 | H165: 0 | I165: 0 | J165: 9809 | K165: 156855.79999999999 | L165: 184942.3 | M165: 66349.100000000006 | N165: 57338.2 | O165: 60646.5 | P165: =SUM(RC[-8]:RC[-1]) -> 535940.89999999991 | Q165: 0 | R165: 0 | S165: 9574.9 | T165: 131298.70000000001 | U165: 97387 | V165: 31711.9 | W165: 31321.599999999999 | X165: 46253.7 | Y165: =SUM(RC[-8]:RC[-1]) -> 347547.8
A166: 162 | D166: 2. | E166: Interpersonal violence | G166: =RC[9]+RC[18] -> 489650.4 | H166: 2446.8000000000002 | I166: 7286.8 | J166: 12412.6 | K166: 172490.7 | L166: 144038.70000000001 | M166: 28451.5 | N166: 14818.1 | O166: 8875.2000000000007 | P166: =SUM(RC[-8]:RC[-1]) -> 390820.4 | Q166: 3081 | R166: 7074.9 | S166: 9184.2999999999993 | T166: 30933.5 | U166: 28367.3 | V166: 6727.4 | W166: 5959.2 | X166: 7502.4 | Y166: =SUM(RC[-8]:RC[-1]) -> 98829.999999999985
A167: 163 | D167: 3. | E167: Collective violence and legal intervention | G167: =RC[9]+RC[18] -> 122372.7 | H167: 12.9 | I167: 755.8 | J167: 9195 | K167: 48631.5 | L167: 33954.400000000001 | M167: 5098.7 | N167: 2677.5 | O167: 1163.5 | P167: =SUM(RC[-8]:RC[-1]) -> 101489.3 | Q167: 13.7 | R167: 772 | S167: 4464.8 | T167: 7911.6 | U167: 5043.7 | V167: 1317.7 | W167: 816.8 | X167: 543.1 | Y167: =SUM(RC[-8]:RC[-1]) -> 20883.399999999998